
         /\      Grafana   /‾‾/  
    /\  /  \     |\  __   /  /   
   /  \/    \    | |/ /  /   ‾‾\ 
  /          \   |   (  |  (‾)  |
 / __________ \  |_|\_\  \_____/ 

     execution: local
        script: /home/edilberto/pspd/atividade-final-pspd/load/ramp.js
        output: json (/home/edilberto/pspd/atividade-final-pspd/results/ramp/metrics.json)

     scenarios: (100.00%) 1 scenario, 150 max VUs, 4m30s max duration (incl. graceful stop):
              * default: Up to 150 looping VUs for 4m0s over 5 stages (gracefulRampDown: 30s, gracefulStop: 30s)


running (0m01.0s), 001/150 VUs, 1 complete and 0 interrupted iterations
default   [   0% ] 001/150 VUs  0m01.0s/4m00.0s

running (0m02.0s), 001/150 VUs, 2 complete and 0 interrupted iterations
default   [   1% ] 001/150 VUs  0m02.0s/4m00.0s

running (0m02.9s), 001/150 VUs, 4 complete and 0 interrupted iterations
default   [   1% ] 001/150 VUs  0m03.0s/4m00.0s

running (0m03.9s), 002/150 VUs, 6 complete and 0 interrupted iterations
default   [   2% ] 002/150 VUs  0m04.0s/4m00.0s

running (0m04.9s), 002/150 VUs, 9 complete and 0 interrupted iterations
default   [   2% ] 002/150 VUs  0m05.0s/4m00.0s

running (0m05.9s), 002/150 VUs, 13 complete and 0 interrupted iterations
default   [   2% ] 002/150 VUs  0m06.0s/4m00.0s

running (0m06.9s), 003/150 VUs, 16 complete and 0 interrupted iterations
default   [   3% ] 003/150 VUs  0m07.0s/4m00.0s

running (0m07.9s), 003/150 VUs, 21 complete and 0 interrupted iterations
default   [   3% ] 003/150 VUs  0m08.0s/4m00.0s

running (0m08.9s), 003/150 VUs, 26 complete and 0 interrupted iterations
default   [   4% ] 003/150 VUs  0m09.0s/4m00.0s

running (0m09.9s), 003/150 VUs, 30 complete and 0 interrupted iterations
default   [   4% ] 003/150 VUs  0m10.0s/4m00.0s

running (0m10.9s), 004/150 VUs, 36 complete and 0 interrupted iterations
default   [   5% ] 004/150 VUs  0m11.0s/4m00.0s

running (0m11.9s), 004/150 VUs, 43 complete and 0 interrupted iterations
default   [   5% ] 004/150 VUs  0m12.0s/4m00.0s

running (0m12.9s), 004/150 VUs, 49 complete and 0 interrupted iterations
default   [   5% ] 004/150 VUs  0m13.0s/4m00.0s

running (0m13.9s), 005/150 VUs, 57 complete and 0 interrupted iterations
default   [   6% ] 005/150 VUs  0m14.0s/4m00.0s

running (0m14.9s), 005/150 VUs, 65 complete and 0 interrupted iterations
default   [   6% ] 005/150 VUs  0m15.0s/4m00.0s

running (0m15.9s), 005/150 VUs, 73 complete and 0 interrupted iterations
default   [   7% ] 005/150 VUs  0m16.0s/4m00.0s

running (0m16.9s), 006/150 VUs, 81 complete and 0 interrupted iterations
default   [   7% ] 006/150 VUs  0m17.0s/4m00.0s

running (0m17.9s), 006/150 VUs, 90 complete and 0 interrupted iterations
default   [   7% ] 006/150 VUs  0m18.0s/4m00.0s

running (0m18.9s), 006/150 VUs, 100 complete and 0 interrupted iterations
default   [   8% ] 006/150 VUs  0m19.0s/4m00.0s

running (0m19.9s), 006/150 VUs, 110 complete and 0 interrupted iterations
default   [   8% ] 006/150 VUs  0m20.0s/4m00.0s

running (0m20.9s), 007/150 VUs, 120 complete and 0 interrupted iterations
default   [   9% ] 007/150 VUs  0m21.0s/4m00.0s

running (0m21.9s), 007/150 VUs, 132 complete and 0 interrupted iterations
default   [   9% ] 007/150 VUs  0m22.0s/4m00.0s

running (0m22.9s), 007/150 VUs, 144 complete and 0 interrupted iterations
default   [  10% ] 007/150 VUs  0m23.0s/4m00.0s

running (0m23.9s), 008/150 VUs, 155 complete and 0 interrupted iterations
default   [  10% ] 008/150 VUs  0m24.0s/4m00.0s

running (0m24.9s), 008/150 VUs, 169 complete and 0 interrupted iterations
default   [  10% ] 008/150 VUs  0m25.0s/4m00.0s

running (0m25.9s), 008/150 VUs, 181 complete and 0 interrupted iterations
default   [  11% ] 008/150 VUs  0m26.0s/4m00.0s

running (0m26.9s), 009/150 VUs, 194 complete and 0 interrupted iterations
default   [  11% ] 009/150 VUs  0m27.0s/4m00.0s

running (0m27.9s), 009/150 VUs, 210 complete and 0 interrupted iterations
default   [  12% ] 009/150 VUs  0m28.0s/4m00.0s

running (0m28.9s), 009/150 VUs, 223 complete and 0 interrupted iterations
default   [  12% ] 009/150 VUs  0m29.0s/4m00.0s

running (0m29.9s), 009/150 VUs, 238 complete and 0 interrupted iterations
default   [  12% ] 009/150 VUs  0m30.0s/4m00.0s

running (0m30.9s), 010/150 VUs, 254 complete and 0 interrupted iterations
default   [  13% ] 010/150 VUs  0m31.0s/4m00.0s

running (0m31.9s), 011/150 VUs, 270 complete and 0 interrupted iterations
default   [  13% ] 011/150 VUs  0m32.0s/4m00.0s

running (0m32.9s), 011/150 VUs, 289 complete and 0 interrupted iterations
default   [  14% ] 011/150 VUs  0m33.0s/4m00.0s

running (0m33.9s), 012/150 VUs, 305 complete and 0 interrupted iterations
default   [  14% ] 012/150 VUs  0m34.0s/4m00.0s

running (0m34.9s), 013/150 VUs, 326 complete and 0 interrupted iterations
default   [  15% ] 013/150 VUs  0m35.0s/4m00.0s

running (0m35.9s), 013/150 VUs, 347 complete and 0 interrupted iterations
default   [  15% ] 013/150 VUs  0m36.0s/4m00.0s

running (0m36.9s), 014/150 VUs, 369 complete and 0 interrupted iterations
default   [  15% ] 014/150 VUs  0m37.0s/4m00.0s

running (0m37.9s), 015/150 VUs, 392 complete and 0 interrupted iterations
default   [  16% ] 015/150 VUs  0m38.0s/4m00.0s

running (0m38.9s), 015/150 VUs, 417 complete and 0 interrupted iterations
default   [  16% ] 015/150 VUs  0m39.0s/4m00.0s

running (0m39.9s), 016/150 VUs, 441 complete and 0 interrupted iterations
default   [  17% ] 016/150 VUs  0m40.0s/4m00.0s

running (0m40.9s), 017/150 VUs, 470 complete and 0 interrupted iterations
default   [  17% ] 017/150 VUs  0m41.0s/4m00.0s

running (0m41.9s), 017/150 VUs, 495 complete and 0 interrupted iterations
default   [  17% ] 017/150 VUs  0m42.0s/4m00.0s

running (0m42.9s), 018/150 VUs, 523 complete and 0 interrupted iterations
default   [  18% ] 018/150 VUs  0m43.0s/4m00.0s

running (0m43.9s), 019/150 VUs, 554 complete and 0 interrupted iterations
default   [  18% ] 019/150 VUs  0m44.0s/4m00.0s

running (0m44.9s), 019/150 VUs, 585 complete and 0 interrupted iterations
default   [  19% ] 019/150 VUs  0m45.0s/4m00.0s

running (0m45.9s), 020/150 VUs, 616 complete and 0 interrupted iterations
default   [  19% ] 020/150 VUs  0m46.0s/4m00.0s

running (0m46.9s), 021/150 VUs, 650 complete and 0 interrupted iterations
default   [  20% ] 021/150 VUs  0m47.0s/4m00.0s

running (0m47.9s), 021/150 VUs, 683 complete and 0 interrupted iterations
default   [  20% ] 021/150 VUs  0m48.0s/4m00.0s

running (0m48.9s), 022/150 VUs, 720 complete and 0 interrupted iterations
default   [  20% ] 022/150 VUs  0m49.0s/4m00.0s

running (0m49.9s), 023/150 VUs, 754 complete and 0 interrupted iterations
default   [  21% ] 023/150 VUs  0m50.0s/4m00.0s

running (0m50.9s), 023/150 VUs, 792 complete and 0 interrupted iterations
default   [  21% ] 023/150 VUs  0m51.0s/4m00.0s

running (0m51.9s), 024/150 VUs, 830 complete and 0 interrupted iterations
default   [  22% ] 024/150 VUs  0m52.0s/4m00.0s

running (0m52.9s), 025/150 VUs, 870 complete and 0 interrupted iterations
default   [  22% ] 025/150 VUs  0m53.0s/4m00.0s

running (0m53.9s), 025/150 VUs, 910 complete and 0 interrupted iterations
default   [  22% ] 025/150 VUs  0m54.0s/4m00.0s

running (0m54.9s), 026/150 VUs, 952 complete and 0 interrupted iterations
default   [  23% ] 026/150 VUs  0m55.0s/4m00.0s

running (0m55.9s), 027/150 VUs, 994 complete and 0 interrupted iterations
default   [  23% ] 027/150 VUs  0m56.0s/4m00.0s

running (0m56.9s), 027/150 VUs, 1041 complete and 0 interrupted iterations
default   [  24% ] 027/150 VUs  0m57.0s/4m00.0s

running (0m57.9s), 028/150 VUs, 1082 complete and 0 interrupted iterations
default   [  24% ] 028/150 VUs  0m58.0s/4m00.0s

running (0m58.9s), 029/150 VUs, 1129 complete and 0 interrupted iterations
default   [  25% ] 029/150 VUs  0m59.0s/4m00.0s

running (0m59.9s), 029/150 VUs, 1175 complete and 0 interrupted iterations
default   [  25% ] 029/150 VUs  1m00.0s/4m00.0s

running (1m00.9s), 030/150 VUs, 1224 complete and 0 interrupted iterations
default   [  25% ] 030/150 VUs  1m01.0s/4m00.0s

running (1m01.9s), 031/150 VUs, 1272 complete and 0 interrupted iterations
default   [  26% ] 031/150 VUs  1m02.0s/4m00.0s

running (1m02.9s), 031/150 VUs, 1324 complete and 0 interrupted iterations
default   [  26% ] 031/150 VUs  1m03.0s/4m00.0s

running (1m03.9s), 032/150 VUs, 1374 complete and 0 interrupted iterations
default   [  27% ] 032/150 VUs  1m04.0s/4m00.0s

running (1m04.9s), 033/150 VUs, 1423 complete and 0 interrupted iterations
default   [  27% ] 033/150 VUs  1m05.0s/4m00.0s

running (1m05.9s), 033/150 VUs, 1479 complete and 0 interrupted iterations
default   [  27% ] 033/150 VUs  1m06.0s/4m00.0s

running (1m06.9s), 034/150 VUs, 1531 complete and 0 interrupted iterations
default   [  28% ] 034/150 VUs  1m07.0s/4m00.0s

running (1m07.9s), 035/150 VUs, 1588 complete and 0 interrupted iterations
default   [  28% ] 035/150 VUs  1m08.0s/4m00.0s

running (1m08.9s), 035/150 VUs, 1644 complete and 0 interrupted iterations
default   [  29% ] 035/150 VUs  1m09.0s/4m00.0s

running (1m09.9s), 036/150 VUs, 1697 complete and 0 interrupted iterations
default   [  29% ] 036/150 VUs  1m10.0s/4m00.0s

running (1m10.9s), 037/150 VUs, 1758 complete and 0 interrupted iterations
default   [  30% ] 037/150 VUs  1m11.0s/4m00.0s

running (1m11.9s), 037/150 VUs, 1817 complete and 0 interrupted iterations
default   [  30% ] 037/150 VUs  1m12.0s/4m00.0s

running (1m12.9s), 038/150 VUs, 1878 complete and 0 interrupted iterations
default   [  30% ] 038/150 VUs  1m13.0s/4m00.0s

running (1m13.9s), 039/150 VUs, 1941 complete and 0 interrupted iterations
default   [  31% ] 039/150 VUs  1m14.0s/4m00.0s

running (1m14.9s), 039/150 VUs, 2000 complete and 0 interrupted iterations
default   [  31% ] 039/150 VUs  1m15.0s/4m00.0s

running (1m15.9s), 040/150 VUs, 2066 complete and 0 interrupted iterations
default   [  32% ] 040/150 VUs  1m16.0s/4m00.0s

running (1m16.9s), 041/150 VUs, 2130 complete and 0 interrupted iterations
default   [  32% ] 041/150 VUs  1m17.0s/4m00.0s

running (1m17.9s), 041/150 VUs, 2199 complete and 0 interrupted iterations
default   [  32% ] 041/150 VUs  1m18.0s/4m00.0s

running (1m18.9s), 042/150 VUs, 2266 complete and 0 interrupted iterations
default   [  33% ] 042/150 VUs  1m19.0s/4m00.0s

running (1m19.9s), 043/150 VUs, 2325 complete and 0 interrupted iterations
default   [  33% ] 043/150 VUs  1m20.0s/4m00.0s

running (1m20.9s), 043/150 VUs, 2398 complete and 0 interrupted iterations
default   [  34% ] 043/150 VUs  1m21.0s/4m00.0s

running (1m21.9s), 044/150 VUs, 2465 complete and 0 interrupted iterations
default   [  34% ] 044/150 VUs  1m22.0s/4m00.0s

running (1m22.9s), 045/150 VUs, 2536 complete and 0 interrupted iterations
default   [  35% ] 045/150 VUs  1m23.0s/4m00.0s

running (1m23.9s), 045/150 VUs, 2609 complete and 0 interrupted iterations
default   [  35% ] 045/150 VUs  1m24.0s/4m00.0s

running (1m24.9s), 046/150 VUs, 2679 complete and 0 interrupted iterations
default   [  35% ] 046/150 VUs  1m25.0s/4m00.0s

running (1m25.9s), 047/150 VUs, 2757 complete and 0 interrupted iterations
default   [  36% ] 047/150 VUs  1m26.0s/4m00.0s

running (1m26.9s), 047/150 VUs, 2834 complete and 0 interrupted iterations
default   [  36% ] 047/150 VUs  1m27.0s/4m00.0s

running (1m27.9s), 048/150 VUs, 2911 complete and 0 interrupted iterations
default   [  37% ] 048/150 VUs  1m28.0s/4m00.0s

running (1m28.9s), 049/150 VUs, 2979 complete and 0 interrupted iterations
default   [  37% ] 049/150 VUs  1m29.0s/4m00.0s

running (1m29.9s), 049/150 VUs, 3057 complete and 0 interrupted iterations
default   [  37% ] 049/150 VUs  1m30.0s/4m00.0s

running (1m30.9s), 050/150 VUs, 3135 complete and 0 interrupted iterations
default   [  38% ] 050/150 VUs  1m31.0s/4m00.0s

running (1m31.9s), 051/150 VUs, 3216 complete and 0 interrupted iterations
default   [  38% ] 051/150 VUs  1m32.0s/4m00.0s

running (1m32.9s), 052/150 VUs, 3293 complete and 0 interrupted iterations
default   [  39% ] 052/150 VUs  1m33.0s/4m00.0s

running (1m33.9s), 053/150 VUs, 3376 complete and 0 interrupted iterations
default   [  39% ] 053/150 VUs  1m34.0s/4m00.0s

running (1m34.9s), 054/150 VUs, 3458 complete and 0 interrupted iterations
default   [  40% ] 054/150 VUs  1m35.0s/4m00.0s

running (1m35.9s), 054/150 VUs, 3544 complete and 0 interrupted iterations
default   [  40% ] 054/150 VUs  1m36.0s/4m00.0s

running (1m36.9s), 055/150 VUs, 3628 complete and 0 interrupted iterations
default   [  40% ] 055/150 VUs  1m37.0s/4m00.0s

running (1m37.9s), 056/150 VUs, 3708 complete and 0 interrupted iterations
default   [  41% ] 056/150 VUs  1m38.0s/4m00.0s

running (1m38.9s), 057/150 VUs, 3802 complete and 0 interrupted iterations
default   [  41% ] 057/150 VUs  1m39.0s/4m00.0s

running (1m39.9s), 058/150 VUs, 3892 complete and 0 interrupted iterations
default   [  42% ] 058/150 VUs  1m40.0s/4m00.0s

running (1m40.9s), 059/150 VUs, 3976 complete and 0 interrupted iterations
default   [  42% ] 059/150 VUs  1m41.0s/4m00.0s

running (1m41.9s), 059/150 VUs, 4069 complete and 0 interrupted iterations
default   [  42% ] 059/150 VUs  1m42.0s/4m00.0s

running (1m42.9s), 060/150 VUs, 4152 complete and 0 interrupted iterations
default   [  43% ] 060/150 VUs  1m43.0s/4m00.0s

running (1m43.9s), 061/150 VUs, 4234 complete and 0 interrupted iterations
default   [  43% ] 061/150 VUs  1m44.0s/4m00.0s

running (1m44.9s), 062/150 VUs, 4324 complete and 0 interrupted iterations
default   [  44% ] 062/150 VUs  1m45.0s/4m00.0s

running (1m45.9s), 063/150 VUs, 4414 complete and 0 interrupted iterations
default   [  44% ] 063/150 VUs  1m46.0s/4m00.0s

running (1m46.9s), 064/150 VUs, 4499 complete and 0 interrupted iterations
default   [  45% ] 064/150 VUs  1m47.0s/4m00.0s

running (1m47.9s), 064/150 VUs, 4574 complete and 0 interrupted iterations
default   [  45% ] 064/150 VUs  1m48.0s/4m00.0s

running (1m48.9s), 065/150 VUs, 4668 complete and 0 interrupted iterations
default   [  45% ] 065/150 VUs  1m49.0s/4m00.0s

running (1m49.9s), 066/150 VUs, 4759 complete and 0 interrupted iterations
default   [  46% ] 066/150 VUs  1m50.0s/4m00.0s

running (1m50.9s), 067/150 VUs, 4854 complete and 0 interrupted iterations
default   [  46% ] 067/150 VUs  1m51.0s/4m00.0s

running (1m51.9s), 068/150 VUs, 4947 complete and 0 interrupted iterations
default   [  47% ] 068/150 VUs  1m52.0s/4m00.0s

running (1m52.9s), 069/150 VUs, 5040 complete and 0 interrupted iterations
default   [  47% ] 069/150 VUs  1m53.0s/4m00.0s

running (1m53.9s), 069/150 VUs, 5125 complete and 0 interrupted iterations
default   [  47% ] 069/150 VUs  1m54.0s/4m00.0s

running (1m54.9s), 070/150 VUs, 5211 complete and 0 interrupted iterations
default   [  48% ] 070/150 VUs  1m55.0s/4m00.0s

running (1m55.9s), 071/150 VUs, 5305 complete and 0 interrupted iterations
default   [  48% ] 071/150 VUs  1m56.0s/4m00.0s

running (1m56.9s), 072/150 VUs, 5398 complete and 0 interrupted iterations
default   [  49% ] 072/150 VUs  1m57.0s/4m00.0s

running (1m57.9s), 073/150 VUs, 5492 complete and 0 interrupted iterations
default   [  49% ] 073/150 VUs  1m58.0s/4m00.0s

running (1m58.9s), 074/150 VUs, 5586 complete and 0 interrupted iterations
default   [  50% ] 074/150 VUs  1m59.0s/4m00.0s

running (1m59.9s), 074/150 VUs, 5678 complete and 0 interrupted iterations
default   [  50% ] 074/150 VUs  2m00.0s/4m00.0s

running (2m00.9s), 075/150 VUs, 5771 complete and 0 interrupted iterations
default   [  50% ] 075/150 VUs  2m01.0s/4m00.0s

running (2m01.9s), 076/150 VUs, 5866 complete and 0 interrupted iterations
default   [  51% ] 076/150 VUs  2m02.0s/4m00.0s

running (2m02.8s), 077/150 VUs, 5959 complete and 0 interrupted iterations
default   [  51% ] 077/150 VUs  2m03.0s/4m00.0s

running (2m03.8s), 078/150 VUs, 6051 complete and 0 interrupted iterations
default   [  52% ] 078/150 VUs  2m04.0s/4m00.0s

running (2m04.8s), 079/150 VUs, 6142 complete and 0 interrupted iterations
default   [  52% ] 079/150 VUs  2m05.0s/4m00.0s

running (2m05.8s), 079/150 VUs, 6237 complete and 0 interrupted iterations
default   [  52% ] 079/150 VUs  2m06.0s/4m00.0s

running (2m06.8s), 080/150 VUs, 6332 complete and 0 interrupted iterations
default   [  53% ] 080/150 VUs  2m07.0s/4m00.0s

running (2m07.8s), 081/150 VUs, 6427 complete and 0 interrupted iterations
default   [  53% ] 081/150 VUs  2m08.0s/4m00.0s

running (2m08.8s), 082/150 VUs, 6519 complete and 0 interrupted iterations
default   [  54% ] 082/150 VUs  2m09.0s/4m00.0s

running (2m09.8s), 083/150 VUs, 6612 complete and 0 interrupted iterations
default   [  54% ] 083/150 VUs  2m10.0s/4m00.0s

running (2m10.8s), 084/150 VUs, 6704 complete and 0 interrupted iterations
default   [  55% ] 084/150 VUs  2m11.0s/4m00.0s

running (2m11.8s), 084/150 VUs, 6799 complete and 0 interrupted iterations
default   [  55% ] 084/150 VUs  2m12.0s/4m00.0s

running (2m12.8s), 085/150 VUs, 6892 complete and 0 interrupted iterations
default   [  55% ] 085/150 VUs  2m13.0s/4m00.0s

running (2m13.8s), 086/150 VUs, 6982 complete and 0 interrupted iterations
default   [  56% ] 086/150 VUs  2m14.0s/4m00.0s

running (2m14.8s), 087/150 VUs, 7076 complete and 0 interrupted iterations
default   [  56% ] 087/150 VUs  2m15.0s/4m00.0s

running (2m15.8s), 088/150 VUs, 7172 complete and 0 interrupted iterations
default   [  57% ] 088/150 VUs  2m16.0s/4m00.0s

running (2m16.8s), 089/150 VUs, 7263 complete and 0 interrupted iterations
default   [  57% ] 089/150 VUs  2m17.0s/4m00.0s

running (2m17.8s), 089/150 VUs, 7352 complete and 0 interrupted iterations
default   [  57% ] 089/150 VUs  2m18.0s/4m00.0s

running (2m18.8s), 090/150 VUs, 7441 complete and 0 interrupted iterations
default   [  58% ] 090/150 VUs  2m19.0s/4m00.0s

running (2m19.8s), 091/150 VUs, 7525 complete and 0 interrupted iterations
default   [  58% ] 091/150 VUs  2m20.0s/4m00.0s

running (2m20.8s), 092/150 VUs, 7612 complete and 0 interrupted iterations
default   [  59% ] 092/150 VUs  2m21.0s/4m00.0s

running (2m21.8s), 093/150 VUs, 7702 complete and 0 interrupted iterations
default   [  59% ] 093/150 VUs  2m22.0s/4m00.0s

running (2m22.8s), 094/150 VUs, 7791 complete and 0 interrupted iterations
default   [  60% ] 094/150 VUs  2m23.0s/4m00.0s

running (2m23.8s), 094/150 VUs, 7881 complete and 0 interrupted iterations
default   [  60% ] 094/150 VUs  2m24.0s/4m00.0s

running (2m24.8s), 095/150 VUs, 7975 complete and 0 interrupted iterations
default   [  60% ] 095/150 VUs  2m25.0s/4m00.0s

running (2m25.8s), 096/150 VUs, 8068 complete and 0 interrupted iterations
default   [  61% ] 096/150 VUs  2m26.0s/4m00.0s

running (2m26.8s), 097/150 VUs, 8160 complete and 0 interrupted iterations
default   [  61% ] 097/150 VUs  2m27.0s/4m00.0s

running (2m27.8s), 098/150 VUs, 8255 complete and 0 interrupted iterations
default   [  62% ] 098/150 VUs  2m28.0s/4m00.0s

running (2m28.8s), 099/150 VUs, 8348 complete and 0 interrupted iterations
default   [  62% ] 099/150 VUs  2m29.0s/4m00.0s

running (2m29.8s), 099/150 VUs, 8440 complete and 0 interrupted iterations
default   [  62% ] 099/150 VUs  2m30.0s/4m00.0s

running (2m30.8s), 100/150 VUs, 8529 complete and 0 interrupted iterations
default   [  63% ] 100/150 VUs  2m31.0s/4m00.0s

running (2m31.8s), 101/150 VUs, 8618 complete and 0 interrupted iterations
default   [  63% ] 101/150 VUs  2m32.0s/4m00.0s

running (2m32.8s), 102/150 VUs, 8692 complete and 0 interrupted iterations
default   [  64% ] 102/150 VUs  2m33.0s/4m00.0s

running (2m33.8s), 103/150 VUs, 8755 complete and 0 interrupted iterations
default   [  64% ] 103/150 VUs  2m34.0s/4m00.0s

running (2m34.8s), 104/150 VUs, 8832 complete and 0 interrupted iterations
default   [  65% ] 104/150 VUs  2m35.0s/4m00.0s

running (2m35.8s), 104/150 VUs, 8915 complete and 0 interrupted iterations
default   [  65% ] 104/150 VUs  2m36.0s/4m00.0s

running (2m36.8s), 105/150 VUs, 8994 complete and 0 interrupted iterations
default   [  65% ] 105/150 VUs  2m37.0s/4m00.0s

running (2m37.8s), 106/150 VUs, 9088 complete and 0 interrupted iterations
default   [  66% ] 106/150 VUs  2m38.0s/4m00.0s

running (2m38.8s), 107/150 VUs, 9179 complete and 0 interrupted iterations
default   [  66% ] 107/150 VUs  2m39.0s/4m00.0s

running (2m39.8s), 108/150 VUs, 9273 complete and 0 interrupted iterations
default   [  67% ] 108/150 VUs  2m40.0s/4m00.0s

running (2m40.8s), 109/150 VUs, 9359 complete and 0 interrupted iterations
default   [  67% ] 109/150 VUs  2m41.0s/4m00.0s

running (2m41.8s), 109/150 VUs, 9452 complete and 0 interrupted iterations
default   [  67% ] 109/150 VUs  2m42.0s/4m00.0s

running (2m42.8s), 110/150 VUs, 9547 complete and 0 interrupted iterations
default   [  68% ] 110/150 VUs  2m43.0s/4m00.0s

running (2m43.8s), 111/150 VUs, 9636 complete and 0 interrupted iterations
default   [  68% ] 111/150 VUs  2m44.0s/4m00.0s

running (2m44.8s), 112/150 VUs, 9718 complete and 0 interrupted iterations
default   [  69% ] 112/150 VUs  2m45.0s/4m00.0s

running (2m45.8s), 113/150 VUs, 9809 complete and 0 interrupted iterations
default   [  69% ] 113/150 VUs  2m46.0s/4m00.0s

running (2m46.8s), 114/150 VUs, 9901 complete and 0 interrupted iterations
default   [  70% ] 114/150 VUs  2m47.0s/4m00.0s

running (2m47.8s), 114/150 VUs, 9995 complete and 0 interrupted iterations
default   [  70% ] 114/150 VUs  2m48.0s/4m00.0s

running (2m48.8s), 115/150 VUs, 10088 complete and 0 interrupted iterations
default   [  70% ] 115/150 VUs  2m49.0s/4m00.0s

running (2m49.8s), 116/150 VUs, 10182 complete and 0 interrupted iterations
default   [  71% ] 116/150 VUs  2m50.0s/4m00.0s

running (2m50.8s), 117/150 VUs, 10274 complete and 0 interrupted iterations
default   [  71% ] 117/150 VUs  2m51.0s/4m00.0s

running (2m51.8s), 118/150 VUs, 10362 complete and 0 interrupted iterations
default   [  72% ] 118/150 VUs  2m52.0s/4m00.0s

running (2m52.8s), 119/150 VUs, 10457 complete and 0 interrupted iterations
default   [  72% ] 119/150 VUs  2m53.0s/4m00.0s

running (2m53.8s), 119/150 VUs, 10521 complete and 0 interrupted iterations
default   [  72% ] 119/150 VUs  2m54.0s/4m00.0s

running (2m54.8s), 120/150 VUs, 10617 complete and 0 interrupted iterations
default   [  73% ] 120/150 VUs  2m55.0s/4m00.0s

running (2m55.8s), 121/150 VUs, 10708 complete and 0 interrupted iterations
default   [  73% ] 121/150 VUs  2m56.0s/4m00.0s

running (2m56.8s), 122/150 VUs, 10798 complete and 0 interrupted iterations
default   [  74% ] 122/150 VUs  2m57.0s/4m00.0s

running (2m57.8s), 123/150 VUs, 10881 complete and 0 interrupted iterations
default   [  74% ] 123/150 VUs  2m58.0s/4m00.0s

running (2m58.8s), 124/150 VUs, 10975 complete and 0 interrupted iterations
default   [  75% ] 124/150 VUs  2m59.0s/4m00.0s

running (2m59.8s), 124/150 VUs, 11068 complete and 0 interrupted iterations
default   [  75% ] 124/150 VUs  3m00.0s/4m00.0s

running (3m00.8s), 125/150 VUs, 11158 complete and 0 interrupted iterations
default   [  75% ] 125/150 VUs  3m01.0s/4m00.0s

running (3m01.8s), 126/150 VUs, 11249 complete and 0 interrupted iterations
default   [  76% ] 126/150 VUs  3m02.0s/4m00.0s

running (3m02.8s), 127/150 VUs, 11343 complete and 0 interrupted iterations
default   [  76% ] 127/150 VUs  3m03.0s/4m00.0s

running (3m03.8s), 128/150 VUs, 11432 complete and 0 interrupted iterations
default   [  77% ] 128/150 VUs  3m04.0s/4m00.0s

running (3m04.8s), 129/150 VUs, 11523 complete and 0 interrupted iterations
default   [  77% ] 129/150 VUs  3m05.0s/4m00.0s

running (3m05.8s), 129/150 VUs, 11618 complete and 0 interrupted iterations
default   [  77% ] 129/150 VUs  3m06.0s/4m00.0s

running (3m06.8s), 130/150 VUs, 11710 complete and 0 interrupted iterations
default   [  78% ] 130/150 VUs  3m07.0s/4m00.0s

running (3m07.8s), 131/150 VUs, 11803 complete and 0 interrupted iterations
default   [  78% ] 131/150 VUs  3m08.0s/4m00.0s

running (3m08.8s), 132/150 VUs, 11891 complete and 0 interrupted iterations
default   [  79% ] 132/150 VUs  3m09.0s/4m00.0s

running (3m09.8s), 133/150 VUs, 11990 complete and 0 interrupted iterations
default   [  79% ] 133/150 VUs  3m10.0s/4m00.0s

running (3m10.8s), 134/150 VUs, 12079 complete and 0 interrupted iterations
default   [  80% ] 134/150 VUs  3m11.0s/4m00.0s

running (3m11.8s), 134/150 VUs, 12170 complete and 0 interrupted iterations
default   [  80% ] 134/150 VUs  3m12.0s/4m00.0s

running (3m12.8s), 135/150 VUs, 12264 complete and 0 interrupted iterations
default   [  80% ] 135/150 VUs  3m13.0s/4m00.0s

running (3m13.8s), 136/150 VUs, 12352 complete and 0 interrupted iterations
default   [  81% ] 136/150 VUs  3m14.0s/4m00.0s

running (3m14.8s), 137/150 VUs, 12446 complete and 0 interrupted iterations
default   [  81% ] 137/150 VUs  3m15.0s/4m00.0s

running (3m15.8s), 138/150 VUs, 12533 complete and 0 interrupted iterations
default   [  82% ] 138/150 VUs  3m16.0s/4m00.0s

running (3m16.8s), 139/150 VUs, 12627 complete and 0 interrupted iterations
default   [  82% ] 139/150 VUs  3m17.0s/4m00.0s

running (3m17.8s), 139/150 VUs, 12721 complete and 0 interrupted iterations
default   [  82% ] 139/150 VUs  3m18.0s/4m00.0s

running (3m18.8s), 140/150 VUs, 12811 complete and 0 interrupted iterations
default   [  83% ] 140/150 VUs  3m19.0s/4m00.0s

running (3m19.8s), 141/150 VUs, 12890 complete and 0 interrupted iterations
default   [  83% ] 141/150 VUs  3m20.0s/4m00.0s

running (3m20.8s), 142/150 VUs, 12976 complete and 0 interrupted iterations
default   [  84% ] 142/150 VUs  3m21.0s/4m00.0s

running (3m21.8s), 143/150 VUs, 13057 complete and 0 interrupted iterations
default   [  84% ] 143/150 VUs  3m22.0s/4m00.0s

running (3m22.8s), 144/150 VUs, 13150 complete and 0 interrupted iterations
default   [  85% ] 144/150 VUs  3m23.0s/4m00.0s

running (3m23.8s), 144/150 VUs, 13239 complete and 0 interrupted iterations
default   [  85% ] 144/150 VUs  3m24.0s/4m00.0s

running (3m24.8s), 145/150 VUs, 13321 complete and 0 interrupted iterations
default   [  85% ] 145/150 VUs  3m25.0s/4m00.0s

running (3m25.8s), 146/150 VUs, 13401 complete and 0 interrupted iterations
default   [  86% ] 146/150 VUs  3m26.0s/4m00.0s

running (3m26.8s), 147/150 VUs, 13484 complete and 0 interrupted iterations
default   [  86% ] 147/150 VUs  3m27.0s/4m00.0s

running (3m27.8s), 148/150 VUs, 13562 complete and 0 interrupted iterations
default   [  87% ] 148/150 VUs  3m28.0s/4m00.0s

running (3m28.8s), 149/150 VUs, 13632 complete and 0 interrupted iterations
default   [  87% ] 149/150 VUs  3m29.0s/4m00.0s

running (3m29.8s), 149/150 VUs, 13703 complete and 0 interrupted iterations
default   [  87% ] 149/150 VUs  3m30.0s/4m00.0s

running (3m30.8s), 149/150 VUs, 13777 complete and 0 interrupted iterations
default   [  88% ] 149/150 VUs  3m31.0s/4m00.0s

running (3m31.8s), 145/150 VUs, 13867 complete and 0 interrupted iterations
default   [  88% ] 145/150 VUs  3m32.0s/4m00.0s

running (3m32.8s), 139/150 VUs, 13954 complete and 0 interrupted iterations
default   [  89% ] 139/150 VUs  3m33.0s/4m00.0s

running (3m33.8s), 134/150 VUs, 14033 complete and 0 interrupted iterations
default   [  89% ] 134/150 VUs  3m34.0s/4m00.0s

running (3m34.8s), 130/150 VUs, 14118 complete and 0 interrupted iterations
default   [  90% ] 130/150 VUs  3m35.0s/4m00.0s

running (3m35.8s), 125/150 VUs, 14209 complete and 0 interrupted iterations
default   [  90% ] 125/150 VUs  3m36.0s/4m00.0s

running (3m36.8s), 119/150 VUs, 14297 complete and 0 interrupted iterations
default   [  90% ] 119/150 VUs  3m37.0s/4m00.0s

running (3m37.8s), 113/150 VUs, 14389 complete and 0 interrupted iterations
default   [  91% ] 113/150 VUs  3m38.0s/4m00.0s

running (3m38.8s), 106/150 VUs, 14480 complete and 0 interrupted iterations
default   [  91% ] 106/150 VUs  3m39.0s/4m00.0s

running (3m39.8s), 105/150 VUs, 14573 complete and 0 interrupted iterations
default   [  92% ] 105/150 VUs  3m40.0s/4m00.0s

running (3m40.8s), 099/150 VUs, 14645 complete and 0 interrupted iterations
default   [  92% ] 099/150 VUs  3m41.0s/4m00.0s

running (3m41.8s), 093/150 VUs, 14738 complete and 0 interrupted iterations
default   [  92% ] 093/150 VUs  3m42.0s/4m00.0s

running (3m42.8s), 090/150 VUs, 14821 complete and 0 interrupted iterations
default   [  93% ] 090/150 VUs  3m43.0s/4m00.0s

running (3m43.8s), 083/150 VUs, 14889 complete and 0 interrupted iterations
default   [  93% ] 083/150 VUs  3m44.0s/4m00.0s

running (3m44.8s), 078/150 VUs, 14965 complete and 0 interrupted iterations
default   [  94% ] 078/150 VUs  3m45.0s/4m00.0s

running (3m45.8s), 073/150 VUs, 15044 complete and 0 interrupted iterations
default   [  94% ] 073/150 VUs  3m46.0s/4m00.0s

running (3m46.8s), 067/150 VUs, 15133 complete and 0 interrupted iterations
default   [  95% ] 067/150 VUs  3m47.0s/4m00.0s

running (3m47.8s), 064/150 VUs, 15194 complete and 0 interrupted iterations
default   [  95% ] 064/150 VUs  3m48.0s/4m00.0s

running (3m48.8s), 059/150 VUs, 15244 complete and 0 interrupted iterations
default   [  95% ] 059/150 VUs  3m49.0s/4m00.0s

running (3m49.8s), 053/150 VUs, 15321 complete and 0 interrupted iterations
default   [  96% ] 053/150 VUs  3m50.0s/4m00.0s

running (3m50.8s), 047/150 VUs, 15397 complete and 0 interrupted iterations
default   [  96% ] 047/150 VUs  3m51.0s/4m00.0s

running (3m51.8s), 042/150 VUs, 15463 complete and 0 interrupted iterations
default   [  97% ] 042/150 VUs  3m52.0s/4m00.0s

running (3m52.8s), 037/150 VUs, 15534 complete and 0 interrupted iterations
default   [  97% ] 037/150 VUs  3m53.0s/4m00.0s

running (3m53.8s), 032/150 VUs, 15592 complete and 0 interrupted iterations
default   [  97% ] 032/150 VUs  3m54.0s/4m00.0s

running (3m54.8s), 027/150 VUs, 15640 complete and 0 interrupted iterations
default   [  98% ] 027/150 VUs  3m55.0s/4m00.0s

running (3m55.8s), 022/150 VUs, 15682 complete and 0 interrupted iterations
default   [  98% ] 022/150 VUs  3m56.0s/4m00.0s

running (3m56.8s), 017/150 VUs, 15718 complete and 0 interrupted iterations
default   [  99% ] 017/150 VUs  3m57.0s/4m00.0s

running (3m57.8s), 012/150 VUs, 15745 complete and 0 interrupted iterations
default   [  99% ] 012/150 VUs  3m58.0s/4m00.0s

running (3m58.8s), 006/150 VUs, 15762 complete and 0 interrupted iterations
default   [ 100% ] 006/150 VUs  3m59.0s/4m00.0s

running (3m59.8s), 003/150 VUs, 15770 complete and 0 interrupted iterations
default   [ 100% ] 003/150 VUs  4m00.0s/4m00.0s


  █ THRESHOLDS 

    http_req_duration
    ✓ 'p(95)<1000' p(95)=995.06ms
    ✓ 'p(99)<2000' p(99)=1.28s

    http_req_failed
    ✓ 'rate<0.05' rate=0.00%


  █ TOTAL RESULTS 

    checks_total.......: 31546   131.312686/s
    checks_succeeded...: 100.00% 31546 out of 31546
    checks_failed......: 0.00%   0 out of 31546

    ✓ a: status 200
    ✓ b: status 200

    HTTP
    http_req_duration..............: avg=262.82ms min=154.19µs med=108.23ms max=1.64s p(90)=852.52ms p(95)=995.06ms
      { expected_response:true }...: avg=262.82ms min=154.19µs med=108.23ms max=1.64s p(90)=852.52ms p(95)=995.06ms
    http_req_failed................: 0.00%  0 out of 31546
    http_reqs......................: 31546  131.312686/s

    EXECUTION
    iteration_duration.............: avg=1.02s    min=610.46ms med=959.64ms max=2.19s p(90)=1.51s    p(95)=1.72s   
    iterations.....................: 15773  65.656343/s
    vus............................: 3      min=1          max=149
    vus_max........................: 150    min=150        max=150

    NETWORK
    data_received..................: 9.8 MB 41 kB/s
    data_sent......................: 3.0 MB 12 kB/s




running (4m00.2s), 000/150 VUs, 15773 complete and 0 interrupted iterations
default ✓ [ 100% ] 000/150 VUs  4m0s
