
         /\      Grafana   /‾‾/  
    /\  /  \     |\  __   /  /   
   /  \/    \    | |/ /  /   ‾‾\ 
  /          \   |   (  |  (‾)  |
 / __________ \  |_|\_\  \_____/ 

     execution: local
        script: /home/edilberto/pspd/atividade-final-pspd/load/ramp.js
        output: json (/home/edilberto/pspd/atividade-final-pspd/results/ramp/metrics.json)

     scenarios: (100.00%) 1 scenario, 150 max VUs, 4m30s max duration (incl. graceful stop):
              * default: Up to 150 looping VUs for 4m0s over 5 stages (gracefulRampDown: 30s, gracefulStop: 30s)


running (0m00.9s), 001/150 VUs, 1 complete and 0 interrupted iterations
default   [   0% ] 001/150 VUs  0m00.9s/4m00.0s

running (0m01.9s), 001/150 VUs, 2 complete and 0 interrupted iterations
default   [   1% ] 001/150 VUs  0m01.9s/4m00.0s

running (0m02.9s), 001/150 VUs, 4 complete and 0 interrupted iterations
default   [   1% ] 001/150 VUs  0m02.9s/4m00.0s

running (0m03.9s), 002/150 VUs, 6 complete and 0 interrupted iterations
default   [   2% ] 002/150 VUs  0m03.9s/4m00.0s

running (0m04.9s), 002/150 VUs, 9 complete and 0 interrupted iterations
default   [   2% ] 002/150 VUs  0m04.9s/4m00.0s

running (0m05.9s), 002/150 VUs, 13 complete and 0 interrupted iterations
default   [   2% ] 002/150 VUs  0m05.9s/4m00.0s

running (0m06.9s), 003/150 VUs, 16 complete and 0 interrupted iterations
default   [   3% ] 003/150 VUs  0m06.9s/4m00.0s

running (0m07.9s), 003/150 VUs, 20 complete and 0 interrupted iterations
default   [   3% ] 003/150 VUs  0m07.9s/4m00.0s

running (0m08.9s), 003/150 VUs, 26 complete and 0 interrupted iterations
default   [   4% ] 003/150 VUs  0m08.9s/4m00.0s

running (0m09.9s), 003/150 VUs, 31 complete and 0 interrupted iterations
default   [   4% ] 003/150 VUs  0m09.9s/4m00.0s

running (0m10.9s), 004/150 VUs, 36 complete and 0 interrupted iterations
default   [   5% ] 004/150 VUs  0m10.9s/4m00.0s

running (0m11.9s), 004/150 VUs, 43 complete and 0 interrupted iterations
default   [   5% ] 004/150 VUs  0m11.9s/4m00.0s

running (0m12.9s), 004/150 VUs, 49 complete and 0 interrupted iterations
default   [   5% ] 004/150 VUs  0m12.9s/4m00.0s

running (0m13.9s), 005/150 VUs, 56 complete and 0 interrupted iterations
default   [   6% ] 005/150 VUs  0m13.9s/4m00.0s

running (0m14.9s), 005/150 VUs, 64 complete and 0 interrupted iterations
default   [   6% ] 005/150 VUs  0m14.9s/4m00.0s

running (0m15.9s), 005/150 VUs, 73 complete and 0 interrupted iterations
default   [   7% ] 005/150 VUs  0m15.9s/4m00.0s

running (0m16.9s), 006/150 VUs, 81 complete and 0 interrupted iterations
default   [   7% ] 006/150 VUs  0m16.9s/4m00.0s

running (0m17.9s), 006/150 VUs, 90 complete and 0 interrupted iterations
default   [   7% ] 006/150 VUs  0m17.9s/4m00.0s

running (0m18.9s), 006/150 VUs, 100 complete and 0 interrupted iterations
default   [   8% ] 006/150 VUs  0m18.9s/4m00.0s

running (0m19.9s), 006/150 VUs, 110 complete and 0 interrupted iterations
default   [   8% ] 006/150 VUs  0m19.9s/4m00.0s

running (0m20.9s), 007/150 VUs, 121 complete and 0 interrupted iterations
default   [   9% ] 007/150 VUs  0m20.9s/4m00.0s

running (0m21.9s), 007/150 VUs, 132 complete and 0 interrupted iterations
default   [   9% ] 007/150 VUs  0m21.9s/4m00.0s

running (0m22.9s), 007/150 VUs, 144 complete and 0 interrupted iterations
default   [  10% ] 007/150 VUs  0m22.9s/4m00.0s

running (0m23.9s), 008/150 VUs, 155 complete and 0 interrupted iterations
default   [  10% ] 008/150 VUs  0m23.9s/4m00.0s

running (0m24.9s), 008/150 VUs, 168 complete and 0 interrupted iterations
default   [  10% ] 008/150 VUs  0m24.9s/4m00.0s

running (0m25.9s), 008/150 VUs, 181 complete and 0 interrupted iterations
default   [  11% ] 008/150 VUs  0m25.9s/4m00.0s

running (0m26.9s), 009/150 VUs, 194 complete and 0 interrupted iterations
default   [  11% ] 009/150 VUs  0m26.9s/4m00.0s

running (0m27.9s), 009/150 VUs, 209 complete and 0 interrupted iterations
default   [  12% ] 009/150 VUs  0m27.9s/4m00.0s

running (0m28.9s), 009/150 VUs, 223 complete and 0 interrupted iterations
default   [  12% ] 009/150 VUs  0m28.9s/4m00.0s

running (0m29.9s), 009/150 VUs, 238 complete and 0 interrupted iterations
default   [  12% ] 009/150 VUs  0m29.9s/4m00.0s

running (0m30.9s), 010/150 VUs, 254 complete and 0 interrupted iterations
default   [  13% ] 010/150 VUs  0m30.9s/4m00.0s

running (0m31.9s), 011/150 VUs, 270 complete and 0 interrupted iterations
default   [  13% ] 011/150 VUs  0m31.9s/4m00.0s

running (0m32.9s), 011/150 VUs, 288 complete and 0 interrupted iterations
default   [  14% ] 011/150 VUs  0m32.9s/4m00.0s

running (0m33.9s), 012/150 VUs, 307 complete and 0 interrupted iterations
default   [  14% ] 012/150 VUs  0m33.9s/4m00.0s

running (0m34.9s), 013/150 VUs, 327 complete and 0 interrupted iterations
default   [  15% ] 013/150 VUs  0m34.9s/4m00.0s

running (0m35.9s), 013/150 VUs, 349 complete and 0 interrupted iterations
default   [  15% ] 013/150 VUs  0m35.9s/4m00.0s

running (0m36.9s), 014/150 VUs, 370 complete and 0 interrupted iterations
default   [  15% ] 014/150 VUs  0m36.9s/4m00.0s

running (0m37.9s), 015/150 VUs, 393 complete and 0 interrupted iterations
default   [  16% ] 015/150 VUs  0m37.9s/4m00.0s

running (0m38.9s), 015/150 VUs, 417 complete and 0 interrupted iterations
default   [  16% ] 015/150 VUs  0m38.9s/4m00.0s

running (0m39.9s), 016/150 VUs, 443 complete and 0 interrupted iterations
default   [  17% ] 016/150 VUs  0m39.9s/4m00.0s

running (0m40.9s), 017/150 VUs, 469 complete and 0 interrupted iterations
default   [  17% ] 017/150 VUs  0m40.9s/4m00.0s

running (0m41.9s), 017/150 VUs, 498 complete and 0 interrupted iterations
default   [  17% ] 017/150 VUs  0m41.9s/4m00.0s

running (0m42.9s), 018/150 VUs, 526 complete and 0 interrupted iterations
default   [  18% ] 018/150 VUs  0m42.9s/4m00.0s

running (0m43.9s), 019/150 VUs, 555 complete and 0 interrupted iterations
default   [  18% ] 019/150 VUs  0m43.9s/4m00.0s

running (0m44.9s), 019/150 VUs, 587 complete and 0 interrupted iterations
default   [  19% ] 019/150 VUs  0m44.9s/4m00.0s

running (0m45.9s), 020/150 VUs, 619 complete and 0 interrupted iterations
default   [  19% ] 020/150 VUs  0m45.9s/4m00.0s

running (0m46.9s), 021/150 VUs, 652 complete and 0 interrupted iterations
default   [  20% ] 021/150 VUs  0m46.9s/4m00.0s

running (0m47.9s), 021/150 VUs, 686 complete and 0 interrupted iterations
default   [  20% ] 021/150 VUs  0m47.9s/4m00.0s

running (0m48.9s), 022/150 VUs, 721 complete and 0 interrupted iterations
default   [  20% ] 022/150 VUs  0m48.9s/4m00.0s

running (0m49.9s), 023/150 VUs, 756 complete and 0 interrupted iterations
default   [  21% ] 023/150 VUs  0m49.9s/4m00.0s

running (0m50.9s), 023/150 VUs, 796 complete and 0 interrupted iterations
default   [  21% ] 023/150 VUs  0m50.9s/4m00.0s

running (0m51.9s), 024/150 VUs, 833 complete and 0 interrupted iterations
default   [  22% ] 024/150 VUs  0m51.9s/4m00.0s

running (0m52.9s), 025/150 VUs, 873 complete and 0 interrupted iterations
default   [  22% ] 025/150 VUs  0m52.9s/4m00.0s

running (0m53.9s), 025/150 VUs, 914 complete and 0 interrupted iterations
default   [  22% ] 025/150 VUs  0m53.9s/4m00.0s

running (0m54.9s), 026/150 VUs, 955 complete and 0 interrupted iterations
default   [  23% ] 026/150 VUs  0m54.9s/4m00.0s

running (0m55.9s), 027/150 VUs, 998 complete and 0 interrupted iterations
default   [  23% ] 027/150 VUs  0m55.9s/4m00.0s

running (0m56.9s), 027/150 VUs, 1041 complete and 0 interrupted iterations
default   [  24% ] 027/150 VUs  0m56.9s/4m00.0s

running (0m57.9s), 028/150 VUs, 1083 complete and 0 interrupted iterations
default   [  24% ] 028/150 VUs  0m57.9s/4m00.0s

running (0m58.9s), 029/150 VUs, 1126 complete and 0 interrupted iterations
default   [  25% ] 029/150 VUs  0m58.9s/4m00.0s

running (0m59.9s), 029/150 VUs, 1174 complete and 0 interrupted iterations
default   [  25% ] 029/150 VUs  0m59.9s/4m00.0s

running (1m00.9s), 030/150 VUs, 1222 complete and 0 interrupted iterations
default   [  25% ] 030/150 VUs  1m00.9s/4m00.0s

running (1m01.9s), 031/150 VUs, 1270 complete and 0 interrupted iterations
default   [  26% ] 031/150 VUs  1m01.9s/4m00.0s

running (1m02.9s), 031/150 VUs, 1322 complete and 0 interrupted iterations
default   [  26% ] 031/150 VUs  1m02.9s/4m00.0s

running (1m03.9s), 032/150 VUs, 1370 complete and 0 interrupted iterations
default   [  27% ] 032/150 VUs  1m03.9s/4m00.0s

running (1m04.9s), 033/150 VUs, 1424 complete and 0 interrupted iterations
default   [  27% ] 033/150 VUs  1m04.9s/4m00.0s

running (1m05.9s), 033/150 VUs, 1481 complete and 0 interrupted iterations
default   [  27% ] 033/150 VUs  1m05.9s/4m00.0s

running (1m06.9s), 034/150 VUs, 1529 complete and 0 interrupted iterations
default   [  28% ] 034/150 VUs  1m06.9s/4m00.0s

running (1m07.9s), 035/150 VUs, 1586 complete and 0 interrupted iterations
default   [  28% ] 035/150 VUs  1m07.9s/4m00.0s

running (1m08.9s), 035/150 VUs, 1646 complete and 0 interrupted iterations
default   [  29% ] 035/150 VUs  1m08.9s/4m00.0s

running (1m09.9s), 036/150 VUs, 1701 complete and 0 interrupted iterations
default   [  29% ] 036/150 VUs  1m09.9s/4m00.0s

running (1m10.9s), 037/150 VUs, 1762 complete and 0 interrupted iterations
default   [  30% ] 037/150 VUs  1m10.9s/4m00.0s

running (1m11.9s), 037/150 VUs, 1821 complete and 0 interrupted iterations
default   [  30% ] 037/150 VUs  1m11.9s/4m00.0s

running (1m12.9s), 038/150 VUs, 1883 complete and 0 interrupted iterations
default   [  30% ] 038/150 VUs  1m12.9s/4m00.0s

running (1m13.9s), 039/150 VUs, 1948 complete and 0 interrupted iterations
default   [  31% ] 039/150 VUs  1m13.9s/4m00.0s

running (1m14.9s), 039/150 VUs, 2006 complete and 0 interrupted iterations
default   [  31% ] 039/150 VUs  1m14.9s/4m00.0s

running (1m15.9s), 040/150 VUs, 2075 complete and 0 interrupted iterations
default   [  32% ] 040/150 VUs  1m15.9s/4m00.0s

running (1m16.9s), 041/150 VUs, 2140 complete and 0 interrupted iterations
default   [  32% ] 041/150 VUs  1m16.9s/4m00.0s

running (1m17.9s), 041/150 VUs, 2205 complete and 0 interrupted iterations
default   [  32% ] 041/150 VUs  1m17.9s/4m00.0s

running (1m18.9s), 042/150 VUs, 2272 complete and 0 interrupted iterations
default   [  33% ] 042/150 VUs  1m18.9s/4m00.0s

running (1m19.9s), 043/150 VUs, 2338 complete and 0 interrupted iterations
default   [  33% ] 043/150 VUs  1m19.9s/4m00.0s

running (1m20.9s), 043/150 VUs, 2413 complete and 0 interrupted iterations
default   [  34% ] 043/150 VUs  1m20.9s/4m00.0s

running (1m21.9s), 044/150 VUs, 2480 complete and 0 interrupted iterations
default   [  34% ] 044/150 VUs  1m21.9s/4m00.0s

running (1m22.9s), 045/150 VUs, 2554 complete and 0 interrupted iterations
default   [  35% ] 045/150 VUs  1m22.9s/4m00.0s

running (1m23.9s), 045/150 VUs, 2626 complete and 0 interrupted iterations
default   [  35% ] 045/150 VUs  1m23.9s/4m00.0s

running (1m24.9s), 046/150 VUs, 2701 complete and 0 interrupted iterations
default   [  35% ] 046/150 VUs  1m24.9s/4m00.0s

running (1m25.9s), 047/150 VUs, 2771 complete and 0 interrupted iterations
default   [  36% ] 047/150 VUs  1m25.9s/4m00.0s

running (1m26.9s), 047/150 VUs, 2846 complete and 0 interrupted iterations
default   [  36% ] 047/150 VUs  1m26.9s/4m00.0s

running (1m27.9s), 048/150 VUs, 2926 complete and 0 interrupted iterations
default   [  37% ] 048/150 VUs  1m27.9s/4m00.0s

running (1m28.9s), 049/150 VUs, 3004 complete and 0 interrupted iterations
default   [  37% ] 049/150 VUs  1m28.9s/4m00.0s

running (1m29.9s), 049/150 VUs, 3084 complete and 0 interrupted iterations
default   [  37% ] 049/150 VUs  1m29.9s/4m00.0s

running (1m30.9s), 050/150 VUs, 3164 complete and 0 interrupted iterations
default   [  38% ] 050/150 VUs  1m30.9s/4m00.0s

running (1m31.9s), 051/150 VUs, 3244 complete and 0 interrupted iterations
default   [  38% ] 051/150 VUs  1m31.9s/4m00.0s

running (1m32.9s), 052/150 VUs, 3328 complete and 0 interrupted iterations
default   [  39% ] 052/150 VUs  1m32.9s/4m00.0s

running (1m33.9s), 053/150 VUs, 3410 complete and 0 interrupted iterations
default   [  39% ] 053/150 VUs  1m33.9s/4m00.0s

running (1m34.9s), 054/150 VUs, 3496 complete and 0 interrupted iterations
default   [  40% ] 054/150 VUs  1m34.9s/4m00.0s

running (1m35.9s), 054/150 VUs, 3584 complete and 0 interrupted iterations
default   [  40% ] 054/150 VUs  1m35.9s/4m00.0s

running (1m36.9s), 055/150 VUs, 3672 complete and 0 interrupted iterations
default   [  40% ] 055/150 VUs  1m36.9s/4m00.0s

running (1m37.9s), 056/150 VUs, 3761 complete and 0 interrupted iterations
default   [  41% ] 056/150 VUs  1m37.9s/4m00.0s

running (1m38.9s), 057/150 VUs, 3847 complete and 0 interrupted iterations
default   [  41% ] 057/150 VUs  1m38.9s/4m00.0s

running (1m39.9s), 058/150 VUs, 3916 complete and 0 interrupted iterations
default   [  42% ] 058/150 VUs  1m39.9s/4m00.0s

running (1m40.9s), 059/150 VUs, 3994 complete and 0 interrupted iterations
default   [  42% ] 059/150 VUs  1m40.9s/4m00.0s

running (1m41.9s), 059/150 VUs, 4086 complete and 0 interrupted iterations
default   [  42% ] 059/150 VUs  1m41.9s/4m00.0s

running (1m42.9s), 060/150 VUs, 4181 complete and 0 interrupted iterations
default   [  43% ] 060/150 VUs  1m42.9s/4m00.0s

running (1m43.9s), 061/150 VUs, 4267 complete and 0 interrupted iterations
default   [  43% ] 061/150 VUs  1m43.9s/4m00.0s

running (1m44.9s), 062/150 VUs, 4363 complete and 0 interrupted iterations
default   [  44% ] 062/150 VUs  1m44.9s/4m00.0s

running (1m45.9s), 063/150 VUs, 4457 complete and 0 interrupted iterations
default   [  44% ] 063/150 VUs  1m45.9s/4m00.0s

running (1m46.9s), 064/150 VUs, 4549 complete and 0 interrupted iterations
default   [  45% ] 064/150 VUs  1m46.9s/4m00.0s

running (1m47.9s), 064/150 VUs, 4643 complete and 0 interrupted iterations
default   [  45% ] 064/150 VUs  1m47.9s/4m00.0s

running (1m48.9s), 065/150 VUs, 4738 complete and 0 interrupted iterations
default   [  45% ] 065/150 VUs  1m48.9s/4m00.0s

running (1m49.9s), 066/150 VUs, 4832 complete and 0 interrupted iterations
default   [  46% ] 066/150 VUs  1m49.9s/4m00.0s

running (1m50.9s), 067/150 VUs, 4926 complete and 0 interrupted iterations
default   [  46% ] 067/150 VUs  1m50.9s/4m00.0s

running (1m51.9s), 068/150 VUs, 5017 complete and 0 interrupted iterations
default   [  47% ] 068/150 VUs  1m51.9s/4m00.0s

running (1m52.9s), 069/150 VUs, 5110 complete and 0 interrupted iterations
default   [  47% ] 069/150 VUs  1m52.9s/4m00.0s

running (1m53.9s), 069/150 VUs, 5207 complete and 0 interrupted iterations
default   [  47% ] 069/150 VUs  1m53.9s/4m00.0s

running (1m54.9s), 070/150 VUs, 5302 complete and 0 interrupted iterations
default   [  48% ] 070/150 VUs  1m54.9s/4m00.0s

running (1m55.9s), 071/150 VUs, 5397 complete and 0 interrupted iterations
default   [  48% ] 071/150 VUs  1m55.9s/4m00.0s

running (1m56.9s), 072/150 VUs, 5491 complete and 0 interrupted iterations
default   [  49% ] 072/150 VUs  1m56.9s/4m00.0s

running (1m57.9s), 073/150 VUs, 5579 complete and 0 interrupted iterations
default   [  49% ] 073/150 VUs  1m57.9s/4m00.0s

running (1m58.9s), 074/150 VUs, 5673 complete and 0 interrupted iterations
default   [  50% ] 074/150 VUs  1m58.9s/4m00.0s

running (1m59.9s), 074/150 VUs, 5759 complete and 0 interrupted iterations
default   [  50% ] 074/150 VUs  1m59.9s/4m00.0s

running (2m00.9s), 075/150 VUs, 5852 complete and 0 interrupted iterations
default   [  50% ] 075/150 VUs  2m00.9s/4m00.0s

running (2m01.9s), 076/150 VUs, 5947 complete and 0 interrupted iterations
default   [  51% ] 076/150 VUs  2m01.9s/4m00.0s

running (2m02.9s), 077/150 VUs, 6039 complete and 0 interrupted iterations
default   [  51% ] 077/150 VUs  2m02.9s/4m00.0s

running (2m03.9s), 078/150 VUs, 6135 complete and 0 interrupted iterations
default   [  52% ] 078/150 VUs  2m03.9s/4m00.0s

running (2m04.9s), 079/150 VUs, 6228 complete and 0 interrupted iterations
default   [  52% ] 079/150 VUs  2m04.9s/4m00.0s

running (2m05.9s), 079/150 VUs, 6315 complete and 0 interrupted iterations
default   [  52% ] 079/150 VUs  2m05.9s/4m00.0s

running (2m06.9s), 080/150 VUs, 6408 complete and 0 interrupted iterations
default   [  53% ] 080/150 VUs  2m06.9s/4m00.0s

running (2m07.9s), 081/150 VUs, 6503 complete and 0 interrupted iterations
default   [  53% ] 081/150 VUs  2m07.9s/4m00.0s

running (2m08.9s), 082/150 VUs, 6598 complete and 0 interrupted iterations
default   [  54% ] 082/150 VUs  2m08.9s/4m00.0s

running (2m09.9s), 083/150 VUs, 6692 complete and 0 interrupted iterations
default   [  54% ] 083/150 VUs  2m09.9s/4m00.0s

running (2m10.9s), 084/150 VUs, 6785 complete and 0 interrupted iterations
default   [  55% ] 084/150 VUs  2m10.9s/4m00.0s

running (2m11.9s), 084/150 VUs, 6881 complete and 0 interrupted iterations
default   [  55% ] 084/150 VUs  2m11.9s/4m00.0s

running (2m12.9s), 085/150 VUs, 6975 complete and 0 interrupted iterations
default   [  55% ] 085/150 VUs  2m12.9s/4m00.0s

running (2m13.9s), 086/150 VUs, 7067 complete and 0 interrupted iterations
default   [  56% ] 086/150 VUs  2m13.9s/4m00.0s

running (2m14.9s), 087/150 VUs, 7155 complete and 0 interrupted iterations
default   [  56% ] 087/150 VUs  2m14.9s/4m00.0s

running (2m15.9s), 088/150 VUs, 7245 complete and 0 interrupted iterations
default   [  57% ] 088/150 VUs  2m15.9s/4m00.0s

running (2m16.9s), 089/150 VUs, 7337 complete and 0 interrupted iterations
default   [  57% ] 089/150 VUs  2m16.9s/4m00.0s

running (2m17.9s), 089/150 VUs, 7429 complete and 0 interrupted iterations
default   [  57% ] 089/150 VUs  2m17.9s/4m00.0s

running (2m18.9s), 090/150 VUs, 7524 complete and 0 interrupted iterations
default   [  58% ] 090/150 VUs  2m18.9s/4m00.0s

running (2m19.9s), 091/150 VUs, 7616 complete and 0 interrupted iterations
default   [  58% ] 091/150 VUs  2m19.9s/4m00.0s

running (2m20.9s), 092/150 VUs, 7711 complete and 0 interrupted iterations
default   [  59% ] 092/150 VUs  2m20.9s/4m00.0s

running (2m21.9s), 093/150 VUs, 7806 complete and 0 interrupted iterations
default   [  59% ] 093/150 VUs  2m21.9s/4m00.0s

running (2m22.9s), 094/150 VUs, 7900 complete and 0 interrupted iterations
default   [  60% ] 094/150 VUs  2m22.9s/4m00.0s

running (2m23.9s), 094/150 VUs, 7996 complete and 0 interrupted iterations
default   [  60% ] 094/150 VUs  2m23.9s/4m00.0s

running (2m24.9s), 095/150 VUs, 8092 complete and 0 interrupted iterations
default   [  60% ] 095/150 VUs  2m24.9s/4m00.0s

running (2m25.9s), 096/150 VUs, 8186 complete and 0 interrupted iterations
default   [  61% ] 096/150 VUs  2m25.9s/4m00.0s

running (2m26.9s), 097/150 VUs, 8278 complete and 0 interrupted iterations
default   [  61% ] 097/150 VUs  2m26.9s/4m00.0s

running (2m27.9s), 098/150 VUs, 8370 complete and 0 interrupted iterations
default   [  62% ] 098/150 VUs  2m27.9s/4m00.0s

running (2m28.9s), 099/150 VUs, 8461 complete and 0 interrupted iterations
default   [  62% ] 099/150 VUs  2m28.9s/4m00.0s

running (2m29.9s), 099/150 VUs, 8541 complete and 0 interrupted iterations
default   [  62% ] 099/150 VUs  2m29.9s/4m00.0s

running (2m30.9s), 100/150 VUs, 8622 complete and 0 interrupted iterations
default   [  63% ] 100/150 VUs  2m30.9s/4m00.0s

running (2m31.9s), 101/150 VUs, 8708 complete and 0 interrupted iterations
default   [  63% ] 101/150 VUs  2m31.9s/4m00.0s

running (2m32.9s), 102/150 VUs, 8800 complete and 0 interrupted iterations
default   [  64% ] 102/150 VUs  2m32.9s/4m00.0s

running (2m33.9s), 103/150 VUs, 8888 complete and 0 interrupted iterations
default   [  64% ] 103/150 VUs  2m33.9s/4m00.0s

running (2m34.9s), 104/150 VUs, 8972 complete and 0 interrupted iterations
default   [  65% ] 104/150 VUs  2m34.9s/4m00.0s

running (2m35.9s), 104/150 VUs, 9064 complete and 0 interrupted iterations
default   [  65% ] 104/150 VUs  2m35.9s/4m00.0s

running (2m36.9s), 105/150 VUs, 9157 complete and 0 interrupted iterations
default   [  65% ] 105/150 VUs  2m36.9s/4m00.0s

running (2m37.9s), 106/150 VUs, 9243 complete and 0 interrupted iterations
default   [  66% ] 106/150 VUs  2m37.9s/4m00.0s

running (2m38.9s), 107/150 VUs, 9336 complete and 0 interrupted iterations
default   [  66% ] 107/150 VUs  2m38.9s/4m00.0s

running (2m39.9s), 108/150 VUs, 9431 complete and 0 interrupted iterations
default   [  67% ] 108/150 VUs  2m39.9s/4m00.0s

running (2m40.9s), 109/150 VUs, 9525 complete and 0 interrupted iterations
default   [  67% ] 109/150 VUs  2m40.9s/4m00.0s

running (2m41.9s), 109/150 VUs, 9623 complete and 0 interrupted iterations
default   [  67% ] 109/150 VUs  2m41.9s/4m00.0s

running (2m42.9s), 110/150 VUs, 9711 complete and 0 interrupted iterations
default   [  68% ] 110/150 VUs  2m42.9s/4m00.0s

running (2m43.9s), 111/150 VUs, 9805 complete and 0 interrupted iterations
default   [  68% ] 111/150 VUs  2m43.9s/4m00.0s

running (2m44.9s), 112/150 VUs, 9899 complete and 0 interrupted iterations
default   [  69% ] 112/150 VUs  2m44.9s/4m00.0s

running (2m45.9s), 113/150 VUs, 9995 complete and 0 interrupted iterations
default   [  69% ] 113/150 VUs  2m45.9s/4m00.0s

running (2m46.9s), 114/150 VUs, 10089 complete and 0 interrupted iterations
default   [  70% ] 114/150 VUs  2m46.9s/4m00.0s

running (2m47.9s), 114/150 VUs, 10184 complete and 0 interrupted iterations
default   [  70% ] 114/150 VUs  2m47.9s/4m00.0s

running (2m48.9s), 115/150 VUs, 10278 complete and 0 interrupted iterations
default   [  70% ] 115/150 VUs  2m48.9s/4m00.0s

running (2m49.9s), 116/150 VUs, 10375 complete and 0 interrupted iterations
default   [  71% ] 116/150 VUs  2m49.9s/4m00.0s

running (2m50.9s), 117/150 VUs, 10469 complete and 0 interrupted iterations
default   [  71% ] 117/150 VUs  2m50.9s/4m00.0s

running (2m51.9s), 118/150 VUs, 10560 complete and 0 interrupted iterations
default   [  72% ] 118/150 VUs  2m51.9s/4m00.0s

running (2m52.9s), 119/150 VUs, 10655 complete and 0 interrupted iterations
default   [  72% ] 119/150 VUs  2m52.9s/4m00.0s

running (2m53.9s), 119/150 VUs, 10750 complete and 0 interrupted iterations
default   [  72% ] 119/150 VUs  2m53.9s/4m00.0s

running (2m54.9s), 120/150 VUs, 10845 complete and 0 interrupted iterations
default   [  73% ] 120/150 VUs  2m54.9s/4m00.0s

running (2m55.9s), 121/150 VUs, 10943 complete and 0 interrupted iterations
default   [  73% ] 121/150 VUs  2m55.9s/4m00.0s

running (2m56.9s), 122/150 VUs, 11010 complete and 0 interrupted iterations
default   [  74% ] 122/150 VUs  2m56.9s/4m00.0s

running (2m57.9s), 123/150 VUs, 11059 complete and 0 interrupted iterations
default   [  74% ] 123/150 VUs  2m57.9s/4m00.0s

running (2m58.9s), 124/150 VUs, 11149 complete and 0 interrupted iterations
default   [  75% ] 124/150 VUs  2m58.9s/4m00.0s

running (2m59.9s), 124/150 VUs, 11238 complete and 0 interrupted iterations
default   [  75% ] 124/150 VUs  2m59.9s/4m00.0s

running (3m00.9s), 125/150 VUs, 11317 complete and 0 interrupted iterations
default   [  75% ] 125/150 VUs  3m00.9s/4m00.0s

running (3m01.9s), 126/150 VUs, 11366 complete and 0 interrupted iterations
default   [  76% ] 126/150 VUs  3m01.9s/4m00.0s

running (3m02.9s), 127/150 VUs, 11433 complete and 0 interrupted iterations
default   [  76% ] 127/150 VUs  3m02.9s/4m00.0s

running (3m03.9s), 128/150 VUs, 11472 complete and 0 interrupted iterations
default   [  77% ] 128/150 VUs  3m03.9s/4m00.0s

running (3m04.9s), 129/150 VUs, 11531 complete and 0 interrupted iterations
default   [  77% ] 129/150 VUs  3m04.9s/4m00.0s

running (3m05.9s), 129/150 VUs, 11600 complete and 0 interrupted iterations
default   [  77% ] 129/150 VUs  3m05.9s/4m00.0s

running (3m06.9s), 130/150 VUs, 11665 complete and 0 interrupted iterations
default   [  78% ] 130/150 VUs  3m06.9s/4m00.0s

running (3m07.9s), 131/150 VUs, 11720 complete and 0 interrupted iterations
default   [  78% ] 131/150 VUs  3m07.9s/4m00.0s

running (3m08.9s), 132/150 VUs, 11796 complete and 0 interrupted iterations
default   [  79% ] 132/150 VUs  3m08.9s/4m00.0s

running (3m09.9s), 133/150 VUs, 11858 complete and 0 interrupted iterations
default   [  79% ] 133/150 VUs  3m09.9s/4m00.0s

running (3m10.9s), 134/150 VUs, 11904 complete and 0 interrupted iterations
default   [  80% ] 134/150 VUs  3m10.9s/4m00.0s

running (10m54.8s), 134/150 VUs, 11971 complete and 0 interrupted iterations
default   [  80% ] 134/150 VUs  3m11.9s/4m00.0s

running (10m55.8s), 135/150 VUs, 12067 complete and 0 interrupted iterations
default   [  80% ] 135/150 VUs  3m12.9s/4m00.0s

running (10m56.8s), 136/150 VUs, 12157 complete and 0 interrupted iterations
default   [  81% ] 136/150 VUs  3m13.9s/4m00.0s

running (10m57.8s), 137/150 VUs, 12247 complete and 0 interrupted iterations
default   [  81% ] 137/150 VUs  3m14.9s/4m00.0s

running (10m58.8s), 138/150 VUs, 12337 complete and 0 interrupted iterations
default   [  82% ] 138/150 VUs  3m15.9s/4m00.0s

running (10m59.8s), 139/150 VUs, 12430 complete and 0 interrupted iterations
default   [  82% ] 139/150 VUs  3m16.9s/4m00.0s

running (11m00.8s), 139/150 VUs, 12527 complete and 0 interrupted iterations
default   [  82% ] 139/150 VUs  3m17.9s/4m00.0s

running (11m01.8s), 140/150 VUs, 12620 complete and 0 interrupted iterations
default   [  83% ] 140/150 VUs  3m18.9s/4m00.0s

running (11m02.8s), 141/150 VUs, 12717 complete and 0 interrupted iterations
default   [  83% ] 141/150 VUs  3m19.9s/4m00.0s

running (11m03.8s), 142/150 VUs, 12807 complete and 0 interrupted iterations
default   [  84% ] 142/150 VUs  3m20.9s/4m00.0s

running (11m04.8s), 143/150 VUs, 12898 complete and 0 interrupted iterations
default   [  84% ] 143/150 VUs  3m21.9s/4m00.0s

running (11m05.8s), 144/150 VUs, 12997 complete and 0 interrupted iterations
default   [  85% ] 144/150 VUs  3m22.9s/4m00.0s

running (11m06.8s), 144/150 VUs, 13088 complete and 0 interrupted iterations
default   [  85% ] 144/150 VUs  3m23.9s/4m00.0s

running (11m07.8s), 145/150 VUs, 13186 complete and 0 interrupted iterations
default   [  85% ] 145/150 VUs  3m24.9s/4m00.0s

running (11m08.8s), 146/150 VUs, 13268 complete and 0 interrupted iterations
default   [  86% ] 146/150 VUs  3m25.9s/4m00.0s

running (11m09.8s), 147/150 VUs, 13366 complete and 0 interrupted iterations
default   [  86% ] 147/150 VUs  3m26.9s/4m00.0s

running (11m10.8s), 148/150 VUs, 13438 complete and 0 interrupted iterations
default   [  87% ] 148/150 VUs  3m27.9s/4m00.0s

running (11m11.8s), 149/150 VUs, 13513 complete and 0 interrupted iterations
default   [  87% ] 149/150 VUs  3m28.9s/4m00.0s

running (11m12.8s), 149/150 VUs, 13607 complete and 0 interrupted iterations
default   [  87% ] 149/150 VUs  3m29.9s/4m00.0s

running (11m13.8s), 150/150 VUs, 13701 complete and 0 interrupted iterations
default   [  88% ] 150/150 VUs  3m30.9s/4m00.0s

running (11m14.8s), 147/150 VUs, 13798 complete and 0 interrupted iterations
default   [  88% ] 147/150 VUs  3m31.9s/4m00.0s

running (11m15.8s), 139/150 VUs, 13894 complete and 0 interrupted iterations
default   [  89% ] 139/150 VUs  3m32.9s/4m00.0s

running (11m16.8s), 134/150 VUs, 13988 complete and 0 interrupted iterations
default   [  89% ] 134/150 VUs  3m33.9s/4m00.0s

running (11m17.8s), 131/150 VUs, 14071 complete and 0 interrupted iterations
default   [  90% ] 131/150 VUs  3m34.9s/4m00.0s

running (11m18.8s), 124/150 VUs, 14160 complete and 0 interrupted iterations
default   [  90% ] 124/150 VUs  3m35.9s/4m00.0s

running (11m19.8s), 121/150 VUs, 14254 complete and 0 interrupted iterations
default   [  90% ] 121/150 VUs  3m36.9s/4m00.0s

running (11m20.8s), 115/150 VUs, 14344 complete and 0 interrupted iterations
default   [  91% ] 115/150 VUs  3m37.9s/4m00.0s

running (11m21.8s), 108/150 VUs, 14431 complete and 0 interrupted iterations
default   [  91% ] 108/150 VUs  3m38.9s/4m00.0s

running (11m22.8s), 104/150 VUs, 14519 complete and 0 interrupted iterations
default   [  92% ] 104/150 VUs  3m39.9s/4m00.0s

running (11m23.8s), 098/150 VUs, 14610 complete and 0 interrupted iterations
default   [  92% ] 098/150 VUs  3m40.9s/4m00.0s

running (11m24.8s), 095/150 VUs, 14683 complete and 0 interrupted iterations
default   [  92% ] 095/150 VUs  3m41.9s/4m00.0s

running (11m25.8s), 089/150 VUs, 14757 complete and 0 interrupted iterations
default   [  93% ] 089/150 VUs  3m42.9s/4m00.0s

running (11m26.8s), 083/150 VUs, 14845 complete and 0 interrupted iterations
default   [  93% ] 083/150 VUs  3m43.9s/4m00.0s

running (11m27.8s), 079/150 VUs, 14935 complete and 0 interrupted iterations
default   [  94% ] 079/150 VUs  3m44.9s/4m00.0s

running (11m28.8s), 074/150 VUs, 15031 complete and 0 interrupted iterations
default   [  94% ] 074/150 VUs  3m45.9s/4m00.0s

running (11m29.8s), 069/150 VUs, 15123 complete and 0 interrupted iterations
default   [  95% ] 069/150 VUs  3m46.9s/4m00.0s

running (11m30.8s), 065/150 VUs, 15215 complete and 0 interrupted iterations
default   [  95% ] 065/150 VUs  3m47.9s/4m00.0s

running (11m31.8s), 058/150 VUs, 15309 complete and 0 interrupted iterations
default   [  95% ] 058/150 VUs  3m48.9s/4m00.0s

running (11m32.8s), 052/150 VUs, 15398 complete and 0 interrupted iterations
default   [  96% ] 052/150 VUs  3m49.9s/4m00.0s

running (11m33.8s), 047/150 VUs, 15483 complete and 0 interrupted iterations
default   [  96% ] 047/150 VUs  3m50.9s/4m00.0s

running (11m34.8s), 043/150 VUs, 15555 complete and 0 interrupted iterations
default   [  97% ] 043/150 VUs  3m51.9s/4m00.0s

running (11m35.8s), 039/150 VUs, 15625 complete and 0 interrupted iterations
default   [  97% ] 039/150 VUs  3m52.9s/4m00.0s

running (11m36.8s), 032/150 VUs, 15683 complete and 0 interrupted iterations
default   [  97% ] 032/150 VUs  3m53.9s/4m00.0s

running (11m37.8s), 026/150 VUs, 15734 complete and 0 interrupted iterations
default   [  98% ] 026/150 VUs  3m54.9s/4m00.0s

running (11m38.8s), 023/150 VUs, 15780 complete and 0 interrupted iterations
default   [  98% ] 023/150 VUs  3m55.9s/4m00.0s

running (11m39.8s), 017/150 VUs, 15813 complete and 0 interrupted iterations
default   [  99% ] 017/150 VUs  3m56.9s/4m00.0s

running (11m40.8s), 012/150 VUs, 15841 complete and 0 interrupted iterations
default   [  99% ] 012/150 VUs  3m57.9s/4m00.0s

running (11m41.8s), 007/150 VUs, 15858 complete and 0 interrupted iterations
default   [ 100% ] 007/150 VUs  3m58.9s/4m00.0s

running (11m42.8s), 003/150 VUs, 15869 complete and 0 interrupted iterations
default   [ 100% ] 003/150 VUs  3m59.9s/4m00.0s


  █ THRESHOLDS 

    http_req_duration
    ✗ 'p(95)<1000' p(95)=1.02s
    ✓ 'p(99)<2000' p(99)=1.45s

    http_req_failed
    ✓ 'rate<0.05' rate=0.00%


  █ TOTAL RESULTS 

    checks_total.......: 31744   45.142946/s
    checks_succeeded...: 100.00% 31744 out of 31744
    checks_failed......: 0.00%   0 out of 31744

    ✓ a: status 200
    ✓ b: status 200

    HTTP
    http_req_duration..............: avg=1.6s  min=2.08ms   med=106.68ms max=7m43s p(90)=866.21ms p(95)=1.02s
      { expected_response:true }...: avg=1.6s  min=2.08ms   med=106.68ms max=7m43s p(90)=866.21ms p(95)=1.02s
    http_req_failed................: 0.00%  0 out of 31744
    http_reqs......................: 31744  45.142946/s

    EXECUTION
    iteration_duration.............: avg=1.02s min=607.66ms med=914.83ms max=3.01s p(90)=1.55s    p(95)=1.88s
    iterations.....................: 15872  22.571473/s
    vus............................: 2      min=1          max=150
    vus_max........................: 150    min=150        max=150

    NETWORK
    data_received..................: 9.8 MB 14 kB/s
    data_sent......................: 3.0 MB 4.3 kB/s




running (11m43.2s), 000/150 VUs, 15872 complete and 0 interrupted iterations
default ✓ [ 100% ] 000/150 VUs  4m0s
