
         /\      Grafana   /‾‾/  
    /\  /  \     |\  __   /  /   
   /  \/    \    | |/ /  /   ‾‾\ 
  /          \   |   (  |  (‾)  |
 / __________ \  |_|\_\  \_____/ 

     execution: local
        script: /home/edilberto/pspd/atividade-final-pspd/load/ramp.js
        output: json (/home/edilberto/pspd/atividade-final-pspd/results/ramp/metrics.json)

     scenarios: (100.00%) 1 scenario, 150 max VUs, 4m30s max duration (incl. graceful stop):
              * default: Up to 150 looping VUs for 4m0s over 5 stages (gracefulRampDown: 30s, gracefulStop: 30s)


running (0m01.0s), 001/150 VUs, 1 complete and 0 interrupted iterations
default   [   0% ] 001/150 VUs  0m01.0s/4m00.0s

running (0m02.0s), 001/150 VUs, 3 complete and 0 interrupted iterations
default   [   1% ] 001/150 VUs  0m02.0s/4m00.0s

running (0m03.0s), 001/150 VUs, 4 complete and 0 interrupted iterations
default   [   1% ] 001/150 VUs  0m03.0s/4m00.0s

running (0m04.0s), 002/150 VUs, 7 complete and 0 interrupted iterations
default   [   2% ] 002/150 VUs  0m04.0s/4m00.0s

running (0m05.0s), 002/150 VUs, 10 complete and 0 interrupted iterations
default   [   2% ] 002/150 VUs  0m05.0s/4m00.0s

running (0m06.0s), 002/150 VUs, 13 complete and 0 interrupted iterations
default   [   2% ] 002/150 VUs  0m06.0s/4m00.0s

running (0m07.0s), 003/150 VUs, 16 complete and 0 interrupted iterations
default   [   3% ] 003/150 VUs  0m07.0s/4m00.0s

running (0m08.0s), 003/150 VUs, 21 complete and 0 interrupted iterations
default   [   3% ] 003/150 VUs  0m08.0s/4m00.0s

running (0m09.0s), 003/150 VUs, 26 complete and 0 interrupted iterations
default   [   4% ] 003/150 VUs  0m09.0s/4m00.0s

running (0m10.0s), 003/150 VUs, 31 complete and 0 interrupted iterations
default   [   4% ] 003/150 VUs  0m10.0s/4m00.0s

running (0m11.0s), 004/150 VUs, 36 complete and 0 interrupted iterations
default   [   5% ] 004/150 VUs  0m11.0s/4m00.0s

running (0m12.0s), 004/150 VUs, 43 complete and 0 interrupted iterations
default   [   5% ] 004/150 VUs  0m12.0s/4m00.0s

running (0m13.0s), 004/150 VUs, 49 complete and 0 interrupted iterations
default   [   5% ] 004/150 VUs  0m13.0s/4m00.0s

running (0m14.0s), 005/150 VUs, 57 complete and 0 interrupted iterations
default   [   6% ] 005/150 VUs  0m14.0s/4m00.0s

running (0m15.0s), 005/150 VUs, 65 complete and 0 interrupted iterations
default   [   6% ] 005/150 VUs  0m15.0s/4m00.0s

running (0m16.0s), 005/150 VUs, 72 complete and 0 interrupted iterations
default   [   7% ] 005/150 VUs  0m16.0s/4m00.0s

running (0m17.0s), 006/150 VUs, 81 complete and 0 interrupted iterations
default   [   7% ] 006/150 VUs  0m17.0s/4m00.0s

running (0m18.0s), 006/150 VUs, 91 complete and 0 interrupted iterations
default   [   7% ] 006/150 VUs  0m18.0s/4m00.0s

running (0m19.0s), 006/150 VUs, 100 complete and 0 interrupted iterations
default   [   8% ] 006/150 VUs  0m19.0s/4m00.0s

running (0m20.0s), 006/150 VUs, 110 complete and 0 interrupted iterations
default   [   8% ] 006/150 VUs  0m20.0s/4m00.0s

running (0m21.0s), 007/150 VUs, 120 complete and 0 interrupted iterations
default   [   9% ] 007/150 VUs  0m21.0s/4m00.0s

running (0m22.0s), 007/150 VUs, 132 complete and 0 interrupted iterations
default   [   9% ] 007/150 VUs  0m22.0s/4m00.0s

running (0m23.0s), 007/150 VUs, 144 complete and 0 interrupted iterations
default   [  10% ] 007/150 VUs  0m23.0s/4m00.0s

running (0m24.0s), 008/150 VUs, 156 complete and 0 interrupted iterations
default   [  10% ] 008/150 VUs  0m24.0s/4m00.0s

running (0m25.0s), 008/150 VUs, 169 complete and 0 interrupted iterations
default   [  10% ] 008/150 VUs  0m25.0s/4m00.0s

running (0m26.0s), 008/150 VUs, 182 complete and 0 interrupted iterations
default   [  11% ] 008/150 VUs  0m26.0s/4m00.0s

running (0m27.0s), 009/150 VUs, 194 complete and 0 interrupted iterations
default   [  11% ] 009/150 VUs  0m27.0s/4m00.0s

running (0m28.0s), 009/150 VUs, 209 complete and 0 interrupted iterations
default   [  12% ] 009/150 VUs  0m28.0s/4m00.0s

running (0m29.0s), 009/150 VUs, 223 complete and 0 interrupted iterations
default   [  12% ] 009/150 VUs  0m29.0s/4m00.0s

running (0m30.0s), 009/150 VUs, 238 complete and 0 interrupted iterations
default   [  12% ] 009/150 VUs  0m30.0s/4m00.0s

running (0m31.0s), 010/150 VUs, 255 complete and 0 interrupted iterations
default   [  13% ] 010/150 VUs  0m31.0s/4m00.0s

running (0m32.0s), 011/150 VUs, 271 complete and 0 interrupted iterations
default   [  13% ] 011/150 VUs  0m32.0s/4m00.0s

running (0m33.0s), 011/150 VUs, 289 complete and 0 interrupted iterations
default   [  14% ] 011/150 VUs  0m33.0s/4m00.0s

running (0m34.0s), 012/150 VUs, 308 complete and 0 interrupted iterations
default   [  14% ] 012/150 VUs  0m34.0s/4m00.0s

running (0m35.0s), 013/150 VUs, 327 complete and 0 interrupted iterations
default   [  15% ] 013/150 VUs  0m35.0s/4m00.0s

running (0m36.0s), 013/150 VUs, 349 complete and 0 interrupted iterations
default   [  15% ] 013/150 VUs  0m36.0s/4m00.0s

running (0m37.0s), 014/150 VUs, 371 complete and 0 interrupted iterations
default   [  15% ] 014/150 VUs  0m37.0s/4m00.0s

running (0m38.0s), 015/150 VUs, 394 complete and 0 interrupted iterations
default   [  16% ] 015/150 VUs  0m38.0s/4m00.0s

running (0m39.0s), 015/150 VUs, 419 complete and 0 interrupted iterations
default   [  16% ] 015/150 VUs  0m39.0s/4m00.0s

running (0m40.0s), 016/150 VUs, 444 complete and 0 interrupted iterations
default   [  17% ] 016/150 VUs  0m40.0s/4m00.0s

running (0m41.0s), 017/150 VUs, 470 complete and 0 interrupted iterations
default   [  17% ] 017/150 VUs  0m41.0s/4m00.0s

running (0m42.0s), 017/150 VUs, 498 complete and 0 interrupted iterations
default   [  17% ] 017/150 VUs  0m42.0s/4m00.0s

running (0m43.0s), 018/150 VUs, 527 complete and 0 interrupted iterations
default   [  18% ] 018/150 VUs  0m43.0s/4m00.0s

running (0m44.0s), 019/150 VUs, 557 complete and 0 interrupted iterations
default   [  18% ] 019/150 VUs  0m44.0s/4m00.0s

running (0m45.0s), 019/150 VUs, 587 complete and 0 interrupted iterations
default   [  19% ] 019/150 VUs  0m45.0s/4m00.0s

running (0m46.0s), 020/150 VUs, 620 complete and 0 interrupted iterations
default   [  19% ] 020/150 VUs  0m46.0s/4m00.0s

running (0m47.0s), 021/150 VUs, 652 complete and 0 interrupted iterations
default   [  20% ] 021/150 VUs  0m47.0s/4m00.0s

running (0m48.0s), 021/150 VUs, 686 complete and 0 interrupted iterations
default   [  20% ] 021/150 VUs  0m48.0s/4m00.0s

running (0m49.0s), 022/150 VUs, 722 complete and 0 interrupted iterations
default   [  20% ] 022/150 VUs  0m49.0s/4m00.0s

running (0m50.0s), 023/150 VUs, 758 complete and 0 interrupted iterations
default   [  21% ] 023/150 VUs  0m50.0s/4m00.0s

running (0m51.0s), 023/150 VUs, 794 complete and 0 interrupted iterations
default   [  21% ] 023/150 VUs  0m51.0s/4m00.0s

running (0m52.0s), 024/150 VUs, 835 complete and 0 interrupted iterations
default   [  22% ] 024/150 VUs  0m52.0s/4m00.0s

running (0m53.0s), 025/150 VUs, 873 complete and 0 interrupted iterations
default   [  22% ] 025/150 VUs  0m53.0s/4m00.0s

running (0m54.0s), 025/150 VUs, 914 complete and 0 interrupted iterations
default   [  22% ] 025/150 VUs  0m54.0s/4m00.0s

running (0m55.0s), 026/150 VUs, 957 complete and 0 interrupted iterations
default   [  23% ] 026/150 VUs  0m55.0s/4m00.0s

running (0m56.0s), 027/150 VUs, 993 complete and 0 interrupted iterations
default   [  23% ] 027/150 VUs  0m56.0s/4m00.0s

running (0m57.0s), 027/150 VUs, 1042 complete and 0 interrupted iterations
default   [  24% ] 027/150 VUs  0m57.0s/4m00.0s

running (0m58.0s), 028/150 VUs, 1087 complete and 0 interrupted iterations
default   [  24% ] 028/150 VUs  0m58.0s/4m00.0s

running (0m59.0s), 029/150 VUs, 1131 complete and 0 interrupted iterations
default   [  25% ] 029/150 VUs  0m59.0s/4m00.0s

running (1m00.0s), 029/150 VUs, 1181 complete and 0 interrupted iterations
default   [  25% ] 029/150 VUs  1m00.0s/4m00.0s

running (1m01.0s), 030/150 VUs, 1226 complete and 0 interrupted iterations
default   [  25% ] 030/150 VUs  1m01.0s/4m00.0s

running (1m02.0s), 031/150 VUs, 1275 complete and 0 interrupted iterations
default   [  26% ] 031/150 VUs  1m02.0s/4m00.0s

running (1m03.0s), 031/150 VUs, 1324 complete and 0 interrupted iterations
default   [  26% ] 031/150 VUs  1m03.0s/4m00.0s

running (1m04.0s), 032/150 VUs, 1373 complete and 0 interrupted iterations
default   [  27% ] 032/150 VUs  1m04.0s/4m00.0s

running (1m05.0s), 033/150 VUs, 1429 complete and 0 interrupted iterations
default   [  27% ] 033/150 VUs  1m05.0s/4m00.0s

running (1m06.0s), 033/150 VUs, 1481 complete and 0 interrupted iterations
default   [  27% ] 033/150 VUs  1m06.0s/4m00.0s

running (1m07.0s), 034/150 VUs, 1535 complete and 0 interrupted iterations
default   [  28% ] 034/150 VUs  1m07.0s/4m00.0s

running (1m08.0s), 035/150 VUs, 1589 complete and 0 interrupted iterations
default   [  28% ] 035/150 VUs  1m08.0s/4m00.0s

running (1m09.0s), 035/150 VUs, 1644 complete and 0 interrupted iterations
default   [  29% ] 035/150 VUs  1m09.0s/4m00.0s

running (1m10.0s), 036/150 VUs, 1705 complete and 0 interrupted iterations
default   [  29% ] 036/150 VUs  1m10.0s/4m00.0s

running (1m11.0s), 037/150 VUs, 1760 complete and 0 interrupted iterations
default   [  30% ] 037/150 VUs  1m11.0s/4m00.0s

running (1m12.0s), 037/150 VUs, 1824 complete and 0 interrupted iterations
default   [  30% ] 037/150 VUs  1m12.0s/4m00.0s

running (1m13.0s), 038/150 VUs, 1881 complete and 0 interrupted iterations
default   [  30% ] 038/150 VUs  1m13.0s/4m00.0s

running (1m14.0s), 039/150 VUs, 1945 complete and 0 interrupted iterations
default   [  31% ] 039/150 VUs  1m14.0s/4m00.0s

running (1m15.0s), 039/150 VUs, 2011 complete and 0 interrupted iterations
default   [  31% ] 039/150 VUs  1m15.0s/4m00.0s

running (1m16.0s), 040/150 VUs, 2074 complete and 0 interrupted iterations
default   [  32% ] 040/150 VUs  1m16.0s/4m00.0s

running (1m17.0s), 041/150 VUs, 2140 complete and 0 interrupted iterations
default   [  32% ] 041/150 VUs  1m17.0s/4m00.0s

running (1m18.0s), 041/150 VUs, 2203 complete and 0 interrupted iterations
default   [  32% ] 041/150 VUs  1m18.0s/4m00.0s

running (1m19.0s), 042/150 VUs, 2270 complete and 0 interrupted iterations
default   [  33% ] 042/150 VUs  1m19.0s/4m00.0s

running (1m20.0s), 043/150 VUs, 2341 complete and 0 interrupted iterations
default   [  33% ] 043/150 VUs  1m20.0s/4m00.0s

running (1m21.0s), 043/150 VUs, 2409 complete and 0 interrupted iterations
default   [  34% ] 043/150 VUs  1m21.0s/4m00.0s

running (1m22.0s), 044/150 VUs, 2482 complete and 0 interrupted iterations
default   [  34% ] 044/150 VUs  1m22.0s/4m00.0s

running (1m23.0s), 045/150 VUs, 2550 complete and 0 interrupted iterations
default   [  35% ] 045/150 VUs  1m23.0s/4m00.0s

running (1m24.0s), 045/150 VUs, 2625 complete and 0 interrupted iterations
default   [  35% ] 045/150 VUs  1m24.0s/4m00.0s

running (1m25.0s), 046/150 VUs, 2692 complete and 0 interrupted iterations
default   [  35% ] 046/150 VUs  1m25.0s/4m00.0s

running (1m26.0s), 047/150 VUs, 2767 complete and 0 interrupted iterations
default   [  36% ] 047/150 VUs  1m26.0s/4m00.0s

running (1m27.0s), 047/150 VUs, 2832 complete and 0 interrupted iterations
default   [  36% ] 047/150 VUs  1m27.0s/4m00.0s

running (1m28.0s), 048/150 VUs, 2894 complete and 0 interrupted iterations
default   [  37% ] 048/150 VUs  1m28.0s/4m00.0s

running (1m29.0s), 049/150 VUs, 2968 complete and 0 interrupted iterations
default   [  37% ] 049/150 VUs  1m29.0s/4m00.0s

running (1m30.0s), 049/150 VUs, 3041 complete and 0 interrupted iterations
default   [  37% ] 049/150 VUs  1m30.0s/4m00.0s

running (1m31.0s), 050/150 VUs, 3122 complete and 0 interrupted iterations
default   [  38% ] 050/150 VUs  1m31.0s/4m00.0s

running (1m32.0s), 051/150 VUs, 3198 complete and 0 interrupted iterations
default   [  38% ] 051/150 VUs  1m32.0s/4m00.0s

running (1m33.0s), 052/150 VUs, 3284 complete and 0 interrupted iterations
default   [  39% ] 052/150 VUs  1m33.0s/4m00.0s

running (1m34.0s), 053/150 VUs, 3365 complete and 0 interrupted iterations
default   [  39% ] 053/150 VUs  1m34.0s/4m00.0s

running (1m35.0s), 054/150 VUs, 3450 complete and 0 interrupted iterations
default   [  40% ] 054/150 VUs  1m35.0s/4m00.0s

running (1m36.0s), 054/150 VUs, 3533 complete and 0 interrupted iterations
default   [  40% ] 054/150 VUs  1m36.0s/4m00.0s

running (1m37.0s), 055/150 VUs, 3618 complete and 0 interrupted iterations
default   [  40% ] 055/150 VUs  1m37.0s/4m00.0s

running (1m38.0s), 056/150 VUs, 3702 complete and 0 interrupted iterations
default   [  41% ] 056/150 VUs  1m38.0s/4m00.0s

running (1m39.0s), 057/150 VUs, 3793 complete and 0 interrupted iterations
default   [  41% ] 057/150 VUs  1m39.0s/4m00.0s

running (1m40.0s), 058/150 VUs, 3880 complete and 0 interrupted iterations
default   [  42% ] 058/150 VUs  1m40.0s/4m00.0s

running (1m41.0s), 059/150 VUs, 3971 complete and 0 interrupted iterations
default   [  42% ] 059/150 VUs  1m41.0s/4m00.0s

running (1m42.0s), 059/150 VUs, 4067 complete and 0 interrupted iterations
default   [  42% ] 059/150 VUs  1m42.0s/4m00.0s

running (1m43.0s), 060/150 VUs, 4160 complete and 0 interrupted iterations
default   [  43% ] 060/150 VUs  1m43.0s/4m00.0s

running (1m44.0s), 061/150 VUs, 4246 complete and 0 interrupted iterations
default   [  43% ] 061/150 VUs  1m44.0s/4m00.0s

running (1m45.0s), 062/150 VUs, 4337 complete and 0 interrupted iterations
default   [  44% ] 062/150 VUs  1m45.0s/4m00.0s

running (1m46.0s), 063/150 VUs, 4429 complete and 0 interrupted iterations
default   [  44% ] 063/150 VUs  1m46.0s/4m00.0s

running (1m47.0s), 064/150 VUs, 4526 complete and 0 interrupted iterations
default   [  45% ] 064/150 VUs  1m47.0s/4m00.0s

running (1m48.0s), 064/150 VUs, 4616 complete and 0 interrupted iterations
default   [  45% ] 064/150 VUs  1m48.0s/4m00.0s

running (1m49.0s), 065/150 VUs, 4709 complete and 0 interrupted iterations
default   [  45% ] 065/150 VUs  1m49.0s/4m00.0s

running (1m50.0s), 066/150 VUs, 4801 complete and 0 interrupted iterations
default   [  46% ] 066/150 VUs  1m50.0s/4m00.0s

running (1m51.0s), 067/150 VUs, 4896 complete and 0 interrupted iterations
default   [  46% ] 067/150 VUs  1m51.0s/4m00.0s

running (1m52.0s), 068/150 VUs, 4988 complete and 0 interrupted iterations
default   [  47% ] 068/150 VUs  1m52.0s/4m00.0s

running (1m53.0s), 069/150 VUs, 5080 complete and 0 interrupted iterations
default   [  47% ] 069/150 VUs  1m53.0s/4m00.0s

running (1m54.0s), 069/150 VUs, 5168 complete and 0 interrupted iterations
default   [  47% ] 069/150 VUs  1m54.0s/4m00.0s

running (1m55.0s), 070/150 VUs, 5267 complete and 0 interrupted iterations
default   [  48% ] 070/150 VUs  1m55.0s/4m00.0s

running (1m56.0s), 071/150 VUs, 5357 complete and 0 interrupted iterations
default   [  48% ] 071/150 VUs  1m56.0s/4m00.0s

running (1m57.0s), 072/150 VUs, 5444 complete and 0 interrupted iterations
default   [  49% ] 072/150 VUs  1m57.0s/4m00.0s

running (1m58.0s), 073/150 VUs, 5533 complete and 0 interrupted iterations
default   [  49% ] 073/150 VUs  1m58.0s/4m00.0s

running (1m59.0s), 074/150 VUs, 5626 complete and 0 interrupted iterations
default   [  50% ] 074/150 VUs  1m59.0s/4m00.0s

running (2m00.0s), 074/150 VUs, 5718 complete and 0 interrupted iterations
default   [  50% ] 074/150 VUs  2m00.0s/4m00.0s

running (2m01.0s), 075/150 VUs, 5814 complete and 0 interrupted iterations
default   [  50% ] 075/150 VUs  2m01.0s/4m00.0s

running (2m02.0s), 076/150 VUs, 5908 complete and 0 interrupted iterations
default   [  51% ] 076/150 VUs  2m02.0s/4m00.0s

running (2m03.0s), 077/150 VUs, 6002 complete and 0 interrupted iterations
default   [  51% ] 077/150 VUs  2m03.0s/4m00.0s

running (2m04.0s), 078/150 VUs, 6098 complete and 0 interrupted iterations
default   [  52% ] 078/150 VUs  2m04.0s/4m00.0s

running (2m05.0s), 079/150 VUs, 6151 complete and 0 interrupted iterations
default   [  52% ] 079/150 VUs  2m05.0s/4m00.0s

running (2m06.0s), 079/150 VUs, 6160 complete and 0 interrupted iterations
default   [  52% ] 079/150 VUs  2m06.0s/4m00.0s

running (2m07.0s), 080/150 VUs, 6160 complete and 0 interrupted iterations
default   [  53% ] 080/150 VUs  2m07.0s/4m00.0s

running (2m08.0s), 081/150 VUs, 6160 complete and 0 interrupted iterations
default   [  53% ] 081/150 VUs  2m08.0s/4m00.0s

running (2m09.0s), 082/150 VUs, 6160 complete and 0 interrupted iterations
default   [  54% ] 082/150 VUs  2m09.0s/4m00.0s

running (2m10.0s), 083/150 VUs, 6160 complete and 0 interrupted iterations
default   [  54% ] 083/150 VUs  2m10.0s/4m00.0s

running (2m11.0s), 084/150 VUs, 6160 complete and 0 interrupted iterations
default   [  55% ] 084/150 VUs  2m11.0s/4m00.0s

running (2m12.0s), 084/150 VUs, 6160 complete and 0 interrupted iterations
default   [  55% ] 084/150 VUs  2m12.0s/4m00.0s

running (2m13.0s), 085/150 VUs, 6160 complete and 0 interrupted iterations
default   [  55% ] 085/150 VUs  2m13.0s/4m00.0s

running (2m14.0s), 086/150 VUs, 6160 complete and 0 interrupted iterations
default   [  56% ] 086/150 VUs  2m14.0s/4m00.0s

running (2m15.0s), 087/150 VUs, 6160 complete and 0 interrupted iterations
default   [  56% ] 087/150 VUs  2m15.0s/4m00.0s

running (2m16.0s), 088/150 VUs, 6160 complete and 0 interrupted iterations
default   [  57% ] 088/150 VUs  2m16.0s/4m00.0s

running (2m17.0s), 089/150 VUs, 6160 complete and 0 interrupted iterations
default   [  57% ] 089/150 VUs  2m17.0s/4m00.0s

running (2m18.0s), 089/150 VUs, 6160 complete and 0 interrupted iterations
default   [  57% ] 089/150 VUs  2m18.0s/4m00.0s

running (2m19.0s), 090/150 VUs, 6160 complete and 0 interrupted iterations
default   [  58% ] 090/150 VUs  2m19.0s/4m00.0s

running (2m20.0s), 091/150 VUs, 6160 complete and 0 interrupted iterations
default   [  58% ] 091/150 VUs  2m20.0s/4m00.0s

running (2m21.0s), 092/150 VUs, 6160 complete and 0 interrupted iterations
default   [  59% ] 092/150 VUs  2m21.0s/4m00.0s

running (2m22.0s), 093/150 VUs, 6160 complete and 0 interrupted iterations
default   [  59% ] 093/150 VUs  2m22.0s/4m00.0s

running (2m23.0s), 094/150 VUs, 6160 complete and 0 interrupted iterations
default   [  60% ] 094/150 VUs  2m23.0s/4m00.0s

running (2m24.0s), 094/150 VUs, 6160 complete and 0 interrupted iterations
default   [  60% ] 094/150 VUs  2m24.0s/4m00.0s

running (2m25.0s), 095/150 VUs, 6160 complete and 0 interrupted iterations
default   [  60% ] 095/150 VUs  2m25.0s/4m00.0s

running (2m26.0s), 096/150 VUs, 6160 complete and 0 interrupted iterations
default   [  61% ] 096/150 VUs  2m26.0s/4m00.0s

running (2m27.0s), 097/150 VUs, 6160 complete and 0 interrupted iterations
default   [  61% ] 097/150 VUs  2m27.0s/4m00.0s

running (2m28.0s), 098/150 VUs, 6160 complete and 0 interrupted iterations
default   [  62% ] 098/150 VUs  2m28.0s/4m00.0s

running (2m29.0s), 099/150 VUs, 6160 complete and 0 interrupted iterations
default   [  62% ] 099/150 VUs  2m29.0s/4m00.0s

running (2m30.0s), 099/150 VUs, 6160 complete and 0 interrupted iterations
default   [  62% ] 099/150 VUs  2m30.0s/4m00.0s

running (2m31.0s), 100/150 VUs, 6160 complete and 0 interrupted iterations
default   [  63% ] 100/150 VUs  2m31.0s/4m00.0s

running (2m32.0s), 101/150 VUs, 6160 complete and 0 interrupted iterations
default   [  63% ] 101/150 VUs  2m32.0s/4m00.0s

running (2m33.0s), 102/150 VUs, 6160 complete and 0 interrupted iterations
default   [  64% ] 102/150 VUs  2m33.0s/4m00.0s

running (2m34.0s), 103/150 VUs, 6160 complete and 0 interrupted iterations
default   [  64% ] 103/150 VUs  2m34.0s/4m00.0s

running (2m35.0s), 104/150 VUs, 6160 complete and 0 interrupted iterations
default   [  65% ] 104/150 VUs  2m35.0s/4m00.0s

running (2m36.0s), 104/150 VUs, 6185 complete and 0 interrupted iterations
default   [  65% ] 104/150 VUs  2m36.0s/4m00.0s

running (2m37.0s), 105/150 VUs, 6185 complete and 0 interrupted iterations
default   [  65% ] 105/150 VUs  2m37.0s/4m00.0s

running (2m38.0s), 106/150 VUs, 6185 complete and 0 interrupted iterations
default   [  66% ] 106/150 VUs  2m38.0s/4m00.0s

running (2m39.0s), 107/150 VUs, 6185 complete and 0 interrupted iterations
default   [  66% ] 107/150 VUs  2m39.0s/4m00.0s

running (2m40.0s), 108/150 VUs, 6185 complete and 0 interrupted iterations
default   [  67% ] 108/150 VUs  2m40.0s/4m00.0s

running (2m41.0s), 109/150 VUs, 6185 complete and 0 interrupted iterations
default   [  67% ] 109/150 VUs  2m41.0s/4m00.0s

running (2m42.0s), 109/150 VUs, 6185 complete and 0 interrupted iterations
default   [  67% ] 109/150 VUs  2m42.0s/4m00.0s

running (2m43.0s), 110/150 VUs, 6185 complete and 0 interrupted iterations
default   [  68% ] 110/150 VUs  2m43.0s/4m00.0s

running (2m44.0s), 111/150 VUs, 6185 complete and 0 interrupted iterations
default   [  68% ] 111/150 VUs  2m44.0s/4m00.0s

running (2m45.0s), 112/150 VUs, 6185 complete and 0 interrupted iterations
default   [  69% ] 112/150 VUs  2m45.0s/4m00.0s

running (2m46.0s), 113/150 VUs, 6185 complete and 0 interrupted iterations
default   [  69% ] 113/150 VUs  2m46.0s/4m00.0s

running (2m47.0s), 114/150 VUs, 6185 complete and 0 interrupted iterations
default   [  70% ] 114/150 VUs  2m47.0s/4m00.0s

running (2m48.0s), 114/150 VUs, 6185 complete and 0 interrupted iterations
default   [  70% ] 114/150 VUs  2m48.0s/4m00.0s

running (2m49.0s), 115/150 VUs, 6185 complete and 0 interrupted iterations
default   [  70% ] 115/150 VUs  2m49.0s/4m00.0s

running (2m50.0s), 116/150 VUs, 6185 complete and 0 interrupted iterations
default   [  71% ] 116/150 VUs  2m50.0s/4m00.0s

running (2m51.0s), 117/150 VUs, 6185 complete and 0 interrupted iterations
default   [  71% ] 117/150 VUs  2m51.0s/4m00.0s

running (2m52.0s), 118/150 VUs, 6185 complete and 0 interrupted iterations
default   [  72% ] 118/150 VUs  2m52.0s/4m00.0s

running (2m53.0s), 119/150 VUs, 6185 complete and 0 interrupted iterations
default   [  72% ] 119/150 VUs  2m53.0s/4m00.0s

running (2m54.0s), 119/150 VUs, 6185 complete and 0 interrupted iterations
default   [  72% ] 119/150 VUs  2m54.0s/4m00.0s

running (2m55.0s), 120/150 VUs, 6185 complete and 0 interrupted iterations
default   [  73% ] 120/150 VUs  2m55.0s/4m00.0s

running (2m56.0s), 121/150 VUs, 6185 complete and 0 interrupted iterations
default   [  73% ] 121/150 VUs  2m56.0s/4m00.0s

running (2m57.0s), 122/150 VUs, 6185 complete and 0 interrupted iterations
default   [  74% ] 122/150 VUs  2m57.0s/4m00.0s

running (2m58.0s), 123/150 VUs, 6185 complete and 0 interrupted iterations
default   [  74% ] 123/150 VUs  2m58.0s/4m00.0s

running (2m59.0s), 124/150 VUs, 6185 complete and 0 interrupted iterations
default   [  75% ] 124/150 VUs  2m59.0s/4m00.0s

running (3m00.0s), 124/150 VUs, 6185 complete and 0 interrupted iterations
default   [  75% ] 124/150 VUs  3m00.0s/4m00.0s

running (3m01.0s), 125/150 VUs, 6185 complete and 0 interrupted iterations
default   [  75% ] 125/150 VUs  3m01.0s/4m00.0s

running (3m02.0s), 126/150 VUs, 6185 complete and 0 interrupted iterations
default   [  76% ] 126/150 VUs  3m02.0s/4m00.0s

running (3m03.0s), 127/150 VUs, 6185 complete and 0 interrupted iterations
default   [  76% ] 127/150 VUs  3m03.0s/4m00.0s

running (3m04.0s), 128/150 VUs, 6185 complete and 0 interrupted iterations
default   [  77% ] 128/150 VUs  3m04.0s/4m00.0s

running (3m05.0s), 129/150 VUs, 6185 complete and 0 interrupted iterations
default   [  77% ] 129/150 VUs  3m05.0s/4m00.0s

running (3m06.0s), 129/150 VUs, 6239 complete and 0 interrupted iterations
default   [  77% ] 129/150 VUs  3m06.0s/4m00.0s

running (3m07.0s), 130/150 VUs, 6240 complete and 0 interrupted iterations
default   [  78% ] 130/150 VUs  3m07.0s/4m00.0s

running (3m08.0s), 131/150 VUs, 6241 complete and 0 interrupted iterations
default   [  78% ] 131/150 VUs  3m08.0s/4m00.0s

running (3m09.0s), 132/150 VUs, 6242 complete and 0 interrupted iterations
default   [  79% ] 132/150 VUs  3m09.0s/4m00.0s

running (3m10.0s), 133/150 VUs, 6242 complete and 0 interrupted iterations
default   [  79% ] 133/150 VUs  3m10.0s/4m00.0s

running (3m11.0s), 134/150 VUs, 6243 complete and 0 interrupted iterations
default   [  80% ] 134/150 VUs  3m11.0s/4m00.0s

running (3m12.0s), 134/150 VUs, 6244 complete and 0 interrupted iterations
default   [  80% ] 134/150 VUs  3m12.0s/4m00.0s

running (3m13.0s), 135/150 VUs, 6245 complete and 0 interrupted iterations
default   [  80% ] 135/150 VUs  3m13.0s/4m00.0s

running (3m14.0s), 136/150 VUs, 6246 complete and 0 interrupted iterations
default   [  81% ] 136/150 VUs  3m14.0s/4m00.0s

running (3m15.0s), 137/150 VUs, 6247 complete and 0 interrupted iterations
default   [  81% ] 137/150 VUs  3m15.0s/4m00.0s

running (3m16.0s), 138/150 VUs, 6247 complete and 0 interrupted iterations
default   [  82% ] 138/150 VUs  3m16.0s/4m00.0s

running (3m17.0s), 139/150 VUs, 6248 complete and 0 interrupted iterations
default   [  82% ] 139/150 VUs  3m17.0s/4m00.0s

running (3m18.0s), 139/150 VUs, 6249 complete and 0 interrupted iterations
default   [  82% ] 139/150 VUs  3m18.0s/4m00.0s

running (3m19.0s), 140/150 VUs, 6250 complete and 0 interrupted iterations
default   [  83% ] 140/150 VUs  3m19.0s/4m00.0s

running (3m20.0s), 141/150 VUs, 6251 complete and 0 interrupted iterations
default   [  83% ] 141/150 VUs  3m20.0s/4m00.0s

running (3m21.0s), 142/150 VUs, 6252 complete and 0 interrupted iterations
default   [  84% ] 142/150 VUs  3m21.0s/4m00.0s

running (3m22.0s), 143/150 VUs, 6252 complete and 0 interrupted iterations
default   [  84% ] 143/150 VUs  3m22.0s/4m00.0s

running (3m23.0s), 144/150 VUs, 6253 complete and 0 interrupted iterations
default   [  85% ] 144/150 VUs  3m23.0s/4m00.0s

running (3m24.0s), 144/150 VUs, 6254 complete and 0 interrupted iterations
default   [  85% ] 144/150 VUs  3m24.0s/4m00.0s

running (3m25.0s), 145/150 VUs, 6255 complete and 0 interrupted iterations
default   [  85% ] 145/150 VUs  3m25.0s/4m00.0s

running (3m26.0s), 146/150 VUs, 6256 complete and 0 interrupted iterations
default   [  86% ] 146/150 VUs  3m26.0s/4m00.0s

running (3m27.0s), 147/150 VUs, 6257 complete and 0 interrupted iterations
default   [  86% ] 147/150 VUs  3m27.0s/4m00.0s

running (3m28.0s), 148/150 VUs, 6257 complete and 0 interrupted iterations
default   [  87% ] 148/150 VUs  3m28.0s/4m00.0s

running (3m29.0s), 149/150 VUs, 6258 complete and 0 interrupted iterations
default   [  87% ] 149/150 VUs  3m29.0s/4m00.0s

running (3m30.0s), 149/150 VUs, 6259 complete and 0 interrupted iterations
default   [  87% ] 149/150 VUs  3m30.0s/4m00.0s

running (3m31.0s), 150/150 VUs, 6260 complete and 0 interrupted iterations
default   [  88% ] 150/150 VUs  3m31.0s/4m00.0s

running (3m32.0s), 150/150 VUs, 6261 complete and 0 interrupted iterations
default   [  88% ] 150/150 VUs  3m32.0s/4m00.0s

running (3m33.1s), 150/150 VUs, 6262 complete and 0 interrupted iterations
default   [  89% ] 150/150 VUs  3m33.0s/4m00.0s

running (3m34.1s), 150/150 VUs, 6262 complete and 0 interrupted iterations
default   [  89% ] 150/150 VUs  3m34.0s/4m00.0s

running (3m35.1s), 150/150 VUs, 6263 complete and 0 interrupted iterations
default   [  90% ] 150/150 VUs  3m35.0s/4m00.0s

running (3m36.1s), 150/150 VUs, 6289 complete and 0 interrupted iterations
default   [  90% ] 150/150 VUs  3m36.0s/4m00.0s

running (3m37.1s), 150/150 VUs, 6290 complete and 0 interrupted iterations
default   [  90% ] 150/150 VUs  3m37.0s/4m00.0s

running (3m38.1s), 150/150 VUs, 6291 complete and 0 interrupted iterations
default   [  91% ] 150/150 VUs  3m38.0s/4m00.0s

running (3m39.1s), 149/150 VUs, 6292 complete and 0 interrupted iterations
default   [  91% ] 149/150 VUs  3m39.0s/4m00.0s

running (3m40.1s), 149/150 VUs, 6292 complete and 0 interrupted iterations
default   [  92% ] 149/150 VUs  3m40.0s/4m00.0s

running (3m41.1s), 148/150 VUs, 6293 complete and 0 interrupted iterations
default   [  92% ] 148/150 VUs  3m41.0s/4m00.0s

running (3m42.1s), 147/150 VUs, 6294 complete and 0 interrupted iterations
default   [  92% ] 147/150 VUs  3m42.0s/4m00.0s

running (3m43.1s), 146/150 VUs, 6295 complete and 0 interrupted iterations
default   [  93% ] 146/150 VUs  3m43.0s/4m00.0s

running (3m44.1s), 145/150 VUs, 6296 complete and 0 interrupted iterations
default   [  93% ] 145/150 VUs  3m44.0s/4m00.0s

running (3m45.1s), 144/150 VUs, 6297 complete and 0 interrupted iterations
default   [  94% ] 144/150 VUs  3m45.0s/4m00.0s

running (3m46.1s), 144/150 VUs, 6297 complete and 0 interrupted iterations
default   [  94% ] 144/150 VUs  3m46.0s/4m00.0s

running (3m47.1s), 143/150 VUs, 6298 complete and 0 interrupted iterations
default   [  95% ] 143/150 VUs  3m47.0s/4m00.0s

running (3m48.1s), 142/150 VUs, 6299 complete and 0 interrupted iterations
default   [  95% ] 142/150 VUs  3m48.0s/4m00.0s

running (3m49.1s), 141/150 VUs, 6300 complete and 0 interrupted iterations
default   [  95% ] 141/150 VUs  3m49.0s/4m00.0s

running (3m50.1s), 140/150 VUs, 6301 complete and 0 interrupted iterations
default   [  96% ] 140/150 VUs  3m50.0s/4m00.0s

running (3m51.1s), 139/150 VUs, 6302 complete and 0 interrupted iterations
default   [  96% ] 139/150 VUs  3m51.0s/4m00.0s

running (3m52.1s), 139/150 VUs, 6302 complete and 0 interrupted iterations
default   [  97% ] 139/150 VUs  3m52.0s/4m00.0s

running (3m53.1s), 138/150 VUs, 6303 complete and 0 interrupted iterations
default   [  97% ] 138/150 VUs  3m53.0s/4m00.0s

running (3m54.1s), 137/150 VUs, 6304 complete and 0 interrupted iterations
default   [  97% ] 137/150 VUs  3m54.0s/4m00.0s

running (3m55.1s), 136/150 VUs, 6305 complete and 0 interrupted iterations
default   [  98% ] 136/150 VUs  3m55.0s/4m00.0s

running (3m56.1s), 135/150 VUs, 6306 complete and 0 interrupted iterations
default   [  98% ] 135/150 VUs  3m56.0s/4m00.0s

running (3m57.1s), 134/150 VUs, 6307 complete and 0 interrupted iterations
default   [  99% ] 134/150 VUs  3m57.0s/4m00.0s

running (3m58.1s), 134/150 VUs, 6307 complete and 0 interrupted iterations
default   [  99% ] 134/150 VUs  3m58.0s/4m00.0s

running (3m59.1s), 133/150 VUs, 6308 complete and 0 interrupted iterations
default   [ 100% ] 133/150 VUs  3m59.0s/4m00.0s

running (4m00.1s), 132/150 VUs, 6309 complete and 0 interrupted iterations
default   [ 100% ] 132/150 VUs  4m00.0s/4m00.0s

running (4m01.1s), 127/150 VUs, 6310 complete and 4 interrupted iterations
default ↓ [ 100% ] 132/150 VUs  4m0s

running (4m02.1s), 121/150 VUs, 6311 complete and 9 interrupted iterations
default ↓ [ 100% ] 132/150 VUs  4m0s

running (4m03.1s), 115/150 VUs, 6312 complete and 14 interrupted iterations
default ↓ [ 100% ] 132/150 VUs  4m0s

running (4m04.1s), 110/150 VUs, 6312 complete and 19 interrupted iterations
default ↓ [ 100% ] 132/150 VUs  4m0s

running (4m05.1s), 106/150 VUs, 6313 complete and 22 interrupted iterations
default ↓ [ 100% ] 132/150 VUs  4m0s

running (4m06.1s), 061/150 VUs, 6358 complete and 22 interrupted iterations
default ↓ [ 100% ] 132/150 VUs  4m0s

running (4m07.1s), 052/150 VUs, 6367 complete and 22 interrupted iterations
default ↓ [ 100% ] 132/150 VUs  4m0s

running (4m08.1s), 051/150 VUs, 6368 complete and 22 interrupted iterations
default ↓ [ 100% ] 132/150 VUs  4m0s

running (4m09.1s), 050/150 VUs, 6369 complete and 22 interrupted iterations
default ↓ [ 100% ] 132/150 VUs  4m0s

running (4m10.1s), 044/150 VUs, 6370 complete and 27 interrupted iterations
default ↓ [ 100% ] 132/150 VUs  4m0s

running (4m11.1s), 038/150 VUs, 6371 complete and 32 interrupted iterations
default ↓ [ 100% ] 132/150 VUs  4m0s

running (4m12.1s), 032/150 VUs, 6372 complete and 37 interrupted iterations
default ↓ [ 100% ] 132/150 VUs  4m0s

running (4m13.1s), 027/150 VUs, 6372 complete and 42 interrupted iterations
default ↓ [ 100% ] 132/150 VUs  4m0s

running (4m14.1s), 025/150 VUs, 6373 complete and 43 interrupted iterations
default ↓ [ 100% ] 132/150 VUs  4m0s

running (4m15.1s), 025/150 VUs, 6373 complete and 43 interrupted iterations
default ↓ [ 100% ] 132/150 VUs  4m0s

running (4m16.1s), 024/150 VUs, 6373 complete and 44 interrupted iterations
default ↓ [ 100% ] 132/150 VUs  4m0s

running (4m17.1s), 023/150 VUs, 6373 complete and 45 interrupted iterations
default ↓ [ 100% ] 132/150 VUs  4m0s

running (4m18.1s), 023/150 VUs, 6373 complete and 45 interrupted iterations
default ↓ [ 100% ] 132/150 VUs  4m0s

running (4m19.1s), 022/150 VUs, 6373 complete and 46 interrupted iterations
default ↓ [ 100% ] 132/150 VUs  4m0s

running (4m20.1s), 019/150 VUs, 6373 complete and 49 interrupted iterations
default ↓ [ 100% ] 132/150 VUs  4m0s

running (4m21.1s), 016/150 VUs, 6373 complete and 52 interrupted iterations
default ↓ [ 100% ] 132/150 VUs  4m0s

running (4m22.1s), 013/150 VUs, 6373 complete and 55 interrupted iterations
default ↓ [ 100% ] 132/150 VUs  4m0s

running (4m23.1s), 010/150 VUs, 6373 complete and 58 interrupted iterations
default ↓ [ 100% ] 132/150 VUs  4m0s

running (4m24.1s), 009/150 VUs, 6373 complete and 59 interrupted iterations
default ↓ [ 100% ] 132/150 VUs  4m0s

running (4m25.1s), 007/150 VUs, 6373 complete and 61 interrupted iterations
default ↓ [ 100% ] 132/150 VUs  4m0s

running (4m26.1s), 005/150 VUs, 6373 complete and 63 interrupted iterations
default ↓ [ 100% ] 132/150 VUs  4m0s

running (4m27.1s), 003/150 VUs, 6373 complete and 65 interrupted iterations
default ↓ [ 100% ] 132/150 VUs  4m0s

running (4m28.1s), 002/150 VUs, 6373 complete and 66 interrupted iterations
default ↓ [ 100% ] 132/150 VUs  4m0s


  █ THRESHOLDS 

    http_req_duration
    ✓ 'p(95)<1000' p(95)=311.54ms
    ✗ 'p(99)<2000' p(99)=30.01s

    http_req_failed
    ✓ 'rate<0.05' rate=3.73%


  █ TOTAL RESULTS 

    checks_total.......: 12814  47.689646/s
    checks_succeeded...: 96.26% 12336 out of 12814
    checks_failed......: 3.73%  478 out of 12814

    ✗ a: status 200
      ↳  96% — ✓ 6185 / ✗ 256
    ✗ b: status 200
      ↳  96% — ✓ 6151 / ✗ 222

    HTTP
    http_req_duration..............: avg=1.18s   min=2.67ms  med=106.88ms max=30.9s    p(90)=255.22ms p(95)=311.54ms
      { expected_response:true }...: avg=82.27ms min=2.67ms  med=95.05ms  max=384.99ms p(90)=217.7ms  p(95)=272.78ms
    http_req_failed................: 3.73%  478 out of 12814
    http_reqs......................: 12814  47.689646/s

    EXECUTION
    iteration_duration.............: avg=2.55s   min=609.3ms med=629.7ms  max=1m1s     p(90)=800.2ms  p(95)=832.98ms
    iterations.....................: 6373   23.718286/s
    vus............................: 2      min=1            max=150
    vus_max........................: 150    min=150          max=150

    NETWORK
    data_received..................: 3.8 MB 14 kB/s
    data_sent......................: 1.2 MB 4.6 kB/s




running (4m28.7s), 000/150 VUs, 6373 complete and 68 interrupted iterations
default ✓ [ 100% ] 000/150 VUs  4m0s
