
         /\      Grafana   /‾‾/  
    /\  /  \     |\  __   /  /   
   /  \/    \    | |/ /  /   ‾‾\ 
  /          \   |   (  |  (‾)  |
 / __________ \  |_|\_\  \_____/ 

     execution: local
        script: /home/edilberto/pspd/atividade-final-pspd/load/ramp.js
        output: json (/home/edilberto/pspd/atividade-final-pspd/results/ramp/metrics.json)

     scenarios: (100.00%) 1 scenario, 150 max VUs, 4m30s max duration (incl. graceful stop):
              * default: Up to 150 looping VUs for 4m0s over 5 stages (gracefulRampDown: 30s, gracefulStop: 30s)


running (0m01.0s), 001/150 VUs, 1 complete and 0 interrupted iterations
default   [   0% ] 001/150 VUs  0m01.0s/4m00.0s

running (0m02.0s), 001/150 VUs, 3 complete and 0 interrupted iterations
default   [   1% ] 001/150 VUs  0m02.0s/4m00.0s

running (0m03.0s), 001/150 VUs, 4 complete and 0 interrupted iterations
default   [   1% ] 001/150 VUs  0m03.0s/4m00.0s

running (0m04.0s), 002/150 VUs, 6 complete and 0 interrupted iterations
default   [   2% ] 002/150 VUs  0m04.0s/4m00.0s

running (0m05.0s), 002/150 VUs, 9 complete and 0 interrupted iterations
default   [   2% ] 002/150 VUs  0m05.0s/4m00.0s

running (0m06.0s), 002/150 VUs, 13 complete and 0 interrupted iterations
default   [   2% ] 002/150 VUs  0m06.0s/4m00.0s

running (0m07.0s), 003/150 VUs, 16 complete and 0 interrupted iterations
default   [   3% ] 003/150 VUs  0m07.0s/4m00.0s

running (0m08.0s), 003/150 VUs, 21 complete and 0 interrupted iterations
default   [   3% ] 003/150 VUs  0m08.0s/4m00.0s

running (0m09.0s), 003/150 VUs, 26 complete and 0 interrupted iterations
default   [   4% ] 003/150 VUs  0m09.0s/4m00.0s

running (0m10.0s), 003/150 VUs, 30 complete and 0 interrupted iterations
default   [   4% ] 003/150 VUs  0m10.0s/4m00.0s

running (0m11.0s), 004/150 VUs, 36 complete and 0 interrupted iterations
default   [   5% ] 004/150 VUs  0m11.0s/4m00.0s

running (0m12.0s), 004/150 VUs, 43 complete and 0 interrupted iterations
default   [   5% ] 004/150 VUs  0m12.0s/4m00.0s

running (0m13.0s), 004/150 VUs, 49 complete and 0 interrupted iterations
default   [   5% ] 004/150 VUs  0m13.0s/4m00.0s

running (0m14.0s), 005/150 VUs, 56 complete and 0 interrupted iterations
default   [   6% ] 005/150 VUs  0m14.0s/4m00.0s

running (0m15.0s), 005/150 VUs, 65 complete and 0 interrupted iterations
default   [   6% ] 005/150 VUs  0m15.0s/4m00.0s

running (0m16.0s), 005/150 VUs, 73 complete and 0 interrupted iterations
default   [   7% ] 005/150 VUs  0m16.0s/4m00.0s

running (0m17.0s), 006/150 VUs, 81 complete and 0 interrupted iterations
default   [   7% ] 006/150 VUs  0m17.0s/4m00.0s

running (0m17.3s), 006/150 VUs, 90 complete and 0 interrupted iterations
default   [   7% ] 006/150 VUs  0m18.0s/4m00.0s

running (0m17.2s), 006/150 VUs, 100 complete and 0 interrupted iterations
default   [   8% ] 006/150 VUs  0m19.0s/4m00.0s

running (0m18.2s), 006/150 VUs, 110 complete and 0 interrupted iterations
default   [   8% ] 006/150 VUs  0m20.0s/4m00.0s

running (0m19.2s), 007/150 VUs, 120 complete and 0 interrupted iterations
default   [   9% ] 007/150 VUs  0m21.0s/4m00.0s

running (0m20.2s), 007/150 VUs, 132 complete and 0 interrupted iterations
default   [   9% ] 007/150 VUs  0m22.0s/4m00.0s

running (0m21.2s), 007/150 VUs, 144 complete and 0 interrupted iterations
default   [  10% ] 007/150 VUs  0m23.0s/4m00.0s

running (0m22.2s), 008/150 VUs, 154 complete and 0 interrupted iterations
default   [  10% ] 008/150 VUs  0m24.0s/4m00.0s

running (0m23.2s), 008/150 VUs, 167 complete and 0 interrupted iterations
default   [  10% ] 008/150 VUs  0m25.0s/4m00.0s

running (0m24.2s), 008/150 VUs, 181 complete and 0 interrupted iterations
default   [  11% ] 008/150 VUs  0m26.0s/4m00.0s

running (0m25.2s), 009/150 VUs, 194 complete and 0 interrupted iterations
default   [  11% ] 009/150 VUs  0m27.0s/4m00.0s

running (0m26.2s), 009/150 VUs, 209 complete and 0 interrupted iterations
default   [  12% ] 009/150 VUs  0m28.0s/4m00.0s

running (0m27.2s), 009/150 VUs, 223 complete and 0 interrupted iterations
default   [  12% ] 009/150 VUs  0m29.0s/4m00.0s

running (0m28.2s), 009/150 VUs, 238 complete and 0 interrupted iterations
default   [  12% ] 009/150 VUs  0m30.0s/4m00.0s

running (0m29.2s), 010/150 VUs, 253 complete and 0 interrupted iterations
default   [  13% ] 010/150 VUs  0m31.0s/4m00.0s

running (0m30.2s), 011/150 VUs, 269 complete and 0 interrupted iterations
default   [  13% ] 011/150 VUs  0m32.0s/4m00.0s

running (0m31.2s), 011/150 VUs, 287 complete and 0 interrupted iterations
default   [  14% ] 011/150 VUs  0m33.0s/4m00.0s

running (0m32.2s), 012/150 VUs, 306 complete and 0 interrupted iterations
default   [  14% ] 012/150 VUs  0m34.0s/4m00.0s

running (0m33.2s), 013/150 VUs, 327 complete and 0 interrupted iterations
default   [  15% ] 013/150 VUs  0m35.0s/4m00.0s

running (0m34.2s), 013/150 VUs, 348 complete and 0 interrupted iterations
default   [  15% ] 013/150 VUs  0m36.0s/4m00.0s

running (0m35.2s), 014/150 VUs, 369 complete and 0 interrupted iterations
default   [  15% ] 014/150 VUs  0m37.0s/4m00.0s

running (0m36.2s), 015/150 VUs, 393 complete and 0 interrupted iterations
default   [  16% ] 015/150 VUs  0m38.0s/4m00.0s

running (0m37.2s), 015/150 VUs, 418 complete and 0 interrupted iterations
default   [  16% ] 015/150 VUs  0m39.0s/4m00.0s

running (0m38.2s), 016/150 VUs, 441 complete and 0 interrupted iterations
default   [  17% ] 016/150 VUs  0m40.0s/4m00.0s

running (0m39.2s), 017/150 VUs, 468 complete and 0 interrupted iterations
default   [  17% ] 017/150 VUs  0m41.0s/4m00.0s

running (0m40.2s), 017/150 VUs, 496 complete and 0 interrupted iterations
default   [  17% ] 017/150 VUs  0m42.0s/4m00.0s

running (0m41.2s), 018/150 VUs, 523 complete and 0 interrupted iterations
default   [  18% ] 018/150 VUs  0m43.0s/4m00.0s

running (0m42.2s), 019/150 VUs, 554 complete and 0 interrupted iterations
default   [  18% ] 019/150 VUs  0m44.0s/4m00.0s

running (0m43.2s), 019/150 VUs, 583 complete and 0 interrupted iterations
default   [  19% ] 019/150 VUs  0m45.0s/4m00.0s

running (0m44.2s), 020/150 VUs, 615 complete and 0 interrupted iterations
default   [  19% ] 020/150 VUs  0m46.0s/4m00.0s

running (0m45.2s), 021/150 VUs, 647 complete and 0 interrupted iterations
default   [  20% ] 021/150 VUs  0m47.0s/4m00.0s

running (0m45.6s), 021/150 VUs, 680 complete and 0 interrupted iterations
default   [  20% ] 021/150 VUs  0m48.0s/4m00.0s

running (0m45.5s), 022/150 VUs, 718 complete and 0 interrupted iterations
default   [  20% ] 022/150 VUs  0m49.0s/4m00.0s

running (0m46.5s), 023/150 VUs, 751 complete and 0 interrupted iterations
default   [  21% ] 023/150 VUs  0m50.0s/4m00.0s

running (0m47.5s), 023/150 VUs, 790 complete and 0 interrupted iterations
default   [  21% ] 023/150 VUs  0m51.0s/4m00.0s

running (0m48.5s), 024/150 VUs, 831 complete and 0 interrupted iterations
default   [  22% ] 024/150 VUs  0m52.0s/4m00.0s

running (0m49.5s), 025/150 VUs, 867 complete and 0 interrupted iterations
default   [  22% ] 025/150 VUs  0m53.0s/4m00.0s

running (0m50.5s), 025/150 VUs, 910 complete and 0 interrupted iterations
default   [  22% ] 025/150 VUs  0m54.0s/4m00.0s

running (0m51.5s), 026/150 VUs, 949 complete and 0 interrupted iterations
default   [  23% ] 026/150 VUs  0m55.0s/4m00.0s

running (0m52.5s), 027/150 VUs, 990 complete and 0 interrupted iterations
default   [  23% ] 027/150 VUs  0m56.0s/4m00.0s

running (0m53.5s), 027/150 VUs, 1039 complete and 0 interrupted iterations
default   [  24% ] 027/150 VUs  0m57.0s/4m00.0s

running (0m54.5s), 028/150 VUs, 1079 complete and 0 interrupted iterations
default   [  24% ] 028/150 VUs  0m58.0s/4m00.0s

running (0m55.5s), 029/150 VUs, 1127 complete and 0 interrupted iterations
default   [  25% ] 029/150 VUs  0m59.0s/4m00.0s

running (0m56.5s), 029/150 VUs, 1172 complete and 0 interrupted iterations
default   [  25% ] 029/150 VUs  1m00.0s/4m00.0s

running (0m57.5s), 030/150 VUs, 1218 complete and 0 interrupted iterations
default   [  25% ] 030/150 VUs  1m01.0s/4m00.0s

running (0m58.5s), 031/150 VUs, 1268 complete and 0 interrupted iterations
default   [  26% ] 031/150 VUs  1m02.0s/4m00.0s

running (0m59.5s), 031/150 VUs, 1321 complete and 0 interrupted iterations
default   [  26% ] 031/150 VUs  1m03.0s/4m00.0s

running (1m00.5s), 032/150 VUs, 1370 complete and 0 interrupted iterations
default   [  27% ] 032/150 VUs  1m04.0s/4m00.0s

running (1m01.5s), 033/150 VUs, 1419 complete and 0 interrupted iterations
default   [  27% ] 033/150 VUs  1m05.0s/4m00.0s

running (1m02.5s), 033/150 VUs, 1475 complete and 0 interrupted iterations
default   [  27% ] 033/150 VUs  1m06.0s/4m00.0s

running (1m03.5s), 034/150 VUs, 1529 complete and 0 interrupted iterations
default   [  28% ] 034/150 VUs  1m07.0s/4m00.0s

running (1m04.5s), 035/150 VUs, 1584 complete and 0 interrupted iterations
default   [  28% ] 035/150 VUs  1m08.0s/4m00.0s

running (1m05.5s), 035/150 VUs, 1642 complete and 0 interrupted iterations
default   [  29% ] 035/150 VUs  1m09.0s/4m00.0s

running (1m06.5s), 036/150 VUs, 1693 complete and 0 interrupted iterations
default   [  29% ] 036/150 VUs  1m10.0s/4m00.0s

running (1m07.5s), 037/150 VUs, 1758 complete and 0 interrupted iterations
default   [  30% ] 037/150 VUs  1m11.0s/4m00.0s

running (1m08.5s), 037/150 VUs, 1811 complete and 0 interrupted iterations
default   [  30% ] 037/150 VUs  1m12.0s/4m00.0s

running (1m09.5s), 038/150 VUs, 1877 complete and 0 interrupted iterations
default   [  30% ] 038/150 VUs  1m13.0s/4m00.0s

running (1m10.5s), 039/150 VUs, 1936 complete and 0 interrupted iterations
default   [  31% ] 039/150 VUs  1m14.0s/4m00.0s

running (1m11.5s), 039/150 VUs, 2002 complete and 0 interrupted iterations
default   [  31% ] 039/150 VUs  1m15.0s/4m00.0s

running (1m12.5s), 040/150 VUs, 2060 complete and 0 interrupted iterations
default   [  32% ] 040/150 VUs  1m16.0s/4m00.0s

running (1m13.5s), 041/150 VUs, 2126 complete and 0 interrupted iterations
default   [  32% ] 041/150 VUs  1m17.0s/4m00.0s

running (1m13.8s), 041/150 VUs, 2189 complete and 0 interrupted iterations
default   [  32% ] 041/150 VUs  1m18.0s/4m00.0s

running (1m13.8s), 042/150 VUs, 2248 complete and 0 interrupted iterations
default   [  33% ] 042/150 VUs  1m19.0s/4m00.0s

running (1m14.8s), 043/150 VUs, 2298 complete and 0 interrupted iterations
default   [  33% ] 043/150 VUs  1m20.0s/4m00.0s

running (1m15.8s), 043/150 VUs, 2363 complete and 0 interrupted iterations
default   [  34% ] 043/150 VUs  1m21.0s/4m00.0s

running (1m16.8s), 044/150 VUs, 2425 complete and 0 interrupted iterations
default   [  34% ] 044/150 VUs  1m22.0s/4m00.0s

running (1m17.8s), 045/150 VUs, 2488 complete and 0 interrupted iterations
default   [  35% ] 045/150 VUs  1m23.0s/4m00.0s

running (1m18.8s), 045/150 VUs, 2558 complete and 0 interrupted iterations
default   [  35% ] 045/150 VUs  1m24.0s/4m00.0s

running (1m19.8s), 046/150 VUs, 2607 complete and 0 interrupted iterations
default   [  35% ] 046/150 VUs  1m25.0s/4m00.0s

running (1m20.8s), 047/150 VUs, 2670 complete and 0 interrupted iterations
default   [  36% ] 047/150 VUs  1m26.0s/4m00.0s

running (1m21.8s), 047/150 VUs, 2720 complete and 0 interrupted iterations
default   [  36% ] 047/150 VUs  1m27.0s/4m00.0s

running (1m22.8s), 048/150 VUs, 2789 complete and 0 interrupted iterations
default   [  37% ] 048/150 VUs  1m28.0s/4m00.0s

running (1m23.8s), 049/150 VUs, 2859 complete and 0 interrupted iterations
default   [  37% ] 049/150 VUs  1m29.0s/4m00.0s

running (1m24.8s), 049/150 VUs, 2938 complete and 0 interrupted iterations
default   [  37% ] 049/150 VUs  1m30.0s/4m00.0s

running (1m25.8s), 050/150 VUs, 3015 complete and 0 interrupted iterations
default   [  38% ] 050/150 VUs  1m31.0s/4m00.0s

running (1m26.8s), 051/150 VUs, 3070 complete and 0 interrupted iterations
default   [  38% ] 051/150 VUs  1m32.0s/4m00.0s

running (1m27.8s), 052/150 VUs, 3110 complete and 0 interrupted iterations
default   [  39% ] 052/150 VUs  1m33.0s/4m00.0s

running (1m28.8s), 053/150 VUs, 3184 complete and 0 interrupted iterations
default   [  39% ] 053/150 VUs  1m34.0s/4m00.0s

running (1m29.8s), 054/150 VUs, 3254 complete and 0 interrupted iterations
default   [  40% ] 054/150 VUs  1m35.0s/4m00.0s

running (1m30.8s), 054/150 VUs, 3339 complete and 0 interrupted iterations
default   [  40% ] 054/150 VUs  1m36.0s/4m00.0s

running (1m31.8s), 055/150 VUs, 3417 complete and 0 interrupted iterations
default   [  40% ] 055/150 VUs  1m37.0s/4m00.0s

running (1m32.8s), 056/150 VUs, 3496 complete and 0 interrupted iterations
default   [  41% ] 056/150 VUs  1m38.0s/4m00.0s

running (1m33.8s), 057/150 VUs, 3544 complete and 0 interrupted iterations
default   [  41% ] 057/150 VUs  1m39.0s/4m00.0s

running (1m34.8s), 058/150 VUs, 3634 complete and 0 interrupted iterations
default   [  42% ] 058/150 VUs  1m40.0s/4m00.0s

running (1m35.8s), 059/150 VUs, 3722 complete and 0 interrupted iterations
default   [  42% ] 059/150 VUs  1m41.0s/4m00.0s

running (1m36.8s), 059/150 VUs, 3810 complete and 0 interrupted iterations
default   [  42% ] 059/150 VUs  1m42.0s/4m00.0s

running (1m37.8s), 060/150 VUs, 3906 complete and 0 interrupted iterations
default   [  43% ] 060/150 VUs  1m43.0s/4m00.0s

running (1m38.8s), 061/150 VUs, 3990 complete and 0 interrupted iterations
default   [  43% ] 061/150 VUs  1m44.0s/4m00.0s

running (1m39.8s), 062/150 VUs, 4082 complete and 0 interrupted iterations
default   [  44% ] 062/150 VUs  1m45.0s/4m00.0s

running (1m40.8s), 063/150 VUs, 4170 complete and 0 interrupted iterations
default   [  44% ] 063/150 VUs  1m46.0s/4m00.0s

running (1m41.8s), 064/150 VUs, 4262 complete and 0 interrupted iterations
default   [  45% ] 064/150 VUs  1m47.0s/4m00.0s

running (1m42.1s), 064/150 VUs, 4357 complete and 0 interrupted iterations
default   [  45% ] 064/150 VUs  1m48.0s/4m00.0s

running (1m42.1s), 065/150 VUs, 4446 complete and 0 interrupted iterations
default   [  45% ] 065/150 VUs  1m49.0s/4m00.0s

running (1m43.1s), 066/150 VUs, 4536 complete and 0 interrupted iterations
default   [  46% ] 066/150 VUs  1m50.0s/4m00.0s

running (1m44.1s), 067/150 VUs, 4630 complete and 0 interrupted iterations
default   [  46% ] 067/150 VUs  1m51.0s/4m00.0s

running (1m45.1s), 068/150 VUs, 4722 complete and 0 interrupted iterations
default   [  47% ] 068/150 VUs  1m52.0s/4m00.0s

running (1m46.1s), 069/150 VUs, 4808 complete and 0 interrupted iterations
default   [  47% ] 069/150 VUs  1m53.0s/4m00.0s

running (1m47.1s), 069/150 VUs, 4890 complete and 0 interrupted iterations
default   [  47% ] 069/150 VUs  1m54.0s/4m00.0s

running (1m48.1s), 070/150 VUs, 4968 complete and 0 interrupted iterations
default   [  48% ] 070/150 VUs  1m55.0s/4m00.0s

running (1m49.1s), 071/150 VUs, 5052 complete and 0 interrupted iterations
default   [  48% ] 071/150 VUs  1m56.0s/4m00.0s

running (1m50.1s), 072/150 VUs, 5140 complete and 0 interrupted iterations
default   [  49% ] 072/150 VUs  1m57.0s/4m00.0s

running (1m51.1s), 073/150 VUs, 5228 complete and 0 interrupted iterations
default   [  49% ] 073/150 VUs  1m58.0s/4m00.0s

running (1m52.1s), 074/150 VUs, 5315 complete and 0 interrupted iterations
default   [  50% ] 074/150 VUs  1m59.0s/4m00.0s

running (1m53.1s), 074/150 VUs, 5410 complete and 0 interrupted iterations
default   [  50% ] 074/150 VUs  2m00.0s/4m00.0s

running (1m54.1s), 075/150 VUs, 5502 complete and 0 interrupted iterations
default   [  50% ] 075/150 VUs  2m01.0s/4m00.0s

running (1m55.1s), 076/150 VUs, 5595 complete and 0 interrupted iterations
default   [  51% ] 076/150 VUs  2m02.0s/4m00.0s

running (1m56.1s), 077/150 VUs, 5690 complete and 0 interrupted iterations
default   [  51% ] 077/150 VUs  2m03.0s/4m00.0s

running (1m57.1s), 078/150 VUs, 5780 complete and 0 interrupted iterations
default   [  52% ] 078/150 VUs  2m04.0s/4m00.0s

running (1m58.1s), 079/150 VUs, 5870 complete and 0 interrupted iterations
default   [  52% ] 079/150 VUs  2m05.0s/4m00.0s

running (1m59.1s), 079/150 VUs, 5960 complete and 0 interrupted iterations
default   [  52% ] 079/150 VUs  2m06.0s/4m00.0s

running (2m00.1s), 080/150 VUs, 6050 complete and 0 interrupted iterations
default   [  53% ] 080/150 VUs  2m07.0s/4m00.0s

running (2m01.1s), 081/150 VUs, 6149 complete and 0 interrupted iterations
default   [  53% ] 081/150 VUs  2m08.0s/4m00.0s

running (2m02.1s), 082/150 VUs, 6220 complete and 0 interrupted iterations
default   [  54% ] 082/150 VUs  2m09.0s/4m00.0s

running (2m03.1s), 083/150 VUs, 6284 complete and 0 interrupted iterations
default   [  54% ] 083/150 VUs  2m10.0s/4m00.0s

running (2m04.1s), 084/150 VUs, 6351 complete and 0 interrupted iterations
default   [  55% ] 084/150 VUs  2m11.0s/4m00.0s

running (2m05.1s), 084/150 VUs, 6402 complete and 0 interrupted iterations
default   [  55% ] 084/150 VUs  2m12.0s/4m00.0s

running (2m06.1s), 085/150 VUs, 6464 complete and 0 interrupted iterations
default   [  55% ] 085/150 VUs  2m13.0s/4m00.0s

running (2m07.1s), 086/150 VUs, 6541 complete and 0 interrupted iterations
default   [  56% ] 086/150 VUs  2m14.0s/4m00.0s

running (2m08.1s), 087/150 VUs, 6601 complete and 0 interrupted iterations
default   [  56% ] 087/150 VUs  2m15.0s/4m00.0s

running (2m09.1s), 088/150 VUs, 6675 complete and 0 interrupted iterations
default   [  57% ] 088/150 VUs  2m16.0s/4m00.0s

running (2m10.1s), 089/150 VUs, 6736 complete and 0 interrupted iterations
default   [  57% ] 089/150 VUs  2m17.0s/4m00.0s

running (2m10.4s), 089/150 VUs, 6813 complete and 0 interrupted iterations
default   [  57% ] 089/150 VUs  2m18.0s/4m00.0s

running (2m10.4s), 090/150 VUs, 6897 complete and 0 interrupted iterations
default   [  58% ] 090/150 VUs  2m19.0s/4m00.0s

running (2m11.4s), 091/150 VUs, 6967 complete and 0 interrupted iterations
default   [  58% ] 091/150 VUs  2m20.0s/4m00.0s

running (2m12.4s), 092/150 VUs, 7028 complete and 0 interrupted iterations
default   [  59% ] 092/150 VUs  2m21.0s/4m00.0s

running (2m13.4s), 093/150 VUs, 7110 complete and 0 interrupted iterations
default   [  59% ] 093/150 VUs  2m22.0s/4m00.0s

running (2m14.4s), 094/150 VUs, 7192 complete and 0 interrupted iterations
default   [  60% ] 094/150 VUs  2m23.0s/4m00.0s

running (2m15.4s), 094/150 VUs, 7262 complete and 0 interrupted iterations
default   [  60% ] 094/150 VUs  2m24.0s/4m00.0s

running (2m16.4s), 095/150 VUs, 7327 complete and 0 interrupted iterations
default   [  60% ] 095/150 VUs  2m25.0s/4m00.0s

running (2m17.4s), 096/150 VUs, 7404 complete and 0 interrupted iterations
default   [  61% ] 096/150 VUs  2m26.0s/4m00.0s

running (2m18.4s), 097/150 VUs, 7488 complete and 0 interrupted iterations
default   [  61% ] 097/150 VUs  2m27.0s/4m00.0s

running (2m19.4s), 098/150 VUs, 7574 complete and 0 interrupted iterations
default   [  62% ] 098/150 VUs  2m28.0s/4m00.0s

running (2m20.4s), 099/150 VUs, 7654 complete and 0 interrupted iterations
default   [  62% ] 099/150 VUs  2m29.0s/4m00.0s

running (2m21.4s), 099/150 VUs, 7743 complete and 0 interrupted iterations
default   [  62% ] 099/150 VUs  2m30.0s/4m00.0s

running (2m22.4s), 100/150 VUs, 7833 complete and 0 interrupted iterations
default   [  63% ] 100/150 VUs  2m31.0s/4m00.0s

running (2m23.4s), 101/150 VUs, 7923 complete and 0 interrupted iterations
default   [  63% ] 101/150 VUs  2m32.0s/4m00.0s

running (2m24.4s), 102/150 VUs, 8014 complete and 0 interrupted iterations
default   [  64% ] 102/150 VUs  2m33.0s/4m00.0s

running (2m25.4s), 103/150 VUs, 8104 complete and 0 interrupted iterations
default   [  64% ] 103/150 VUs  2m34.0s/4m00.0s

running (2m26.4s), 104/150 VUs, 8200 complete and 0 interrupted iterations
default   [  65% ] 104/150 VUs  2m35.0s/4m00.0s

running (2m27.4s), 104/150 VUs, 8292 complete and 0 interrupted iterations
default   [  65% ] 104/150 VUs  2m36.0s/4m00.0s

running (2m28.4s), 105/150 VUs, 8382 complete and 0 interrupted iterations
default   [  65% ] 105/150 VUs  2m37.0s/4m00.0s

running (2m29.4s), 106/150 VUs, 8464 complete and 0 interrupted iterations
default   [  66% ] 106/150 VUs  2m38.0s/4m00.0s

running (2m30.4s), 107/150 VUs, 8560 complete and 0 interrupted iterations
default   [  66% ] 107/150 VUs  2m39.0s/4m00.0s

running (2m31.4s), 108/150 VUs, 8644 complete and 0 interrupted iterations
default   [  67% ] 108/150 VUs  2m40.0s/4m00.0s

running (2m32.4s), 109/150 VUs, 8736 complete and 0 interrupted iterations
default   [  67% ] 109/150 VUs  2m41.0s/4m00.0s

running (2m33.4s), 109/150 VUs, 8830 complete and 0 interrupted iterations
default   [  67% ] 109/150 VUs  2m42.0s/4m00.0s

running (2m34.4s), 110/150 VUs, 8914 complete and 0 interrupted iterations
default   [  68% ] 110/150 VUs  2m43.0s/4m00.0s

running (2m35.4s), 111/150 VUs, 9006 complete and 0 interrupted iterations
default   [  68% ] 111/150 VUs  2m44.0s/4m00.0s

running (2m36.4s), 112/150 VUs, 9097 complete and 0 interrupted iterations
default   [  69% ] 112/150 VUs  2m45.0s/4m00.0s

running (2m37.4s), 113/150 VUs, 9188 complete and 0 interrupted iterations
default   [  69% ] 113/150 VUs  2m46.0s/4m00.0s

running (2m38.4s), 114/150 VUs, 9274 complete and 0 interrupted iterations
default   [  70% ] 114/150 VUs  2m47.0s/4m00.0s

running (2m38.7s), 114/150 VUs, 9367 complete and 0 interrupted iterations
default   [  70% ] 114/150 VUs  2m48.0s/4m00.0s

running (2m38.7s), 115/150 VUs, 9454 complete and 0 interrupted iterations
default   [  70% ] 115/150 VUs  2m49.0s/4m00.0s

running (2m39.7s), 116/150 VUs, 9539 complete and 0 interrupted iterations
default   [  71% ] 116/150 VUs  2m50.0s/4m00.0s

running (2m40.7s), 117/150 VUs, 9626 complete and 0 interrupted iterations
default   [  71% ] 117/150 VUs  2m51.0s/4m00.0s

running (2m41.7s), 118/150 VUs, 9709 complete and 0 interrupted iterations
default   [  72% ] 118/150 VUs  2m52.0s/4m00.0s

running (2m42.7s), 119/150 VUs, 9796 complete and 0 interrupted iterations
default   [  72% ] 119/150 VUs  2m53.0s/4m00.0s

running (2m43.7s), 119/150 VUs, 9879 complete and 0 interrupted iterations
default   [  72% ] 119/150 VUs  2m54.0s/4m00.0s

running (2m44.7s), 120/150 VUs, 9970 complete and 0 interrupted iterations
default   [  73% ] 120/150 VUs  2m55.0s/4m00.0s

running (2m45.7s), 121/150 VUs, 10059 complete and 0 interrupted iterations
default   [  73% ] 121/150 VUs  2m56.0s/4m00.0s

running (2m46.7s), 122/150 VUs, 10151 complete and 0 interrupted iterations
default   [  74% ] 122/150 VUs  2m57.0s/4m00.0s

running (2m47.7s), 123/150 VUs, 10242 complete and 0 interrupted iterations
default   [  74% ] 123/150 VUs  2m58.0s/4m00.0s

running (2m48.7s), 124/150 VUs, 10330 complete and 0 interrupted iterations
default   [  75% ] 124/150 VUs  2m59.0s/4m00.0s

running (2m49.7s), 124/150 VUs, 10427 complete and 0 interrupted iterations
default   [  75% ] 124/150 VUs  3m00.0s/4m00.0s

running (2m50.7s), 125/150 VUs, 10519 complete and 0 interrupted iterations
default   [  75% ] 125/150 VUs  3m01.0s/4m00.0s

running (2m51.7s), 126/150 VUs, 10609 complete and 0 interrupted iterations
default   [  76% ] 126/150 VUs  3m02.0s/4m00.0s

running (2m52.7s), 127/150 VUs, 10694 complete and 0 interrupted iterations
default   [  76% ] 127/150 VUs  3m03.0s/4m00.0s

running (2m53.7s), 128/150 VUs, 10753 complete and 0 interrupted iterations
default   [  77% ] 128/150 VUs  3m04.0s/4m00.0s

running (2m54.7s), 129/150 VUs, 10838 complete and 0 interrupted iterations
default   [  77% ] 129/150 VUs  3m05.0s/4m00.0s

running (2m55.7s), 129/150 VUs, 10886 complete and 0 interrupted iterations
default   [  77% ] 129/150 VUs  3m06.0s/4m00.0s

running (2m56.7s), 130/150 VUs, 10960 complete and 0 interrupted iterations
default   [  78% ] 130/150 VUs  3m07.0s/4m00.0s

running (2m57.7s), 131/150 VUs, 11038 complete and 0 interrupted iterations
default   [  78% ] 131/150 VUs  3m08.0s/4m00.0s

running (2m58.7s), 132/150 VUs, 11092 complete and 0 interrupted iterations
default   [  79% ] 132/150 VUs  3m09.0s/4m00.0s

running (2m59.7s), 133/150 VUs, 11168 complete and 0 interrupted iterations
default   [  79% ] 133/150 VUs  3m10.0s/4m00.0s

running (3m00.7s), 134/150 VUs, 11253 complete and 0 interrupted iterations
default   [  80% ] 134/150 VUs  3m11.0s/4m00.0s

running (3m01.7s), 134/150 VUs, 11345 complete and 0 interrupted iterations
default   [  80% ] 134/150 VUs  3m12.0s/4m00.0s

running (3m02.7s), 135/150 VUs, 11431 complete and 0 interrupted iterations
default   [  80% ] 135/150 VUs  3m13.0s/4m00.0s

running (3m03.7s), 136/150 VUs, 11511 complete and 0 interrupted iterations
default   [  81% ] 136/150 VUs  3m14.0s/4m00.0s

running (3m04.7s), 137/150 VUs, 11582 complete and 0 interrupted iterations
default   [  81% ] 137/150 VUs  3m15.0s/4m00.0s

running (3m05.7s), 138/150 VUs, 11650 complete and 0 interrupted iterations
default   [  82% ] 138/150 VUs  3m16.0s/4m00.0s

running (3m06.7s), 139/150 VUs, 11748 complete and 0 interrupted iterations
default   [  82% ] 139/150 VUs  3m17.0s/4m00.0s

running (3m07.0s), 139/150 VUs, 11838 complete and 0 interrupted iterations
default   [  82% ] 139/150 VUs  3m18.0s/4m00.0s

running (3m07.0s), 140/150 VUs, 11917 complete and 0 interrupted iterations
default   [  83% ] 140/150 VUs  3m19.0s/4m00.0s

running (3m08.0s), 141/150 VUs, 12001 complete and 0 interrupted iterations
default   [  83% ] 141/150 VUs  3m20.0s/4m00.0s

running (3m09.0s), 142/150 VUs, 12093 complete and 0 interrupted iterations
default   [  84% ] 142/150 VUs  3m21.0s/4m00.0s

running (3m10.0s), 143/150 VUs, 12187 complete and 0 interrupted iterations
default   [  84% ] 143/150 VUs  3m22.0s/4m00.0s

running (3m11.0s), 144/150 VUs, 12252 complete and 0 interrupted iterations
default   [  85% ] 144/150 VUs  3m23.0s/4m00.0s

running (3m12.0s), 144/150 VUs, 12319 complete and 0 interrupted iterations
default   [  85% ] 144/150 VUs  3m24.0s/4m00.0s

running (3m13.0s), 145/150 VUs, 12384 complete and 0 interrupted iterations
default   [  85% ] 145/150 VUs  3m25.0s/4m00.0s

running (3m14.0s), 146/150 VUs, 12462 complete and 0 interrupted iterations
default   [  86% ] 146/150 VUs  3m26.0s/4m00.0s

running (3m15.0s), 147/150 VUs, 12532 complete and 0 interrupted iterations
default   [  86% ] 147/150 VUs  3m27.0s/4m00.0s

running (3m16.0s), 148/150 VUs, 12614 complete and 0 interrupted iterations
default   [  87% ] 148/150 VUs  3m28.0s/4m00.0s

running (3m17.0s), 149/150 VUs, 12677 complete and 0 interrupted iterations
default   [  87% ] 149/150 VUs  3m29.0s/4m00.0s

running (3m18.0s), 149/150 VUs, 12739 complete and 0 interrupted iterations
default   [  87% ] 149/150 VUs  3m30.0s/4m00.0s

running (3m19.0s), 150/150 VUs, 12805 complete and 0 interrupted iterations
default   [  88% ] 150/150 VUs  3m31.0s/4m00.0s

running (3m20.0s), 148/150 VUs, 12850 complete and 0 interrupted iterations
default   [  88% ] 148/150 VUs  3m32.0s/4m00.0s

running (3m21.0s), 143/150 VUs, 12906 complete and 0 interrupted iterations
default   [  89% ] 143/150 VUs  3m33.0s/4m00.0s

running (3m22.0s), 138/150 VUs, 12964 complete and 0 interrupted iterations
default   [  89% ] 138/150 VUs  3m34.0s/4m00.0s

running (3m23.0s), 132/150 VUs, 13017 complete and 0 interrupted iterations
default   [  90% ] 132/150 VUs  3m35.0s/4m00.0s

running (3m24.0s), 124/150 VUs, 13081 complete and 0 interrupted iterations
default   [  90% ] 124/150 VUs  3m36.0s/4m00.0s

running (3m25.0s), 118/150 VUs, 13161 complete and 0 interrupted iterations
default   [  90% ] 118/150 VUs  3m37.0s/4m00.0s

running (3m26.0s), 116/150 VUs, 13226 complete and 0 interrupted iterations
default   [  91% ] 116/150 VUs  3m38.0s/4m00.0s

running (3m27.0s), 110/150 VUs, 13307 complete and 0 interrupted iterations
default   [  91% ] 110/150 VUs  3m39.0s/4m00.0s

running (3m28.0s), 104/150 VUs, 13378 complete and 0 interrupted iterations
default   [  92% ] 104/150 VUs  3m40.0s/4m00.0s

running (3m29.0s), 100/150 VUs, 13455 complete and 0 interrupted iterations
default   [  92% ] 100/150 VUs  3m41.0s/4m00.0s

running (3m30.0s), 094/150 VUs, 13547 complete and 0 interrupted iterations
default   [  92% ] 094/150 VUs  3m42.0s/4m00.0s

running (3m31.0s), 089/150 VUs, 13627 complete and 0 interrupted iterations
default   [  93% ] 089/150 VUs  3m43.0s/4m00.0s

running (3m32.0s), 083/150 VUs, 13708 complete and 0 interrupted iterations
default   [  93% ] 083/150 VUs  3m44.0s/4m00.0s

running (3m33.0s), 080/150 VUs, 13793 complete and 0 interrupted iterations
default   [  94% ] 080/150 VUs  3m45.0s/4m00.0s

running (3m34.0s), 073/150 VUs, 13878 complete and 0 interrupted iterations
default   [  94% ] 073/150 VUs  3m46.0s/4m00.0s

running (3m35.0s), 069/150 VUs, 13962 complete and 0 interrupted iterations
default   [  95% ] 069/150 VUs  3m47.0s/4m00.0s

running (3m35.3s), 063/150 VUs, 14036 complete and 0 interrupted iterations
default   [  95% ] 063/150 VUs  3m48.0s/4m00.0s

running (3m35.3s), 057/150 VUs, 14116 complete and 0 interrupted iterations
default   [  95% ] 057/150 VUs  3m49.0s/4m00.0s

running (3m36.3s), 053/150 VUs, 14189 complete and 0 interrupted iterations
default   [  96% ] 053/150 VUs  3m50.0s/4m00.0s

running (3m37.3s), 048/150 VUs, 14268 complete and 0 interrupted iterations
default   [  96% ] 048/150 VUs  3m51.0s/4m00.0s

running (3m38.3s), 042/150 VUs, 14338 complete and 0 interrupted iterations
default   [  97% ] 042/150 VUs  3m52.0s/4m00.0s

running (3m39.3s), 037/150 VUs, 14406 complete and 0 interrupted iterations
default   [  97% ] 037/150 VUs  3m53.0s/4m00.0s

running (3m40.3s), 032/150 VUs, 14459 complete and 0 interrupted iterations
default   [  97% ] 032/150 VUs  3m54.0s/4m00.0s

running (3m41.3s), 027/150 VUs, 14510 complete and 0 interrupted iterations
default   [  98% ] 027/150 VUs  3m55.0s/4m00.0s

running (3m42.3s), 021/150 VUs, 14554 complete and 0 interrupted iterations
default   [  98% ] 021/150 VUs  3m56.0s/4m00.0s

running (3m43.3s), 016/150 VUs, 14588 complete and 0 interrupted iterations
default   [  99% ] 016/150 VUs  3m57.0s/4m00.0s

running (3m44.3s), 012/150 VUs, 14611 complete and 0 interrupted iterations
default   [  99% ] 012/150 VUs  3m58.0s/4m00.0s

running (3m45.3s), 008/150 VUs, 14628 complete and 0 interrupted iterations
default   [ 100% ] 008/150 VUs  3m59.0s/4m00.0s

running (3m46.3s), 002/150 VUs, 14639 complete and 0 interrupted iterations
default   [ 100% ] 002/150 VUs  4m00.0s/4m00.0s


  █ THRESHOLDS 

    http_req_duration
    ✗ 'p(95)<1000' p(95)=1.1s
    ✓ 'p(99)<2000' p(99)=1.57s

    http_req_failed
    ✓ 'rate<0.05' rate=0.00%


  █ TOTAL RESULTS 

    checks_total.......: 29282   129.220695/s
    checks_succeeded...: 100.00% 29282 out of 29282
    checks_failed......: 0.00%   0 out of 29282

    ✓ a: status 200
    ✓ b: status 200

    HTTP
    http_req_duration..............: avg=295.39ms min=47.68µs med=111.4ms max=2.48s p(90)=874.12ms p(95)=1.1s 
      { expected_response:true }...: avg=295.39ms min=47.68µs med=111.4ms max=2.48s p(90)=874.12ms p(95)=1.1s 
    http_req_failed................: 0.00%  0 out of 29282
    http_reqs......................: 29282  129.220695/s

    EXECUTION
    iteration_duration.............: avg=1.1s     min=609.2ms med=1.08s   max=3.15s p(90)=1.75s    p(95)=2.02s
    iterations.....................: 14641  64.610347/s
    vus............................: 2      min=1          max=150
    vus_max........................: 150    min=150        max=150

    NETWORK
    data_received..................: 9.1 MB 40 kB/s
    data_sent......................: 2.8 MB 12 kB/s




running (3m46.6s), 000/150 VUs, 14641 complete and 0 interrupted iterations
default ✓ [ 100% ] 000/150 VUs  4m0s
