
         /\      Grafana   /‾‾/  
    /\  /  \     |\  __   /  /   
   /  \/    \    | |/ /  /   ‾‾\ 
  /          \   |   (  |  (‾)  |
 / __________ \  |_|\_\  \_____/ 

     execution: local
        script: /home/edilberto/pspd/atividade-final-pspd/load/ramp.js
        output: json (/home/edilberto/pspd/atividade-final-pspd/results/ramp/metrics.json)

     scenarios: (100.00%) 1 scenario, 150 max VUs, 4m30s max duration (incl. graceful stop):
              * default: Up to 150 looping VUs for 4m0s over 5 stages (gracefulRampDown: 30s, gracefulStop: 30s)


running (0m00.9s), 001/150 VUs, 1 complete and 0 interrupted iterations
default   [   0% ] 001/150 VUs  0m00.9s/4m00.0s

running (0m01.9s), 001/150 VUs, 3 complete and 0 interrupted iterations
default   [   1% ] 001/150 VUs  0m01.9s/4m00.0s

running (0m02.9s), 001/150 VUs, 4 complete and 0 interrupted iterations
default   [   1% ] 001/150 VUs  0m02.9s/4m00.0s

running (0m03.9s), 002/150 VUs, 6 complete and 0 interrupted iterations
default   [   2% ] 002/150 VUs  0m03.9s/4m00.0s

running (0m04.9s), 002/150 VUs, 9 complete and 0 interrupted iterations
default   [   2% ] 002/150 VUs  0m04.9s/4m00.0s

running (0m05.9s), 002/150 VUs, 13 complete and 0 interrupted iterations
default   [   2% ] 002/150 VUs  0m05.9s/4m00.0s

running (0m06.9s), 003/150 VUs, 16 complete and 0 interrupted iterations
default   [   3% ] 003/150 VUs  0m06.9s/4m00.0s

running (0m07.9s), 003/150 VUs, 21 complete and 0 interrupted iterations
default   [   3% ] 003/150 VUs  0m07.9s/4m00.0s

running (0m08.9s), 003/150 VUs, 26 complete and 0 interrupted iterations
default   [   4% ] 003/150 VUs  0m08.9s/4m00.0s

running (0m09.7s), 003/150 VUs, 29 complete and 0 interrupted iterations
default   [   4% ] 003/150 VUs  0m09.7s/4m00.0s

running (0m09.9s), 003/150 VUs, 31 complete and 0 interrupted iterations
default   [   4% ] 003/150 VUs  0m09.9s/4m00.0s

running (0m10.9s), 004/150 VUs, 36 complete and 0 interrupted iterations
default   [   5% ] 004/150 VUs  0m10.9s/4m00.0s

running (0m11.9s), 004/150 VUs, 42 complete and 0 interrupted iterations
default   [   5% ] 004/150 VUs  0m11.9s/4m00.0s

running (0m12.9s), 004/150 VUs, 48 complete and 0 interrupted iterations
default   [   5% ] 004/150 VUs  0m12.9s/4m00.0s

running (0m13.9s), 005/150 VUs, 55 complete and 0 interrupted iterations
default   [   6% ] 005/150 VUs  0m13.9s/4m00.0s

running (0m14.9s), 005/150 VUs, 64 complete and 0 interrupted iterations
default   [   6% ] 005/150 VUs  0m14.9s/4m00.0s

running (0m15.9s), 005/150 VUs, 72 complete and 0 interrupted iterations
default   [   7% ] 005/150 VUs  0m15.9s/4m00.0s

running (0m16.9s), 006/150 VUs, 79 complete and 0 interrupted iterations
default   [   7% ] 006/150 VUs  0m16.9s/4m00.0s

running (0m17.9s), 006/150 VUs, 88 complete and 0 interrupted iterations
default   [   7% ] 006/150 VUs  0m17.9s/4m00.0s

running (0m18.9s), 006/150 VUs, 98 complete and 0 interrupted iterations
default   [   8% ] 006/150 VUs  0m18.9s/4m00.0s

running (0m19.9s), 006/150 VUs, 109 complete and 0 interrupted iterations
default   [   8% ] 006/150 VUs  0m19.9s/4m00.0s

running (0m20.9s), 007/150 VUs, 119 complete and 0 interrupted iterations
default   [   9% ] 007/150 VUs  0m20.9s/4m00.0s

running (0m21.9s), 007/150 VUs, 131 complete and 0 interrupted iterations
default   [   9% ] 007/150 VUs  0m21.9s/4m00.0s

running (0m22.9s), 007/150 VUs, 142 complete and 0 interrupted iterations
default   [  10% ] 007/150 VUs  0m22.9s/4m00.0s

running (0m23.9s), 008/150 VUs, 154 complete and 0 interrupted iterations
default   [  10% ] 008/150 VUs  0m23.9s/4m00.0s

running (0m24.9s), 008/150 VUs, 166 complete and 0 interrupted iterations
default   [  10% ] 008/150 VUs  0m24.9s/4m00.0s

running (0m25.9s), 008/150 VUs, 179 complete and 0 interrupted iterations
default   [  11% ] 008/150 VUs  0m25.9s/4m00.0s

running (0m26.9s), 009/150 VUs, 192 complete and 0 interrupted iterations
default   [  11% ] 009/150 VUs  0m26.9s/4m00.0s

running (0m27.9s), 009/150 VUs, 208 complete and 0 interrupted iterations
default   [  12% ] 009/150 VUs  0m27.9s/4m00.0s

running (0m28.9s), 009/150 VUs, 222 complete and 0 interrupted iterations
default   [  12% ] 009/150 VUs  0m28.9s/4m00.0s

running (0m29.9s), 009/150 VUs, 237 complete and 0 interrupted iterations
default   [  12% ] 009/150 VUs  0m29.9s/4m00.0s

running (0m30.9s), 010/150 VUs, 251 complete and 0 interrupted iterations
default   [  13% ] 010/150 VUs  0m30.9s/4m00.0s

running (0m31.9s), 011/150 VUs, 269 complete and 0 interrupted iterations
default   [  13% ] 011/150 VUs  0m31.9s/4m00.0s

running (0m32.9s), 011/150 VUs, 287 complete and 0 interrupted iterations
default   [  14% ] 011/150 VUs  0m32.9s/4m00.0s

running (0m33.9s), 012/150 VUs, 304 complete and 0 interrupted iterations
default   [  14% ] 012/150 VUs  0m33.9s/4m00.0s

running (0m34.9s), 013/150 VUs, 326 complete and 0 interrupted iterations
default   [  15% ] 013/150 VUs  0m34.9s/4m00.0s

running (0m35.9s), 013/150 VUs, 347 complete and 0 interrupted iterations
default   [  15% ] 013/150 VUs  0m35.9s/4m00.0s

running (0m36.9s), 014/150 VUs, 368 complete and 0 interrupted iterations
default   [  15% ] 014/150 VUs  0m36.9s/4m00.0s

running (0m37.9s), 015/150 VUs, 392 complete and 0 interrupted iterations
default   [  16% ] 015/150 VUs  0m37.9s/4m00.0s

running (0m38.9s), 015/150 VUs, 416 complete and 0 interrupted iterations
default   [  16% ] 015/150 VUs  0m38.9s/4m00.0s

running (0m39.9s), 016/150 VUs, 442 complete and 0 interrupted iterations
default   [  17% ] 016/150 VUs  0m39.9s/4m00.0s

running (0m40.9s), 017/150 VUs, 468 complete and 0 interrupted iterations
default   [  17% ] 017/150 VUs  0m40.9s/4m00.0s

running (0m41.9s), 017/150 VUs, 494 complete and 0 interrupted iterations
default   [  17% ] 017/150 VUs  0m41.9s/4m00.0s

running (0m42.9s), 018/150 VUs, 524 complete and 0 interrupted iterations
default   [  18% ] 018/150 VUs  0m42.9s/4m00.0s

running (0m43.9s), 019/150 VUs, 553 complete and 0 interrupted iterations
default   [  18% ] 019/150 VUs  0m43.9s/4m00.0s

running (0m44.9s), 019/150 VUs, 584 complete and 0 interrupted iterations
default   [  19% ] 019/150 VUs  0m44.9s/4m00.0s

running (0m45.9s), 020/150 VUs, 616 complete and 0 interrupted iterations
default   [  19% ] 020/150 VUs  0m45.9s/4m00.0s

running (0m46.9s), 021/150 VUs, 648 complete and 0 interrupted iterations
default   [  20% ] 021/150 VUs  0m46.9s/4m00.0s

running (0m47.9s), 021/150 VUs, 684 complete and 0 interrupted iterations
default   [  20% ] 021/150 VUs  0m47.9s/4m00.0s

running (0m48.9s), 022/150 VUs, 718 complete and 0 interrupted iterations
default   [  20% ] 022/150 VUs  0m48.9s/4m00.0s

running (0m49.9s), 023/150 VUs, 753 complete and 0 interrupted iterations
default   [  21% ] 023/150 VUs  0m49.9s/4m00.0s

running (0m50.9s), 023/150 VUs, 790 complete and 0 interrupted iterations
default   [  21% ] 023/150 VUs  0m50.9s/4m00.0s

running (0m51.9s), 024/150 VUs, 829 complete and 0 interrupted iterations
default   [  22% ] 024/150 VUs  0m51.9s/4m00.0s

running (0m52.9s), 025/150 VUs, 868 complete and 0 interrupted iterations
default   [  22% ] 025/150 VUs  0m52.9s/4m00.0s

running (0m53.9s), 025/150 VUs, 910 complete and 0 interrupted iterations
default   [  22% ] 025/150 VUs  0m53.9s/4m00.0s

running (0m54.9s), 026/150 VUs, 947 complete and 0 interrupted iterations
default   [  23% ] 026/150 VUs  0m54.9s/4m00.0s

running (0m55.9s), 027/150 VUs, 994 complete and 0 interrupted iterations
default   [  23% ] 027/150 VUs  0m55.9s/4m00.0s

running (0m56.9s), 027/150 VUs, 1036 complete and 0 interrupted iterations
default   [  24% ] 027/150 VUs  0m56.9s/4m00.0s

running (0m57.9s), 028/150 VUs, 1079 complete and 0 interrupted iterations
default   [  24% ] 028/150 VUs  0m57.9s/4m00.0s

running (0m58.9s), 029/150 VUs, 1126 complete and 0 interrupted iterations
default   [  25% ] 029/150 VUs  0m58.9s/4m00.0s

running (0m59.9s), 029/150 VUs, 1170 complete and 0 interrupted iterations
default   [  25% ] 029/150 VUs  0m59.9s/4m00.0s

running (1m00.9s), 030/150 VUs, 1220 complete and 0 interrupted iterations
default   [  25% ] 030/150 VUs  1m00.9s/4m00.0s

running (1m01.9s), 031/150 VUs, 1270 complete and 0 interrupted iterations
default   [  26% ] 031/150 VUs  1m01.9s/4m00.0s

running (1m02.9s), 031/150 VUs, 1317 complete and 0 interrupted iterations
default   [  26% ] 031/150 VUs  1m02.9s/4m00.0s

running (1m03.9s), 032/150 VUs, 1373 complete and 0 interrupted iterations
default   [  27% ] 032/150 VUs  1m03.9s/4m00.0s

running (1m04.9s), 033/150 VUs, 1417 complete and 0 interrupted iterations
default   [  27% ] 033/150 VUs  1m04.9s/4m00.0s

running (1m05.9s), 033/150 VUs, 1476 complete and 0 interrupted iterations
default   [  27% ] 033/150 VUs  1m05.9s/4m00.0s

running (1m06.9s), 034/150 VUs, 1527 complete and 0 interrupted iterations
default   [  28% ] 034/150 VUs  1m06.9s/4m00.0s

running (1m07.9s), 035/150 VUs, 1584 complete and 0 interrupted iterations
default   [  28% ] 035/150 VUs  1m07.9s/4m00.0s

running (1m08.9s), 035/150 VUs, 1645 complete and 0 interrupted iterations
default   [  29% ] 035/150 VUs  1m08.9s/4m00.0s

running (1m09.9s), 036/150 VUs, 1698 complete and 0 interrupted iterations
default   [  29% ] 036/150 VUs  1m09.9s/4m00.0s

running (1m10.9s), 037/150 VUs, 1758 complete and 0 interrupted iterations
default   [  30% ] 037/150 VUs  1m10.9s/4m00.0s

running (1m11.9s), 037/150 VUs, 1820 complete and 0 interrupted iterations
default   [  30% ] 037/150 VUs  1m11.9s/4m00.0s

running (1m12.9s), 038/150 VUs, 1875 complete and 0 interrupted iterations
default   [  30% ] 038/150 VUs  1m12.9s/4m00.0s

running (1m13.9s), 039/150 VUs, 1942 complete and 0 interrupted iterations
default   [  31% ] 039/150 VUs  1m13.9s/4m00.0s

running (1m14.9s), 039/150 VUs, 2003 complete and 0 interrupted iterations
default   [  31% ] 039/150 VUs  1m14.9s/4m00.0s

running (1m15.9s), 040/150 VUs, 2068 complete and 0 interrupted iterations
default   [  32% ] 040/150 VUs  1m15.9s/4m00.0s

running (1m16.9s), 041/150 VUs, 2135 complete and 0 interrupted iterations
default   [  32% ] 041/150 VUs  1m16.9s/4m00.0s

running (1m17.9s), 041/150 VUs, 2196 complete and 0 interrupted iterations
default   [  32% ] 041/150 VUs  1m17.9s/4m00.0s

running (1m18.9s), 042/150 VUs, 2268 complete and 0 interrupted iterations
default   [  33% ] 042/150 VUs  1m18.9s/4m00.0s

running (1m19.9s), 043/150 VUs, 2332 complete and 0 interrupted iterations
default   [  33% ] 043/150 VUs  1m19.9s/4m00.0s

running (1m20.9s), 043/150 VUs, 2402 complete and 0 interrupted iterations
default   [  34% ] 043/150 VUs  1m20.9s/4m00.0s

running (1m21.9s), 044/150 VUs, 2471 complete and 0 interrupted iterations
default   [  34% ] 044/150 VUs  1m21.9s/4m00.0s

running (1m22.9s), 045/150 VUs, 2541 complete and 0 interrupted iterations
default   [  35% ] 045/150 VUs  1m22.9s/4m00.0s

running (1m23.9s), 045/150 VUs, 2611 complete and 0 interrupted iterations
default   [  35% ] 045/150 VUs  1m23.9s/4m00.0s

running (1m24.9s), 046/150 VUs, 2683 complete and 0 interrupted iterations
default   [  35% ] 046/150 VUs  1m24.9s/4m00.0s

running (1m25.9s), 047/150 VUs, 2756 complete and 0 interrupted iterations
default   [  36% ] 047/150 VUs  1m25.9s/4m00.0s

running (1m26.9s), 047/150 VUs, 2830 complete and 0 interrupted iterations
default   [  36% ] 047/150 VUs  1m26.9s/4m00.0s

running (1m27.9s), 048/150 VUs, 2905 complete and 0 interrupted iterations
default   [  37% ] 048/150 VUs  1m27.9s/4m00.0s

running (1m28.9s), 049/150 VUs, 2970 complete and 0 interrupted iterations
default   [  37% ] 049/150 VUs  1m28.9s/4m00.0s

running (1m29.9s), 049/150 VUs, 3049 complete and 0 interrupted iterations
default   [  37% ] 049/150 VUs  1m29.9s/4m00.0s

running (1m30.9s), 050/150 VUs, 3124 complete and 0 interrupted iterations
default   [  38% ] 050/150 VUs  1m30.9s/4m00.0s

running (1m31.9s), 051/150 VUs, 3202 complete and 0 interrupted iterations
default   [  38% ] 051/150 VUs  1m31.9s/4m00.0s

running (1m32.9s), 052/150 VUs, 3284 complete and 0 interrupted iterations
default   [  39% ] 052/150 VUs  1m32.9s/4m00.0s

running (1m33.9s), 053/150 VUs, 3353 complete and 0 interrupted iterations
default   [  39% ] 053/150 VUs  1m33.9s/4m00.0s

running (1m34.9s), 054/150 VUs, 3436 complete and 0 interrupted iterations
default   [  40% ] 054/150 VUs  1m34.9s/4m00.0s

running (1m35.9s), 054/150 VUs, 3519 complete and 0 interrupted iterations
default   [  40% ] 054/150 VUs  1m35.9s/4m00.0s

running (1m36.9s), 055/150 VUs, 3604 complete and 0 interrupted iterations
default   [  40% ] 055/150 VUs  1m36.9s/4m00.0s

running (1m37.9s), 056/150 VUs, 3693 complete and 0 interrupted iterations
default   [  41% ] 056/150 VUs  1m37.9s/4m00.0s

running (1m38.9s), 057/150 VUs, 3779 complete and 0 interrupted iterations
default   [  41% ] 057/150 VUs  1m38.9s/4m00.0s

running (1m39.9s), 058/150 VUs, 3869 complete and 0 interrupted iterations
default   [  42% ] 058/150 VUs  1m39.9s/4m00.0s

running (1m40.9s), 059/150 VUs, 3958 complete and 0 interrupted iterations
default   [  42% ] 059/150 VUs  1m40.9s/4m00.0s

running (1m41.9s), 059/150 VUs, 4054 complete and 0 interrupted iterations
default   [  42% ] 059/150 VUs  1m41.9s/4m00.0s

running (1m42.9s), 060/150 VUs, 4142 complete and 0 interrupted iterations
default   [  43% ] 060/150 VUs  1m42.9s/4m00.0s

running (1m43.9s), 061/150 VUs, 4232 complete and 0 interrupted iterations
default   [  43% ] 061/150 VUs  1m43.9s/4m00.0s

running (1m44.9s), 062/150 VUs, 4322 complete and 0 interrupted iterations
default   [  44% ] 062/150 VUs  1m44.9s/4m00.0s

running (1m45.9s), 063/150 VUs, 4417 complete and 0 interrupted iterations
default   [  44% ] 063/150 VUs  1m45.9s/4m00.0s

running (1m46.9s), 064/150 VUs, 4511 complete and 0 interrupted iterations
default   [  45% ] 064/150 VUs  1m46.9s/4m00.0s

running (1m47.9s), 064/150 VUs, 4604 complete and 0 interrupted iterations
default   [  45% ] 064/150 VUs  1m47.9s/4m00.0s

running (1m48.9s), 065/150 VUs, 4696 complete and 0 interrupted iterations
default   [  45% ] 065/150 VUs  1m48.9s/4m00.0s

running (1m49.9s), 066/150 VUs, 4790 complete and 0 interrupted iterations
default   [  46% ] 066/150 VUs  1m49.9s/4m00.0s

running (1m50.9s), 067/150 VUs, 4882 complete and 0 interrupted iterations
default   [  46% ] 067/150 VUs  1m50.9s/4m00.0s

running (1m51.9s), 068/150 VUs, 4972 complete and 0 interrupted iterations
default   [  47% ] 068/150 VUs  1m51.9s/4m00.0s

running (1m52.9s), 069/150 VUs, 5062 complete and 0 interrupted iterations
default   [  47% ] 069/150 VUs  1m52.9s/4m00.0s

running (1m53.9s), 069/150 VUs, 5145 complete and 0 interrupted iterations
default   [  47% ] 069/150 VUs  1m53.9s/4m00.0s

running (1m54.9s), 070/150 VUs, 5234 complete and 0 interrupted iterations
default   [  48% ] 070/150 VUs  1m54.9s/4m00.0s

running (1m55.9s), 071/150 VUs, 5294 complete and 0 interrupted iterations
default   [  48% ] 071/150 VUs  1m55.9s/4m00.0s

running (1m56.9s), 072/150 VUs, 5364 complete and 0 interrupted iterations
default   [  49% ] 072/150 VUs  1m56.9s/4m00.0s

running (1m57.9s), 073/150 VUs, 5434 complete and 0 interrupted iterations
default   [  49% ] 073/150 VUs  1m57.9s/4m00.0s

running (1m58.9s), 074/150 VUs, 5496 complete and 0 interrupted iterations
default   [  50% ] 074/150 VUs  1m58.9s/4m00.0s

running (1m59.9s), 074/150 VUs, 5542 complete and 0 interrupted iterations
default   [  50% ] 074/150 VUs  1m59.9s/4m00.0s

running (2m00.9s), 075/150 VUs, 5591 complete and 0 interrupted iterations
default   [  50% ] 075/150 VUs  2m00.9s/4m00.0s

running (2m01.9s), 076/150 VUs, 5679 complete and 0 interrupted iterations
default   [  51% ] 076/150 VUs  2m01.9s/4m00.0s

running (2m02.9s), 077/150 VUs, 5752 complete and 0 interrupted iterations
default   [  51% ] 077/150 VUs  2m02.9s/4m00.0s

running (2m03.9s), 078/150 VUs, 5802 complete and 0 interrupted iterations
default   [  52% ] 078/150 VUs  2m03.9s/4m00.0s

running (2m04.9s), 079/150 VUs, 5873 complete and 0 interrupted iterations
default   [  52% ] 079/150 VUs  2m04.9s/4m00.0s

running (2m05.9s), 079/150 VUs, 5926 complete and 0 interrupted iterations
default   [  52% ] 079/150 VUs  2m05.9s/4m00.0s

running (2m06.9s), 080/150 VUs, 6001 complete and 0 interrupted iterations
default   [  53% ] 080/150 VUs  2m06.9s/4m00.0s

running (2m07.9s), 081/150 VUs, 6079 complete and 0 interrupted iterations
default   [  53% ] 081/150 VUs  2m07.9s/4m00.0s

running (2m08.9s), 082/150 VUs, 6174 complete and 0 interrupted iterations
default   [  54% ] 082/150 VUs  2m08.9s/4m00.0s

running (2m09.9s), 083/150 VUs, 6264 complete and 0 interrupted iterations
default   [  54% ] 083/150 VUs  2m09.9s/4m00.0s

running (2m10.9s), 084/150 VUs, 6355 complete and 0 interrupted iterations
default   [  55% ] 084/150 VUs  2m10.9s/4m00.0s

running (2m11.9s), 084/150 VUs, 6445 complete and 0 interrupted iterations
default   [  55% ] 084/150 VUs  2m11.9s/4m00.0s

running (2m12.9s), 085/150 VUs, 6535 complete and 0 interrupted iterations
default   [  55% ] 085/150 VUs  2m12.9s/4m00.0s

running (2m13.9s), 086/150 VUs, 6584 complete and 0 interrupted iterations
default   [  56% ] 086/150 VUs  2m13.9s/4m00.0s

running (2m14.9s), 087/150 VUs, 6640 complete and 0 interrupted iterations
default   [  56% ] 087/150 VUs  2m14.9s/4m00.0s

running (2m15.9s), 088/150 VUs, 6687 complete and 0 interrupted iterations
default   [  57% ] 088/150 VUs  2m15.9s/4m00.0s

running (2m16.9s), 089/150 VUs, 6743 complete and 0 interrupted iterations
default   [  57% ] 089/150 VUs  2m16.9s/4m00.0s

running (2m17.9s), 089/150 VUs, 6785 complete and 0 interrupted iterations
default   [  57% ] 089/150 VUs  2m17.9s/4m00.0s

running (2m18.9s), 090/150 VUs, 6839 complete and 0 interrupted iterations
default   [  58% ] 090/150 VUs  2m18.9s/4m00.0s

running (2m19.9s), 091/150 VUs, 6910 complete and 0 interrupted iterations
default   [  58% ] 091/150 VUs  2m19.9s/4m00.0s

running (2m20.9s), 092/150 VUs, 6981 complete and 0 interrupted iterations
default   [  59% ] 092/150 VUs  2m20.9s/4m00.0s

running (2m21.9s), 093/150 VUs, 7052 complete and 0 interrupted iterations
default   [  59% ] 093/150 VUs  2m21.9s/4m00.0s

running (2m22.9s), 094/150 VUs, 7131 complete and 0 interrupted iterations
default   [  60% ] 094/150 VUs  2m22.9s/4m00.0s

running (2m23.9s), 094/150 VUs, 7219 complete and 0 interrupted iterations
default   [  60% ] 094/150 VUs  2m23.9s/4m00.0s

running (2m24.9s), 095/150 VUs, 7309 complete and 0 interrupted iterations
default   [  60% ] 095/150 VUs  2m24.9s/4m00.0s

running (2m25.9s), 096/150 VUs, 7391 complete and 0 interrupted iterations
default   [  61% ] 096/150 VUs  2m25.9s/4m00.0s

running (2m26.9s), 097/150 VUs, 7489 complete and 0 interrupted iterations
default   [  61% ] 097/150 VUs  2m26.9s/4m00.0s

running (2m27.9s), 098/150 VUs, 7573 complete and 0 interrupted iterations
default   [  62% ] 098/150 VUs  2m27.9s/4m00.0s

running (2m28.9s), 099/150 VUs, 7663 complete and 0 interrupted iterations
default   [  62% ] 099/150 VUs  2m28.9s/4m00.0s

running (2m29.9s), 099/150 VUs, 7752 complete and 0 interrupted iterations
default   [  62% ] 099/150 VUs  2m29.9s/4m00.0s

running (2m30.9s), 100/150 VUs, 7843 complete and 0 interrupted iterations
default   [  63% ] 100/150 VUs  2m30.9s/4m00.0s

running (2m31.9s), 101/150 VUs, 7920 complete and 0 interrupted iterations
default   [  63% ] 101/150 VUs  2m31.9s/4m00.0s

running (2m32.9s), 102/150 VUs, 8019 complete and 0 interrupted iterations
default   [  64% ] 102/150 VUs  2m32.9s/4m00.0s

running (2m33.9s), 103/150 VUs, 8109 complete and 0 interrupted iterations
default   [  64% ] 103/150 VUs  2m33.9s/4m00.0s

running (2m34.9s), 104/150 VUs, 8180 complete and 0 interrupted iterations
default   [  65% ] 104/150 VUs  2m34.9s/4m00.0s

running (2m35.9s), 104/150 VUs, 8260 complete and 0 interrupted iterations
default   [  65% ] 104/150 VUs  2m35.9s/4m00.0s

running (2m36.9s), 105/150 VUs, 8337 complete and 0 interrupted iterations
default   [  65% ] 105/150 VUs  2m36.9s/4m00.0s

running (2m37.9s), 106/150 VUs, 8426 complete and 0 interrupted iterations
default   [  66% ] 106/150 VUs  2m37.9s/4m00.0s

running (2m38.9s), 107/150 VUs, 8504 complete and 0 interrupted iterations
default   [  66% ] 107/150 VUs  2m38.9s/4m00.0s

running (2m39.9s), 108/150 VUs, 8563 complete and 0 interrupted iterations
default   [  67% ] 108/150 VUs  2m39.9s/4m00.0s

running (2m40.9s), 109/150 VUs, 8631 complete and 0 interrupted iterations
default   [  67% ] 109/150 VUs  2m40.9s/4m00.0s

running (2m41.9s), 109/150 VUs, 8694 complete and 0 interrupted iterations
default   [  67% ] 109/150 VUs  2m41.9s/4m00.0s

running (2m42.9s), 110/150 VUs, 8765 complete and 0 interrupted iterations
default   [  68% ] 110/150 VUs  2m42.9s/4m00.0s

running (2m43.9s), 111/150 VUs, 8814 complete and 0 interrupted iterations
default   [  68% ] 111/150 VUs  2m43.9s/4m00.0s

running (2m44.9s), 112/150 VUs, 8887 complete and 0 interrupted iterations
default   [  69% ] 112/150 VUs  2m44.9s/4m00.0s

running (2m45.9s), 113/150 VUs, 8961 complete and 0 interrupted iterations
default   [  69% ] 113/150 VUs  2m45.9s/4m00.0s

running (2m46.9s), 114/150 VUs, 9046 complete and 0 interrupted iterations
default   [  70% ] 114/150 VUs  2m46.9s/4m00.0s

running (2m47.9s), 114/150 VUs, 9131 complete and 0 interrupted iterations
default   [  70% ] 114/150 VUs  2m47.9s/4m00.0s

running (2m48.9s), 115/150 VUs, 9218 complete and 0 interrupted iterations
default   [  70% ] 115/150 VUs  2m48.9s/4m00.0s

running (2m49.9s), 116/150 VUs, 9313 complete and 0 interrupted iterations
default   [  71% ] 116/150 VUs  2m49.9s/4m00.0s

running (2m50.9s), 117/150 VUs, 9390 complete and 0 interrupted iterations
default   [  71% ] 117/150 VUs  2m50.9s/4m00.0s

running (2m51.9s), 118/150 VUs, 9459 complete and 0 interrupted iterations
default   [  72% ] 118/150 VUs  2m51.9s/4m00.0s

running (2m52.9s), 119/150 VUs, 9534 complete and 0 interrupted iterations
default   [  72% ] 119/150 VUs  2m52.9s/4m00.0s

running (2m53.9s), 119/150 VUs, 9601 complete and 0 interrupted iterations
default   [  72% ] 119/150 VUs  2m53.9s/4m00.0s

running (2m54.9s), 120/150 VUs, 9665 complete and 0 interrupted iterations
default   [  73% ] 120/150 VUs  2m54.9s/4m00.0s

running (2m55.9s), 121/150 VUs, 9733 complete and 0 interrupted iterations
default   [  73% ] 121/150 VUs  2m55.9s/4m00.0s

running (2m56.9s), 122/150 VUs, 9790 complete and 0 interrupted iterations
default   [  74% ] 122/150 VUs  2m56.9s/4m00.0s

running (2m57.9s), 123/150 VUs, 9896 complete and 0 interrupted iterations
default   [  74% ] 123/150 VUs  2m57.9s/4m00.0s

running (2m58.9s), 124/150 VUs, 9966 complete and 0 interrupted iterations
default   [  75% ] 124/150 VUs  2m58.9s/4m00.0s

running (2m59.9s), 124/150 VUs, 10051 complete and 0 interrupted iterations
default   [  75% ] 124/150 VUs  2m59.9s/4m00.0s

running (3m00.9s), 125/150 VUs, 10124 complete and 0 interrupted iterations
default   [  75% ] 125/150 VUs  3m00.9s/4m00.0s

running (3m01.9s), 126/150 VUs, 10216 complete and 0 interrupted iterations
default   [  76% ] 126/150 VUs  3m01.9s/4m00.0s

running (3m02.9s), 127/150 VUs, 10302 complete and 0 interrupted iterations
default   [  76% ] 127/150 VUs  3m02.9s/4m00.0s

running (3m03.9s), 128/150 VUs, 10400 complete and 0 interrupted iterations
default   [  77% ] 128/150 VUs  3m03.9s/4m00.0s

running (3m04.9s), 129/150 VUs, 10493 complete and 0 interrupted iterations
default   [  77% ] 129/150 VUs  3m04.9s/4m00.0s

running (3m05.9s), 129/150 VUs, 10585 complete and 0 interrupted iterations
default   [  77% ] 129/150 VUs  3m05.9s/4m00.0s

running (3m06.9s), 130/150 VUs, 10677 complete and 0 interrupted iterations
default   [  78% ] 130/150 VUs  3m06.9s/4m00.0s

running (3m07.9s), 131/150 VUs, 10771 complete and 0 interrupted iterations
default   [  78% ] 131/150 VUs  3m07.9s/4m00.0s

running (3m08.9s), 132/150 VUs, 10863 complete and 0 interrupted iterations
default   [  79% ] 132/150 VUs  3m08.9s/4m00.0s

running (3m09.9s), 133/150 VUs, 10957 complete and 0 interrupted iterations
default   [  79% ] 133/150 VUs  3m09.9s/4m00.0s

running (3m10.9s), 134/150 VUs, 11050 complete and 0 interrupted iterations
default   [  80% ] 134/150 VUs  3m10.9s/4m00.0s

running (3m11.9s), 134/150 VUs, 11144 complete and 0 interrupted iterations
default   [  80% ] 134/150 VUs  3m11.9s/4m00.0s

running (3m12.9s), 135/150 VUs, 11237 complete and 0 interrupted iterations
default   [  80% ] 135/150 VUs  3m12.9s/4m00.0s

running (3m13.9s), 136/150 VUs, 11317 complete and 0 interrupted iterations
default   [  81% ] 136/150 VUs  3m13.9s/4m00.0s

running (3m14.9s), 137/150 VUs, 11414 complete and 0 interrupted iterations
default   [  81% ] 137/150 VUs  3m14.9s/4m00.0s

running (3m15.9s), 138/150 VUs, 11500 complete and 0 interrupted iterations
default   [  82% ] 138/150 VUs  3m15.9s/4m00.0s

running (3m16.9s), 139/150 VUs, 11597 complete and 0 interrupted iterations
default   [  82% ] 139/150 VUs  3m16.9s/4m00.0s

running (3m17.9s), 139/150 VUs, 11688 complete and 0 interrupted iterations
default   [  82% ] 139/150 VUs  3m17.9s/4m00.0s

running (3m18.9s), 140/150 VUs, 11780 complete and 0 interrupted iterations
default   [  83% ] 140/150 VUs  3m18.9s/4m00.0s

running (3m19.9s), 141/150 VUs, 11869 complete and 0 interrupted iterations
default   [  83% ] 141/150 VUs  3m19.9s/4m00.0s

running (3m20.9s), 142/150 VUs, 11961 complete and 0 interrupted iterations
default   [  84% ] 142/150 VUs  3m20.9s/4m00.0s

running (3m21.9s), 143/150 VUs, 12052 complete and 0 interrupted iterations
default   [  84% ] 143/150 VUs  3m21.9s/4m00.0s

running (3m22.9s), 144/150 VUs, 12149 complete and 0 interrupted iterations
default   [  85% ] 144/150 VUs  3m22.9s/4m00.0s

running (3m23.9s), 144/150 VUs, 12244 complete and 0 interrupted iterations
default   [  85% ] 144/150 VUs  3m23.9s/4m00.0s

running (3m24.9s), 145/150 VUs, 12337 complete and 0 interrupted iterations
default   [  85% ] 145/150 VUs  3m24.9s/4m00.0s

running (3m25.9s), 146/150 VUs, 12427 complete and 0 interrupted iterations
default   [  86% ] 146/150 VUs  3m25.9s/4m00.0s

running (3m26.9s), 147/150 VUs, 12517 complete and 0 interrupted iterations
default   [  86% ] 147/150 VUs  3m26.9s/4m00.0s

running (3m27.9s), 148/150 VUs, 12614 complete and 0 interrupted iterations
default   [  87% ] 148/150 VUs  3m27.9s/4m00.0s

running (3m28.9s), 149/150 VUs, 12703 complete and 0 interrupted iterations
default   [  87% ] 149/150 VUs  3m28.9s/4m00.0s

running (3m29.9s), 149/150 VUs, 12799 complete and 0 interrupted iterations
default   [  87% ] 149/150 VUs  3m29.9s/4m00.0s

running (3m30.9s), 148/150 VUs, 12894 complete and 0 interrupted iterations
default   [  88% ] 148/150 VUs  3m30.9s/4m00.0s

running (3m31.9s), 145/150 VUs, 12987 complete and 0 interrupted iterations
default   [  88% ] 145/150 VUs  3m31.9s/4m00.0s

running (3m32.9s), 138/150 VUs, 13080 complete and 0 interrupted iterations
default   [  89% ] 138/150 VUs  3m32.9s/4m00.0s

running (3m33.9s), 133/150 VUs, 13163 complete and 0 interrupted iterations
default   [  89% ] 133/150 VUs  3m33.9s/4m00.0s

running (3m34.9s), 128/150 VUs, 13262 complete and 0 interrupted iterations
default   [  90% ] 128/150 VUs  3m34.9s/4m00.0s

running (3m35.9s), 124/150 VUs, 13357 complete and 0 interrupted iterations
default   [  90% ] 124/150 VUs  3m35.9s/4m00.0s

running (3m36.9s), 119/150 VUs, 13450 complete and 0 interrupted iterations
default   [  90% ] 119/150 VUs  3m36.9s/4m00.0s

running (3m37.9s), 112/150 VUs, 13545 complete and 0 interrupted iterations
default   [  91% ] 112/150 VUs  3m37.9s/4m00.0s

running (3m38.9s), 109/150 VUs, 13638 complete and 0 interrupted iterations
default   [  91% ] 109/150 VUs  3m38.9s/4m00.0s

running (3m39.9s), 104/150 VUs, 13733 complete and 0 interrupted iterations
default   [  92% ] 104/150 VUs  3m39.9s/4m00.0s

running (3m40.9s), 098/150 VUs, 13825 complete and 0 interrupted iterations
default   [  92% ] 098/150 VUs  3m40.9s/4m00.0s

running (3m41.9s), 094/150 VUs, 13919 complete and 0 interrupted iterations
default   [  92% ] 094/150 VUs  3m41.9s/4m00.0s

running (3m42.9s), 089/150 VUs, 14013 complete and 0 interrupted iterations
default   [  93% ] 089/150 VUs  3m42.9s/4m00.0s

running (3m43.9s), 083/150 VUs, 14105 complete and 0 interrupted iterations
default   [  93% ] 083/150 VUs  3m43.9s/4m00.0s

running (3m44.9s), 079/150 VUs, 14199 complete and 0 interrupted iterations
default   [  94% ] 079/150 VUs  3m44.9s/4m00.0s

running (3m45.9s), 073/150 VUs, 14288 complete and 0 interrupted iterations
default   [  94% ] 073/150 VUs  3m45.9s/4m00.0s

running (3m46.9s), 069/150 VUs, 14385 complete and 0 interrupted iterations
default   [  95% ] 069/150 VUs  3m46.9s/4m00.0s

running (3m47.9s), 064/150 VUs, 14477 complete and 0 interrupted iterations
default   [  95% ] 064/150 VUs  3m47.9s/4m00.0s

running (3m48.9s), 057/150 VUs, 14567 complete and 0 interrupted iterations
default   [  95% ] 057/150 VUs  3m48.9s/4m00.0s

running (3m49.9s), 052/150 VUs, 14656 complete and 0 interrupted iterations
default   [  96% ] 052/150 VUs  3m49.9s/4m00.0s

running (3m50.9s), 047/150 VUs, 14740 complete and 0 interrupted iterations
default   [  96% ] 047/150 VUs  3m50.9s/4m00.0s

running (3m51.9s), 041/150 VUs, 14814 complete and 0 interrupted iterations
default   [  97% ] 041/150 VUs  3m51.9s/4m00.0s

running (3m52.9s), 038/150 VUs, 14879 complete and 0 interrupted iterations
default   [  97% ] 038/150 VUs  3m52.9s/4m00.0s

running (3m53.9s), 032/150 VUs, 14934 complete and 0 interrupted iterations
default   [  97% ] 032/150 VUs  3m53.9s/4m00.0s

running (3m54.9s), 027/150 VUs, 14985 complete and 0 interrupted iterations
default   [  98% ] 027/150 VUs  3m54.9s/4m00.0s

running (3m55.9s), 022/150 VUs, 15030 complete and 0 interrupted iterations
default   [  98% ] 022/150 VUs  3m55.9s/4m00.0s

running (3m56.9s), 018/150 VUs, 15063 complete and 0 interrupted iterations
default   [  99% ] 018/150 VUs  3m56.9s/4m00.0s

running (3m57.9s), 012/150 VUs, 15090 complete and 0 interrupted iterations
default   [  99% ] 012/150 VUs  3m57.9s/4m00.0s

running (3m58.9s), 007/150 VUs, 15108 complete and 0 interrupted iterations
default   [ 100% ] 007/150 VUs  3m58.9s/4m00.0s

running (3m59.9s), 004/150 VUs, 15117 complete and 0 interrupted iterations
default   [ 100% ] 004/150 VUs  3m59.9s/4m00.0s


  █ THRESHOLDS 

    http_req_duration
    ✗ 'p(95)<1000' p(95)=1.03s
    ✓ 'p(99)<2000' p(99)=1.14s

    http_req_failed
    ✓ 'rate<0.05' rate=0.00%


  █ TOTAL RESULTS 

    checks_total.......: 30244   125.756073/s
    checks_succeeded...: 100.00% 30244 out of 30244
    checks_failed......: 0.00%   0 out of 30244

    ✓ a: status 200
    ✓ b: status 200

    HTTP
    http_req_duration..............: avg=284.64ms min=2.82ms   med=109.1ms max=1.48s p(90)=948.43ms p(95)=1.03s
      { expected_response:true }...: avg=284.64ms min=2.82ms   med=109.1ms max=1.48s p(90)=948.43ms p(95)=1.03s
    http_req_failed................: 0.00%  0 out of 30244
    http_reqs......................: 30244  125.756073/s

    EXECUTION
    iteration_duration.............: avg=1.07s    min=608.95ms med=1.06s   max=2.35s p(90)=1.58s    p(95)=1.64s
    iterations.....................: 15122  62.878037/s
    vus............................: 3      min=1          max=149
    vus_max........................: 150    min=150        max=150

    NETWORK
    data_received..................: 9.4 MB 39 kB/s
    data_sent......................: 2.9 MB 12 kB/s




running (4m00.5s), 000/150 VUs, 15122 complete and 0 interrupted iterations
default ✓ [ 100% ] 000/150 VUs  4m0s
