
         /\      Grafana   /‾‾/  
    /\  /  \     |\  __   /  /   
   /  \/    \    | |/ /  /   ‾‾\ 
  /          \   |   (  |  (‾)  |
 / __________ \  |_|\_\  \_____/ 

     execution: local
        script: /home/edilberto/pspd/atividade-final-pspd/load/ramp.js
        output: json (/home/edilberto/pspd/atividade-final-pspd/test_results/scenario_1/ramp/metrics.json)

     scenarios: (100.00%) 1 scenario, 150 max VUs, 4m30s max duration (incl. graceful stop):
              * default: Up to 150 looping VUs for 4m0s over 5 stages (gracefulRampDown: 30s, gracefulStop: 30s)


running (0m00.8s), 001/150 VUs, 0 complete and 0 interrupted iterations
default   [   0% ] 001/150 VUs  0m00.8s/4m00.0s

running (0m01.8s), 001/150 VUs, 2 complete and 0 interrupted iterations
default   [   1% ] 001/150 VUs  0m01.8s/4m00.0s

running (0m02.8s), 001/150 VUs, 3 complete and 0 interrupted iterations
default   [   1% ] 001/150 VUs  0m02.8s/4m00.0s

running (0m03.8s), 002/150 VUs, 5 complete and 0 interrupted iterations
default   [   2% ] 002/150 VUs  0m03.8s/4m00.0s

running (0m04.8s), 002/150 VUs, 9 complete and 0 interrupted iterations
default   [   2% ] 002/150 VUs  0m04.8s/4m00.0s

running (0m05.8s), 002/150 VUs, 11 complete and 0 interrupted iterations
default   [   2% ] 002/150 VUs  0m05.8s/4m00.0s

running (0m06.8s), 003/150 VUs, 15 complete and 0 interrupted iterations
default   [   3% ] 003/150 VUs  0m06.8s/4m00.0s

running (0m07.8s), 003/150 VUs, 19 complete and 0 interrupted iterations
default   [   3% ] 003/150 VUs  0m07.8s/4m00.0s

running (0m08.8s), 003/150 VUs, 24 complete and 0 interrupted iterations
default   [   4% ] 003/150 VUs  0m08.8s/4m00.0s

running (0m09.8s), 003/150 VUs, 30 complete and 0 interrupted iterations
default   [   4% ] 003/150 VUs  0m09.8s/4m00.0s

running (0m10.8s), 004/150 VUs, 35 complete and 0 interrupted iterations
default   [   5% ] 004/150 VUs  0m10.8s/4m00.0s

running (0m11.8s), 004/150 VUs, 41 complete and 0 interrupted iterations
default   [   5% ] 004/150 VUs  0m11.8s/4m00.0s

running (0m12.8s), 004/150 VUs, 48 complete and 0 interrupted iterations
default   [   5% ] 004/150 VUs  0m12.8s/4m00.0s

running (0m13.8s), 005/150 VUs, 54 complete and 0 interrupted iterations
default   [   6% ] 005/150 VUs  0m13.8s/4m00.0s

running (0m14.8s), 005/150 VUs, 63 complete and 0 interrupted iterations
default   [   6% ] 005/150 VUs  0m14.8s/4m00.0s

running (0m15.8s), 005/150 VUs, 70 complete and 0 interrupted iterations
default   [   7% ] 005/150 VUs  0m15.8s/4m00.0s

running (0m16.8s), 006/150 VUs, 78 complete and 0 interrupted iterations
default   [   7% ] 006/150 VUs  0m16.8s/4m00.0s

running (0m17.8s), 006/150 VUs, 87 complete and 0 interrupted iterations
default   [   7% ] 006/150 VUs  0m17.8s/4m00.0s

running (0m18.8s), 006/150 VUs, 97 complete and 0 interrupted iterations
default   [   8% ] 006/150 VUs  0m18.8s/4m00.0s

running (0m19.8s), 006/150 VUs, 108 complete and 0 interrupted iterations
default   [   8% ] 006/150 VUs  0m19.8s/4m00.0s

running (0m20.8s), 007/150 VUs, 117 complete and 0 interrupted iterations
default   [   9% ] 007/150 VUs  0m20.8s/4m00.0s

running (0m21.8s), 007/150 VUs, 129 complete and 0 interrupted iterations
default   [   9% ] 007/150 VUs  0m21.8s/4m00.0s

running (0m22.8s), 007/150 VUs, 140 complete and 0 interrupted iterations
default   [  10% ] 007/150 VUs  0m22.8s/4m00.0s

running (0m23.8s), 008/150 VUs, 152 complete and 0 interrupted iterations
default   [  10% ] 008/150 VUs  0m23.8s/4m00.0s

running (0m24.8s), 008/150 VUs, 165 complete and 0 interrupted iterations
default   [  10% ] 008/150 VUs  0m24.8s/4m00.0s

running (0m25.8s), 008/150 VUs, 176 complete and 0 interrupted iterations
default   [  11% ] 008/150 VUs  0m25.8s/4m00.0s

running (0m26.8s), 009/150 VUs, 190 complete and 0 interrupted iterations
default   [  11% ] 009/150 VUs  0m26.8s/4m00.0s

running (0m27.8s), 009/150 VUs, 204 complete and 0 interrupted iterations
default   [  12% ] 009/150 VUs  0m27.8s/4m00.0s

running (0m28.8s), 009/150 VUs, 219 complete and 0 interrupted iterations
default   [  12% ] 009/150 VUs  0m28.8s/4m00.0s

running (0m29.8s), 009/150 VUs, 233 complete and 0 interrupted iterations
default   [  12% ] 009/150 VUs  0m29.8s/4m00.0s

running (0m30.8s), 010/150 VUs, 247 complete and 0 interrupted iterations
default   [  13% ] 010/150 VUs  0m30.8s/4m00.0s

running (0m31.8s), 011/150 VUs, 264 complete and 0 interrupted iterations
default   [  13% ] 011/150 VUs  0m31.8s/4m00.0s

running (0m32.8s), 011/150 VUs, 281 complete and 0 interrupted iterations
default   [  14% ] 011/150 VUs  0m32.8s/4m00.0s

running (0m33.8s), 012/150 VUs, 300 complete and 0 interrupted iterations
default   [  14% ] 012/150 VUs  0m33.8s/4m00.0s

running (0m34.8s), 013/150 VUs, 319 complete and 0 interrupted iterations
default   [  15% ] 013/150 VUs  0m34.8s/4m00.0s

running (0m35.8s), 013/150 VUs, 339 complete and 0 interrupted iterations
default   [  15% ] 013/150 VUs  0m35.8s/4m00.0s

running (0m36.8s), 014/150 VUs, 363 complete and 0 interrupted iterations
default   [  15% ] 014/150 VUs  0m36.8s/4m00.0s

running (0m37.8s), 015/150 VUs, 384 complete and 0 interrupted iterations
default   [  16% ] 015/150 VUs  0m37.8s/4m00.0s

running (0m38.8s), 015/150 VUs, 409 complete and 0 interrupted iterations
default   [  16% ] 015/150 VUs  0m38.8s/4m00.0s

running (0m39.8s), 016/150 VUs, 434 complete and 0 interrupted iterations
default   [  17% ] 016/150 VUs  0m39.8s/4m00.0s

running (0m40.8s), 017/150 VUs, 457 complete and 0 interrupted iterations
default   [  17% ] 017/150 VUs  0m40.8s/4m00.0s

running (0m41.8s), 017/150 VUs, 487 complete and 0 interrupted iterations
default   [  17% ] 017/150 VUs  0m41.8s/4m00.0s

running (0m42.8s), 018/150 VUs, 514 complete and 0 interrupted iterations
default   [  18% ] 018/150 VUs  0m42.8s/4m00.0s

running (0m43.8s), 019/150 VUs, 543 complete and 0 interrupted iterations
default   [  18% ] 019/150 VUs  0m43.8s/4m00.0s

running (0m44.8s), 019/150 VUs, 575 complete and 0 interrupted iterations
default   [  19% ] 019/150 VUs  0m44.8s/4m00.0s

running (0m45.8s), 020/150 VUs, 604 complete and 0 interrupted iterations
default   [  19% ] 020/150 VUs  0m45.8s/4m00.0s

running (0m46.8s), 021/150 VUs, 639 complete and 0 interrupted iterations
default   [  20% ] 021/150 VUs  0m46.8s/4m00.0s

running (0m47.8s), 021/150 VUs, 673 complete and 0 interrupted iterations
default   [  20% ] 021/150 VUs  0m47.8s/4m00.0s

running (0m48.8s), 022/150 VUs, 707 complete and 0 interrupted iterations
default   [  20% ] 022/150 VUs  0m48.8s/4m00.0s

running (0m49.8s), 023/150 VUs, 744 complete and 0 interrupted iterations
default   [  21% ] 023/150 VUs  0m49.8s/4m00.0s

running (0m50.8s), 023/150 VUs, 780 complete and 0 interrupted iterations
default   [  21% ] 023/150 VUs  0m50.8s/4m00.0s

running (0m51.8s), 024/150 VUs, 819 complete and 0 interrupted iterations
default   [  22% ] 024/150 VUs  0m51.8s/4m00.0s

running (0m52.8s), 025/150 VUs, 855 complete and 0 interrupted iterations
default   [  22% ] 025/150 VUs  0m52.8s/4m00.0s

running (0m53.8s), 025/150 VUs, 895 complete and 0 interrupted iterations
default   [  22% ] 025/150 VUs  0m53.8s/4m00.0s

running (0m54.8s), 026/150 VUs, 938 complete and 0 interrupted iterations
default   [  23% ] 026/150 VUs  0m54.8s/4m00.0s

running (0m55.8s), 027/150 VUs, 979 complete and 0 interrupted iterations
default   [  23% ] 027/150 VUs  0m55.8s/4m00.0s

running (0m56.8s), 027/150 VUs, 1023 complete and 0 interrupted iterations
default   [  24% ] 027/150 VUs  0m56.8s/4m00.0s

running (0m57.8s), 028/150 VUs, 1066 complete and 0 interrupted iterations
default   [  24% ] 028/150 VUs  0m57.8s/4m00.0s

running (0m58.8s), 029/150 VUs, 1112 complete and 0 interrupted iterations
default   [  25% ] 029/150 VUs  0m58.8s/4m00.0s

running (0m59.8s), 029/150 VUs, 1159 complete and 0 interrupted iterations
default   [  25% ] 029/150 VUs  0m59.8s/4m00.0s

running (1m00.8s), 030/150 VUs, 1205 complete and 0 interrupted iterations
default   [  25% ] 030/150 VUs  1m00.8s/4m00.0s

running (1m01.8s), 031/150 VUs, 1254 complete and 0 interrupted iterations
default   [  26% ] 031/150 VUs  1m01.8s/4m00.0s

running (1m02.8s), 031/150 VUs, 1303 complete and 0 interrupted iterations
default   [  26% ] 031/150 VUs  1m02.8s/4m00.0s

running (1m03.8s), 032/150 VUs, 1355 complete and 0 interrupted iterations
default   [  27% ] 032/150 VUs  1m03.8s/4m00.0s

running (1m04.8s), 033/150 VUs, 1406 complete and 0 interrupted iterations
default   [  27% ] 033/150 VUs  1m04.8s/4m00.0s

running (1m05.8s), 033/150 VUs, 1457 complete and 0 interrupted iterations
default   [  27% ] 033/150 VUs  1m05.8s/4m00.0s

running (1m06.8s), 034/150 VUs, 1509 complete and 0 interrupted iterations
default   [  28% ] 034/150 VUs  1m06.8s/4m00.0s

running (1m07.8s), 035/150 VUs, 1565 complete and 0 interrupted iterations
default   [  28% ] 035/150 VUs  1m07.8s/4m00.0s

running (1m08.8s), 035/150 VUs, 1618 complete and 0 interrupted iterations
default   [  29% ] 035/150 VUs  1m08.8s/4m00.0s

running (1m09.8s), 036/150 VUs, 1677 complete and 0 interrupted iterations
default   [  29% ] 036/150 VUs  1m09.8s/4m00.0s

running (1m10.8s), 037/150 VUs, 1735 complete and 0 interrupted iterations
default   [  30% ] 037/150 VUs  1m10.8s/4m00.0s

running (1m11.8s), 037/150 VUs, 1794 complete and 0 interrupted iterations
default   [  30% ] 037/150 VUs  1m11.8s/4m00.0s

running (1m12.8s), 038/150 VUs, 1855 complete and 0 interrupted iterations
default   [  30% ] 038/150 VUs  1m12.8s/4m00.0s

running (1m13.8s), 039/150 VUs, 1912 complete and 0 interrupted iterations
default   [  31% ] 039/150 VUs  1m13.8s/4m00.0s

running (1m14.8s), 039/150 VUs, 1972 complete and 0 interrupted iterations
default   [  31% ] 039/150 VUs  1m14.8s/4m00.0s

running (1m15.8s), 040/150 VUs, 2035 complete and 0 interrupted iterations
default   [  32% ] 040/150 VUs  1m15.8s/4m00.0s

running (1m16.8s), 041/150 VUs, 2101 complete and 0 interrupted iterations
default   [  32% ] 041/150 VUs  1m16.8s/4m00.0s

running (1m17.8s), 041/150 VUs, 2164 complete and 0 interrupted iterations
default   [  32% ] 041/150 VUs  1m17.8s/4m00.0s

running (1m18.8s), 042/150 VUs, 2232 complete and 0 interrupted iterations
default   [  33% ] 042/150 VUs  1m18.8s/4m00.0s

running (1m19.8s), 043/150 VUs, 2296 complete and 0 interrupted iterations
default   [  33% ] 043/150 VUs  1m19.8s/4m00.0s

running (1m20.8s), 043/150 VUs, 2364 complete and 0 interrupted iterations
default   [  34% ] 043/150 VUs  1m20.8s/4m00.0s

running (1m21.8s), 044/150 VUs, 2434 complete and 0 interrupted iterations
default   [  34% ] 044/150 VUs  1m21.8s/4m00.0s

running (1m22.8s), 045/150 VUs, 2502 complete and 0 interrupted iterations
default   [  35% ] 045/150 VUs  1m22.8s/4m00.0s

running (1m23.8s), 045/150 VUs, 2579 complete and 0 interrupted iterations
default   [  35% ] 045/150 VUs  1m23.8s/4m00.0s

running (1m24.8s), 046/150 VUs, 2644 complete and 0 interrupted iterations
default   [  35% ] 046/150 VUs  1m24.8s/4m00.0s

running (1m25.8s), 047/150 VUs, 2716 complete and 0 interrupted iterations
default   [  36% ] 047/150 VUs  1m25.8s/4m00.0s

running (1m26.8s), 047/150 VUs, 2789 complete and 0 interrupted iterations
default   [  36% ] 047/150 VUs  1m26.8s/4m00.0s

running (1m27.8s), 048/150 VUs, 2864 complete and 0 interrupted iterations
default   [  37% ] 048/150 VUs  1m27.8s/4m00.0s

running (1m28.8s), 049/150 VUs, 2935 complete and 0 interrupted iterations
default   [  37% ] 049/150 VUs  1m28.8s/4m00.0s

running (1m29.8s), 049/150 VUs, 3007 complete and 0 interrupted iterations
default   [  37% ] 049/150 VUs  1m29.8s/4m00.0s

running (1m30.8s), 050/150 VUs, 3085 complete and 0 interrupted iterations
default   [  38% ] 050/150 VUs  1m30.8s/4m00.0s

running (1m31.8s), 051/150 VUs, 3163 complete and 0 interrupted iterations
default   [  38% ] 051/150 VUs  1m31.8s/4m00.0s

running (1m32.8s), 052/150 VUs, 3244 complete and 0 interrupted iterations
default   [  39% ] 052/150 VUs  1m32.8s/4m00.0s

running (1m33.8s), 053/150 VUs, 3320 complete and 0 interrupted iterations
default   [  39% ] 053/150 VUs  1m33.8s/4m00.0s

running (1m34.8s), 054/150 VUs, 3391 complete and 0 interrupted iterations
default   [  40% ] 054/150 VUs  1m34.8s/4m00.0s

running (1m35.8s), 054/150 VUs, 3468 complete and 0 interrupted iterations
default   [  40% ] 054/150 VUs  1m35.8s/4m00.0s

running (1m36.8s), 055/150 VUs, 3550 complete and 0 interrupted iterations
default   [  40% ] 055/150 VUs  1m36.8s/4m00.0s

running (1m37.8s), 056/150 VUs, 3618 complete and 0 interrupted iterations
default   [  41% ] 056/150 VUs  1m37.8s/4m00.0s

running (1m38.8s), 057/150 VUs, 3699 complete and 0 interrupted iterations
default   [  41% ] 057/150 VUs  1m38.8s/4m00.0s

running (1m39.8s), 058/150 VUs, 3787 complete and 0 interrupted iterations
default   [  42% ] 058/150 VUs  1m39.8s/4m00.0s

running (1m40.8s), 059/150 VUs, 3871 complete and 0 interrupted iterations
default   [  42% ] 059/150 VUs  1m40.8s/4m00.0s

running (1m41.8s), 059/150 VUs, 3963 complete and 0 interrupted iterations
default   [  42% ] 059/150 VUs  1m41.8s/4m00.0s

running (1m42.8s), 060/150 VUs, 4047 complete and 0 interrupted iterations
default   [  43% ] 060/150 VUs  1m42.8s/4m00.0s

running (1m43.8s), 061/150 VUs, 4127 complete and 0 interrupted iterations
default   [  43% ] 061/150 VUs  1m43.8s/4m00.0s

running (1m44.9s), 062/150 VUs, 4208 complete and 0 interrupted iterations
default   [  44% ] 062/150 VUs  1m44.8s/4m00.0s

running (1m45.9s), 063/150 VUs, 4298 complete and 0 interrupted iterations
default   [  44% ] 063/150 VUs  1m45.8s/4m00.0s

running (1m46.9s), 064/150 VUs, 4378 complete and 0 interrupted iterations
default   [  45% ] 064/150 VUs  1m46.8s/4m00.0s

running (1m47.9s), 064/150 VUs, 4464 complete and 0 interrupted iterations
default   [  45% ] 064/150 VUs  1m47.8s/4m00.0s

running (1m48.9s), 065/150 VUs, 4554 complete and 0 interrupted iterations
default   [  45% ] 065/150 VUs  1m48.8s/4m00.0s

running (1m49.9s), 066/150 VUs, 4644 complete and 0 interrupted iterations
default   [  46% ] 066/150 VUs  1m49.8s/4m00.0s

running (1m50.9s), 067/150 VUs, 4740 complete and 0 interrupted iterations
default   [  46% ] 067/150 VUs  1m50.8s/4m00.0s

running (1m51.9s), 068/150 VUs, 4804 complete and 0 interrupted iterations
default   [  47% ] 068/150 VUs  1m51.8s/4m00.0s

running (1m52.9s), 069/150 VUs, 4865 complete and 0 interrupted iterations
default   [  47% ] 069/150 VUs  1m52.8s/4m00.0s

running (1m53.9s), 069/150 VUs, 4953 complete and 0 interrupted iterations
default   [  47% ] 069/150 VUs  1m53.8s/4m00.0s

running (1m54.9s), 070/150 VUs, 5029 complete and 0 interrupted iterations
default   [  48% ] 070/150 VUs  1m54.8s/4m00.0s

running (1m55.9s), 071/150 VUs, 5107 complete and 0 interrupted iterations
default   [  48% ] 071/150 VUs  1m55.8s/4m00.0s

running (1m56.9s), 072/150 VUs, 5184 complete and 0 interrupted iterations
default   [  49% ] 072/150 VUs  1m56.8s/4m00.0s

running (1m57.9s), 073/150 VUs, 5265 complete and 0 interrupted iterations
default   [  49% ] 073/150 VUs  1m57.8s/4m00.0s

running (1m58.9s), 074/150 VUs, 5346 complete and 0 interrupted iterations
default   [  50% ] 074/150 VUs  1m58.8s/4m00.0s

running (1m59.9s), 074/150 VUs, 5430 complete and 0 interrupted iterations
default   [  50% ] 074/150 VUs  1m59.8s/4m00.0s

running (2m00.9s), 075/150 VUs, 5514 complete and 0 interrupted iterations
default   [  50% ] 075/150 VUs  2m00.8s/4m00.0s

running (2m01.9s), 076/150 VUs, 5615 complete and 0 interrupted iterations
default   [  51% ] 076/150 VUs  2m01.8s/4m00.0s

running (2m02.9s), 077/150 VUs, 5705 complete and 0 interrupted iterations
default   [  51% ] 077/150 VUs  2m02.8s/4m00.0s

running (2m03.9s), 078/150 VUs, 5792 complete and 0 interrupted iterations
default   [  52% ] 078/150 VUs  2m03.8s/4m00.0s

running (2m04.9s), 079/150 VUs, 5880 complete and 0 interrupted iterations
default   [  52% ] 079/150 VUs  2m04.8s/4m00.0s

running (2m05.9s), 079/150 VUs, 5968 complete and 0 interrupted iterations
default   [  52% ] 079/150 VUs  2m05.8s/4m00.0s

running (2m06.9s), 080/150 VUs, 6058 complete and 0 interrupted iterations
default   [  53% ] 080/150 VUs  2m06.8s/4m00.0s

running (2m07.9s), 081/150 VUs, 6148 complete and 0 interrupted iterations
default   [  53% ] 081/150 VUs  2m07.8s/4m00.0s

running (2m08.9s), 082/150 VUs, 6240 complete and 0 interrupted iterations
default   [  54% ] 082/150 VUs  2m08.8s/4m00.0s

running (2m09.9s), 083/150 VUs, 6330 complete and 0 interrupted iterations
default   [  54% ] 083/150 VUs  2m09.8s/4m00.0s

running (2m10.9s), 084/150 VUs, 6422 complete and 0 interrupted iterations
default   [  55% ] 084/150 VUs  2m10.8s/4m00.0s

running (2m11.9s), 084/150 VUs, 6512 complete and 0 interrupted iterations
default   [  55% ] 084/150 VUs  2m11.8s/4m00.0s

running (2m12.9s), 085/150 VUs, 6606 complete and 0 interrupted iterations
default   [  55% ] 085/150 VUs  2m12.8s/4m00.0s

running (2m13.9s), 086/150 VUs, 6698 complete and 0 interrupted iterations
default   [  56% ] 086/150 VUs  2m13.8s/4m00.0s

running (2m14.9s), 087/150 VUs, 6780 complete and 0 interrupted iterations
default   [  56% ] 087/150 VUs  2m14.8s/4m00.0s

running (2m15.9s), 088/150 VUs, 6869 complete and 0 interrupted iterations
default   [  57% ] 088/150 VUs  2m15.8s/4m00.0s

running (2m16.9s), 089/150 VUs, 6958 complete and 0 interrupted iterations
default   [  57% ] 089/150 VUs  2m16.8s/4m00.0s

running (2m17.9s), 089/150 VUs, 7041 complete and 0 interrupted iterations
default   [  57% ] 089/150 VUs  2m17.8s/4m00.0s

running (2m18.9s), 090/150 VUs, 7139 complete and 0 interrupted iterations
default   [  58% ] 090/150 VUs  2m18.8s/4m00.0s

running (2m19.9s), 091/150 VUs, 7226 complete and 0 interrupted iterations
default   [  58% ] 091/150 VUs  2m19.8s/4m00.0s

running (2m20.9s), 092/150 VUs, 7319 complete and 0 interrupted iterations
default   [  59% ] 092/150 VUs  2m20.8s/4m00.0s

running (2m21.9s), 093/150 VUs, 7404 complete and 0 interrupted iterations
default   [  59% ] 093/150 VUs  2m21.8s/4m00.0s

running (2m22.9s), 094/150 VUs, 7482 complete and 0 interrupted iterations
default   [  60% ] 094/150 VUs  2m22.8s/4m00.0s

running (2m23.9s), 094/150 VUs, 7578 complete and 0 interrupted iterations
default   [  60% ] 094/150 VUs  2m23.8s/4m00.0s

running (2m24.9s), 095/150 VUs, 7664 complete and 0 interrupted iterations
default   [  60% ] 095/150 VUs  2m24.8s/4m00.0s

running (2m25.9s), 096/150 VUs, 7753 complete and 0 interrupted iterations
default   [  61% ] 096/150 VUs  2m25.8s/4m00.0s

running (2m26.9s), 097/150 VUs, 7842 complete and 0 interrupted iterations
default   [  61% ] 097/150 VUs  2m26.8s/4m00.0s

running (2m27.9s), 098/150 VUs, 7926 complete and 0 interrupted iterations
default   [  62% ] 098/150 VUs  2m27.8s/4m00.0s

running (2m28.9s), 099/150 VUs, 8015 complete and 0 interrupted iterations
default   [  62% ] 099/150 VUs  2m28.8s/4m00.0s

running (2m29.9s), 099/150 VUs, 8085 complete and 0 interrupted iterations
default   [  62% ] 099/150 VUs  2m29.8s/4m00.0s

running (2m30.9s), 100/150 VUs, 8170 complete and 0 interrupted iterations
default   [  63% ] 100/150 VUs  2m30.8s/4m00.0s

running (2m31.9s), 101/150 VUs, 8253 complete and 0 interrupted iterations
default   [  63% ] 101/150 VUs  2m31.8s/4m00.0s

running (2m32.9s), 102/150 VUs, 8330 complete and 0 interrupted iterations
default   [  64% ] 102/150 VUs  2m32.8s/4m00.0s

running (2m33.9s), 103/150 VUs, 8408 complete and 0 interrupted iterations
default   [  64% ] 103/150 VUs  2m33.8s/4m00.0s

running (2m34.9s), 104/150 VUs, 8486 complete and 0 interrupted iterations
default   [  65% ] 104/150 VUs  2m34.8s/4m00.0s

running (2m35.9s), 104/150 VUs, 8558 complete and 0 interrupted iterations
default   [  65% ] 104/150 VUs  2m35.8s/4m00.0s

running (2m36.9s), 105/150 VUs, 8651 complete and 0 interrupted iterations
default   [  65% ] 105/150 VUs  2m36.8s/4m00.0s

running (2m37.9s), 106/150 VUs, 8694 complete and 0 interrupted iterations
default   [  66% ] 106/150 VUs  2m37.8s/4m00.0s

running (2m38.9s), 107/150 VUs, 8793 complete and 0 interrupted iterations
default   [  66% ] 107/150 VUs  2m38.8s/4m00.0s

running (2m39.9s), 108/150 VUs, 8879 complete and 0 interrupted iterations
default   [  67% ] 108/150 VUs  2m39.8s/4m00.0s

running (2m40.9s), 109/150 VUs, 8967 complete and 0 interrupted iterations
default   [  67% ] 109/150 VUs  2m40.8s/4m00.0s

running (2m41.9s), 109/150 VUs, 9060 complete and 0 interrupted iterations
default   [  67% ] 109/150 VUs  2m41.8s/4m00.0s

running (2m42.9s), 110/150 VUs, 9141 complete and 0 interrupted iterations
default   [  68% ] 110/150 VUs  2m42.8s/4m00.0s

running (2m43.9s), 111/150 VUs, 9234 complete and 0 interrupted iterations
default   [  68% ] 111/150 VUs  2m43.8s/4m00.0s

running (2m44.9s), 112/150 VUs, 9324 complete and 0 interrupted iterations
default   [  69% ] 112/150 VUs  2m44.8s/4m00.0s

running (2m45.9s), 113/150 VUs, 9403 complete and 0 interrupted iterations
default   [  69% ] 113/150 VUs  2m45.8s/4m00.0s

running (2m46.9s), 114/150 VUs, 9493 complete and 0 interrupted iterations
default   [  70% ] 114/150 VUs  2m46.8s/4m00.0s

running (2m47.9s), 114/150 VUs, 9570 complete and 0 interrupted iterations
default   [  70% ] 114/150 VUs  2m47.8s/4m00.0s

running (2m48.9s), 115/150 VUs, 9662 complete and 0 interrupted iterations
default   [  70% ] 115/150 VUs  2m48.8s/4m00.0s

running (2m49.9s), 116/150 VUs, 9740 complete and 0 interrupted iterations
default   [  71% ] 116/150 VUs  2m49.8s/4m00.0s

running (2m50.9s), 117/150 VUs, 9829 complete and 0 interrupted iterations
default   [  71% ] 117/150 VUs  2m50.8s/4m00.0s

running (2m51.9s), 118/150 VUs, 9921 complete and 0 interrupted iterations
default   [  72% ] 118/150 VUs  2m51.8s/4m00.0s

running (2m52.9s), 119/150 VUs, 10009 complete and 0 interrupted iterations
default   [  72% ] 119/150 VUs  2m52.8s/4m00.0s

running (2m53.9s), 119/150 VUs, 10087 complete and 0 interrupted iterations
default   [  72% ] 119/150 VUs  2m53.8s/4m00.0s

running (2m54.9s), 120/150 VUs, 10153 complete and 0 interrupted iterations
default   [  73% ] 120/150 VUs  2m54.8s/4m00.0s

running (2m55.9s), 121/150 VUs, 10214 complete and 0 interrupted iterations
default   [  73% ] 121/150 VUs  2m55.8s/4m00.0s

running (2m56.9s), 122/150 VUs, 10287 complete and 0 interrupted iterations
default   [  74% ] 122/150 VUs  2m56.8s/4m00.0s

running (2m57.9s), 123/150 VUs, 10371 complete and 0 interrupted iterations
default   [  74% ] 123/150 VUs  2m57.8s/4m00.0s

running (2m58.9s), 124/150 VUs, 10440 complete and 0 interrupted iterations
default   [  75% ] 124/150 VUs  2m58.8s/4m00.0s

running (2m59.9s), 124/150 VUs, 10496 complete and 0 interrupted iterations
default   [  75% ] 124/150 VUs  2m59.8s/4m00.0s

running (3m00.1s), 124/150 VUs, 10506 complete and 0 interrupted iterations
default   [  75% ] 124/150 VUs  3m00.0s/4m00.0s

running (3m00.9s), 125/150 VUs, 10533 complete and 0 interrupted iterations
default   [  75% ] 125/150 VUs  3m00.8s/4m00.0s

running (3m01.9s), 126/150 VUs, 10586 complete and 0 interrupted iterations
default   [  76% ] 126/150 VUs  3m01.8s/4m00.0s

running (3m02.9s), 127/150 VUs, 10634 complete and 0 interrupted iterations
default   [  76% ] 127/150 VUs  3m02.8s/4m00.0s

running (3m03.9s), 128/150 VUs, 10680 complete and 0 interrupted iterations
default   [  77% ] 128/150 VUs  3m03.8s/4m00.0s

running (3m04.9s), 129/150 VUs, 10728 complete and 0 interrupted iterations
default   [  77% ] 129/150 VUs  3m04.8s/4m00.0s

running (3m05.9s), 129/150 VUs, 10790 complete and 0 interrupted iterations
default   [  77% ] 129/150 VUs  3m05.8s/4m00.0s

running (3m06.9s), 130/150 VUs, 10855 complete and 0 interrupted iterations
default   [  78% ] 130/150 VUs  3m06.8s/4m00.0s

running (3m07.9s), 131/150 VUs, 10927 complete and 0 interrupted iterations
default   [  78% ] 131/150 VUs  3m07.8s/4m00.0s

running (3m08.9s), 132/150 VUs, 10987 complete and 0 interrupted iterations
default   [  79% ] 132/150 VUs  3m08.8s/4m00.0s

running (3m09.9s), 133/150 VUs, 11051 complete and 0 interrupted iterations
default   [  79% ] 133/150 VUs  3m09.8s/4m00.0s

running (3m10.9s), 134/150 VUs, 11122 complete and 0 interrupted iterations
default   [  80% ] 134/150 VUs  3m10.8s/4m00.0s

running (3m11.9s), 134/150 VUs, 11199 complete and 0 interrupted iterations
default   [  80% ] 134/150 VUs  3m11.8s/4m00.0s

running (3m12.9s), 135/150 VUs, 11281 complete and 0 interrupted iterations
default   [  80% ] 135/150 VUs  3m12.8s/4m00.0s

running (3m13.9s), 136/150 VUs, 11370 complete and 0 interrupted iterations
default   [  81% ] 136/150 VUs  3m13.8s/4m00.0s

running (3m14.9s), 137/150 VUs, 11456 complete and 0 interrupted iterations
default   [  81% ] 137/150 VUs  3m14.8s/4m00.0s

running (3m15.9s), 138/150 VUs, 11545 complete and 0 interrupted iterations
default   [  82% ] 138/150 VUs  3m15.8s/4m00.0s

running (3m16.9s), 139/150 VUs, 11643 complete and 0 interrupted iterations
default   [  82% ] 139/150 VUs  3m16.8s/4m00.0s

running (3m17.9s), 139/150 VUs, 11734 complete and 0 interrupted iterations
default   [  82% ] 139/150 VUs  3m17.8s/4m00.0s

running (3m18.9s), 140/150 VUs, 11826 complete and 0 interrupted iterations
default   [  83% ] 140/150 VUs  3m18.8s/4m00.0s

running (3m19.9s), 141/150 VUs, 11916 complete and 0 interrupted iterations
default   [  83% ] 141/150 VUs  3m19.8s/4m00.0s

running (3m20.9s), 142/150 VUs, 12013 complete and 0 interrupted iterations
default   [  84% ] 142/150 VUs  3m20.8s/4m00.0s

running (3m21.9s), 143/150 VUs, 12104 complete and 0 interrupted iterations
default   [  84% ] 143/150 VUs  3m21.8s/4m00.0s

running (3m22.9s), 144/150 VUs, 12194 complete and 0 interrupted iterations
default   [  85% ] 144/150 VUs  3m22.8s/4m00.0s

running (3m23.9s), 144/150 VUs, 12289 complete and 0 interrupted iterations
default   [  85% ] 144/150 VUs  3m23.8s/4m00.0s

running (3m24.9s), 145/150 VUs, 12377 complete and 0 interrupted iterations
default   [  85% ] 145/150 VUs  3m24.8s/4m00.0s

running (3m25.9s), 146/150 VUs, 12463 complete and 0 interrupted iterations
default   [  86% ] 146/150 VUs  3m25.8s/4m00.0s

running (3m26.9s), 147/150 VUs, 12555 complete and 0 interrupted iterations
default   [  86% ] 147/150 VUs  3m26.8s/4m00.0s

running (3m27.9s), 148/150 VUs, 12643 complete and 0 interrupted iterations
default   [  87% ] 148/150 VUs  3m27.8s/4m00.0s

running (3m28.9s), 149/150 VUs, 12729 complete and 0 interrupted iterations
default   [  87% ] 149/150 VUs  3m28.8s/4m00.0s

running (3m29.9s), 149/150 VUs, 12810 complete and 0 interrupted iterations
default   [  87% ] 149/150 VUs  3m29.8s/4m00.0s

running (3m30.9s), 149/150 VUs, 12889 complete and 0 interrupted iterations
default   [  88% ] 149/150 VUs  3m30.8s/4m00.0s

running (3m31.9s), 146/150 VUs, 12974 complete and 0 interrupted iterations
default   [  88% ] 146/150 VUs  3m31.8s/4m00.0s

running (3m32.9s), 141/150 VUs, 13057 complete and 0 interrupted iterations
default   [  89% ] 141/150 VUs  3m32.8s/4m00.0s

running (3m33.9s), 135/150 VUs, 13145 complete and 0 interrupted iterations
default   [  89% ] 135/150 VUs  3m33.8s/4m00.0s

running (3m34.9s), 131/150 VUs, 13227 complete and 0 interrupted iterations
default   [  90% ] 131/150 VUs  3m34.8s/4m00.0s

running (3m35.9s), 126/150 VUs, 13314 complete and 0 interrupted iterations
default   [  90% ] 126/150 VUs  3m35.8s/4m00.0s

running (3m36.9s), 119/150 VUs, 13410 complete and 0 interrupted iterations
default   [  90% ] 119/150 VUs  3m36.8s/4m00.0s

running (3m37.9s), 115/150 VUs, 13488 complete and 0 interrupted iterations
default   [  91% ] 115/150 VUs  3m37.8s/4m00.0s

running (3m38.9s), 112/150 VUs, 13578 complete and 0 interrupted iterations
default   [  91% ] 112/150 VUs  3m38.8s/4m00.0s

running (3m39.9s), 102/150 VUs, 13670 complete and 0 interrupted iterations
default   [  92% ] 102/150 VUs  3m39.8s/4m00.0s

running (3m40.9s), 100/150 VUs, 13766 complete and 0 interrupted iterations
default   [  92% ] 100/150 VUs  3m40.8s/4m00.0s

running (3m41.9s), 093/150 VUs, 13859 complete and 0 interrupted iterations
default   [  92% ] 093/150 VUs  3m41.8s/4m00.0s

running (3m42.9s), 089/150 VUs, 13948 complete and 0 interrupted iterations
default   [  93% ] 089/150 VUs  3m42.8s/4m00.0s

running (3m43.9s), 083/150 VUs, 14035 complete and 0 interrupted iterations
default   [  93% ] 083/150 VUs  3m43.8s/4m00.0s

running (3m44.9s), 079/150 VUs, 14130 complete and 0 interrupted iterations
default   [  94% ] 079/150 VUs  3m44.8s/4m00.0s

running (3m45.9s), 073/150 VUs, 14217 complete and 0 interrupted iterations
default   [  94% ] 073/150 VUs  3m45.8s/4m00.0s

running (3m46.9s), 069/150 VUs, 14310 complete and 0 interrupted iterations
default   [  95% ] 069/150 VUs  3m46.8s/4m00.0s

running (3m47.9s), 063/150 VUs, 14403 complete and 0 interrupted iterations
default   [  95% ] 063/150 VUs  3m47.8s/4m00.0s

running (3m48.9s), 059/150 VUs, 14492 complete and 0 interrupted iterations
default   [  95% ] 059/150 VUs  3m48.8s/4m00.0s

running (3m49.9s), 054/150 VUs, 14587 complete and 0 interrupted iterations
default   [  96% ] 054/150 VUs  3m49.8s/4m00.0s

running (3m50.9s), 049/150 VUs, 14668 complete and 0 interrupted iterations
default   [  96% ] 049/150 VUs  3m50.8s/4m00.0s

running (3m51.9s), 042/150 VUs, 14741 complete and 0 interrupted iterations
default   [  97% ] 042/150 VUs  3m51.8s/4m00.0s

running (3m52.9s), 037/150 VUs, 14803 complete and 0 interrupted iterations
default   [  97% ] 037/150 VUs  3m52.8s/4m00.0s

running (3m53.9s), 033/150 VUs, 14865 complete and 0 interrupted iterations
default   [  97% ] 033/150 VUs  3m53.8s/4m00.0s

running (3m54.9s), 029/150 VUs, 14914 complete and 0 interrupted iterations
default   [  98% ] 029/150 VUs  3m54.8s/4m00.0s

running (3m55.9s), 023/150 VUs, 14958 complete and 0 interrupted iterations
default   [  98% ] 023/150 VUs  3m55.8s/4m00.0s

running (3m56.9s), 018/150 VUs, 14988 complete and 0 interrupted iterations
default   [  99% ] 018/150 VUs  3m56.8s/4m00.0s

running (3m57.9s), 013/150 VUs, 15020 complete and 0 interrupted iterations
default   [  99% ] 013/150 VUs  3m57.8s/4m00.0s

running (3m58.9s), 009/150 VUs, 15038 complete and 0 interrupted iterations
default   [ 100% ] 009/150 VUs  3m58.8s/4m00.0s

running (3m59.9s), 003/150 VUs, 15050 complete and 0 interrupted iterations
default   [ 100% ] 003/150 VUs  3m59.8s/4m00.0s


  █ THRESHOLDS 

    http_req_duration
    ✗ 'p(95)<800' p(95)=1127.06ms
    ✗ 'p(99)<1500' p(99)=1619.68ms

    http_req_failed
    ✓ 'rate<0.05' rate=0.00%


  █ TOTAL RESULTS 

    checks_total.......: 30106   125.356596/s
    checks_succeeded...: 100.00% 30106 out of 30106
    checks_failed......: 0.00%   0 out of 30106

    ✓ a: status 200
    ✓ b: status 200

    HTTP
    http_req_duration..............: min=3.54ms   avg=287.31ms  med=111.05ms max=2339.12ms p(90)=957.23ms  p(95)=1127.06ms p(99)=1619.68ms
      { expected_response:true }...: min=3.54ms   avg=287.31ms  med=111.05ms max=2339.12ms p(90)=957.23ms  p(95)=1127.06ms p(99)=1619.68ms
    http_req_failed................: 0.00%  0 out of 30106
    http_reqs......................: 30106  125.356596/s

    EXECUTION
    iteration_duration.............: min=611.80ms avg=1075.64ms med=955.52ms max=3103.10ms p(90)=1680.00ms p(95)=1879.45ms p(99)=2552.58ms
    iterations.....................: 15053  62.678298/s
    vus............................: 3      min=1          max=149
    vus_max........................: 150    min=150        max=150

    NETWORK
    data_received..................: 9.3 MB 39 kB/s
    data_sent......................: 2.8 MB 12 kB/s




running (4m00.2s), 000/150 VUs, 15053 complete and 0 interrupted iterations
default ✓ [ 100% ] 000/150 VUs  4m0s
