
         /\      Grafana   /‾‾/  
    /\  /  \     |\  __   /  /   
   /  \/    \    | |/ /  /   ‾‾\ 
  /          \   |   (  |  (‾)  |
 / __________ \  |_|\_\  \_____/ 

     execution: local
        script: /home/edilberto/pspd/atividade-final-pspd/load/baseline.js
        output: json (/home/edilberto/pspd/atividade-final-pspd/results/baseline/metrics.json)

     scenarios: (100.00%) 1 scenario, 10 max VUs, 2m10s max duration (incl. graceful stop):
              * default: Up to 10 looping VUs for 1m40s over 3 stages (gracefulRampDown: 30s, gracefulStop: 30s)


running (0m01.0s), 01/10 VUs, 9 complete and 0 interrupted iterations
default   [   1% ] 01/10 VUs  0m01.0s/1m40.0s

running (0m02.0s), 01/10 VUs, 18 complete and 0 interrupted iterations
default   [   2% ] 01/10 VUs  0m02.0s/1m40.0s

running (0m01.3s), 01/10 VUs, 27 complete and 0 interrupted iterations
default   [   3% ] 01/10 VUs  0m03.0s/1m40.0s

running (0m02.3s), 02/10 VUs, 42 complete and 0 interrupted iterations
default   [   4% ] 02/10 VUs  0m04.0s/1m40.0s

running (0m03.3s), 02/10 VUs, 60 complete and 0 interrupted iterations
default   [   5% ] 02/10 VUs  0m05.0s/1m40.0s

running (0m04.3s), 02/10 VUs, 77 complete and 0 interrupted iterations
default   [   6% ] 02/10 VUs  0m06.0s/1m40.0s

running (0m05.3s), 03/10 VUs, 97 complete and 0 interrupted iterations
default   [   7% ] 03/10 VUs  0m07.0s/1m40.0s

running (0m06.3s), 03/10 VUs, 124 complete and 0 interrupted iterations
default   [   8% ] 03/10 VUs  0m08.0s/1m40.0s

running (0m07.3s), 03/10 VUs, 151 complete and 0 interrupted iterations
default   [   9% ] 03/10 VUs  0m09.0s/1m40.0s

running (0m08.3s), 03/10 VUs, 178 complete and 0 interrupted iterations
default   [  10% ] 03/10 VUs  0m10.0s/1m40.0s

running (0m09.3s), 04/10 VUs, 210 complete and 0 interrupted iterations
default   [  11% ] 04/10 VUs  0m11.0s/1m40.0s

running (0m10.3s), 04/10 VUs, 241 complete and 0 interrupted iterations
default   [  12% ] 04/10 VUs  0m12.0s/1m40.0s

running (0m11.3s), 04/10 VUs, 255 complete and 0 interrupted iterations
default   [  13% ] 04/10 VUs  0m13.0s/1m40.0s

running (0m12.3s), 05/10 VUs, 293 complete and 0 interrupted iterations
default   [  14% ] 05/10 VUs  0m14.0s/1m40.0s

running (0m13.3s), 05/10 VUs, 338 complete and 0 interrupted iterations
default   [  15% ] 05/10 VUs  0m15.0s/1m40.0s

running (0m14.3s), 05/10 VUs, 378 complete and 0 interrupted iterations
default   [  16% ] 05/10 VUs  0m16.0s/1m40.0s

running (0m15.3s), 06/10 VUs, 417 complete and 0 interrupted iterations
default   [  17% ] 06/10 VUs  0m17.0s/1m40.0s

running (0m16.3s), 06/10 VUs, 465 complete and 0 interrupted iterations
default   [  18% ] 06/10 VUs  0m18.0s/1m40.0s

running (0m17.3s), 06/10 VUs, 510 complete and 0 interrupted iterations
default   [  19% ] 06/10 VUs  0m19.0s/1m40.0s

running (0m18.3s), 06/10 VUs, 564 complete and 0 interrupted iterations
default   [  20% ] 06/10 VUs  0m20.0s/1m40.0s

running (0m19.3s), 07/10 VUs, 626 complete and 0 interrupted iterations
default   [  21% ] 07/10 VUs  0m21.0s/1m40.0s

running (0m20.3s), 07/10 VUs, 684 complete and 0 interrupted iterations
default   [  22% ] 07/10 VUs  0m22.0s/1m40.0s

running (0m21.3s), 07/10 VUs, 744 complete and 0 interrupted iterations
default   [  23% ] 07/10 VUs  0m23.0s/1m40.0s

running (0m22.3s), 08/10 VUs, 797 complete and 0 interrupted iterations
default   [  24% ] 08/10 VUs  0m24.0s/1m40.0s

running (0m23.3s), 08/10 VUs, 865 complete and 0 interrupted iterations
default   [  25% ] 08/10 VUs  0m25.0s/1m40.0s

running (0m24.3s), 08/10 VUs, 923 complete and 0 interrupted iterations
default   [  26% ] 08/10 VUs  0m26.0s/1m40.0s

running (0m25.3s), 09/10 VUs, 996 complete and 0 interrupted iterations
default   [  27% ] 09/10 VUs  0m27.0s/1m40.0s

running (0m26.3s), 09/10 VUs, 1073 complete and 0 interrupted iterations
default   [  28% ] 09/10 VUs  0m28.0s/1m40.0s

running (0m27.3s), 09/10 VUs, 1154 complete and 0 interrupted iterations
default   [  29% ] 09/10 VUs  0m29.0s/1m40.0s

running (0m28.3s), 09/10 VUs, 1235 complete and 0 interrupted iterations
default   [  30% ] 09/10 VUs  0m30.0s/1m40.0s

running (0m29.3s), 10/10 VUs, 1320 complete and 0 interrupted iterations
default   [  31% ] 10/10 VUs  0m31.0s/1m40.0s

running (0m30.3s), 10/10 VUs, 1407 complete and 0 interrupted iterations
default   [  32% ] 10/10 VUs  0m32.0s/1m40.0s

running (0m29.6s), 10/10 VUs, 1498 complete and 0 interrupted iterations
default   [  33% ] 10/10 VUs  0m33.0s/1m40.0s

running (0m30.6s), 10/10 VUs, 1588 complete and 0 interrupted iterations
default   [  34% ] 10/10 VUs  0m34.0s/1m40.0s

running (0m31.6s), 10/10 VUs, 1674 complete and 0 interrupted iterations
default   [  35% ] 10/10 VUs  0m35.0s/1m40.0s

running (0m32.6s), 10/10 VUs, 1747 complete and 0 interrupted iterations
default   [  36% ] 10/10 VUs  0m36.0s/1m40.0s

running (0m33.6s), 10/10 VUs, 1817 complete and 0 interrupted iterations
default   [  37% ] 10/10 VUs  0m37.0s/1m40.0s

running (0m34.6s), 10/10 VUs, 1882 complete and 0 interrupted iterations
default   [  38% ] 10/10 VUs  0m38.0s/1m40.0s

running (0m35.6s), 10/10 VUs, 1943 complete and 0 interrupted iterations
default   [  39% ] 10/10 VUs  0m39.0s/1m40.0s

running (0m36.6s), 10/10 VUs, 2024 complete and 0 interrupted iterations
default   [  40% ] 10/10 VUs  0m40.0s/1m40.0s

running (0m37.6s), 10/10 VUs, 2104 complete and 0 interrupted iterations
default   [  41% ] 10/10 VUs  0m41.0s/1m40.0s

running (0m38.6s), 10/10 VUs, 2189 complete and 0 interrupted iterations
default   [  42% ] 10/10 VUs  0m42.0s/1m40.0s

running (0m39.6s), 10/10 VUs, 2279 complete and 0 interrupted iterations
default   [  43% ] 10/10 VUs  0m43.0s/1m40.0s

running (0m40.6s), 10/10 VUs, 2362 complete and 0 interrupted iterations
default   [  44% ] 10/10 VUs  0m44.0s/1m40.0s

running (0m41.6s), 10/10 VUs, 2449 complete and 0 interrupted iterations
default   [  45% ] 10/10 VUs  0m45.0s/1m40.0s

running (0m42.6s), 10/10 VUs, 2539 complete and 0 interrupted iterations
default   [  46% ] 10/10 VUs  0m46.0s/1m40.0s

running (0m43.6s), 10/10 VUs, 2629 complete and 0 interrupted iterations
default   [  47% ] 10/10 VUs  0m47.0s/1m40.0s

running (0m44.6s), 10/10 VUs, 2716 complete and 0 interrupted iterations
default   [  48% ] 10/10 VUs  0m48.0s/1m40.0s

running (0m45.6s), 10/10 VUs, 2799 complete and 0 interrupted iterations
default   [  49% ] 10/10 VUs  0m49.0s/1m40.0s

running (0m46.6s), 10/10 VUs, 2889 complete and 0 interrupted iterations
default   [  50% ] 10/10 VUs  0m50.0s/1m40.0s

running (0m47.6s), 10/10 VUs, 2977 complete and 0 interrupted iterations
default   [  51% ] 10/10 VUs  0m51.0s/1m40.0s

running (0m48.6s), 10/10 VUs, 3064 complete and 0 interrupted iterations
default   [  52% ] 10/10 VUs  0m52.0s/1m40.0s

running (0m49.6s), 10/10 VUs, 3152 complete and 0 interrupted iterations
default   [  53% ] 10/10 VUs  0m53.0s/1m40.0s

running (0m50.6s), 10/10 VUs, 3242 complete and 0 interrupted iterations
default   [  54% ] 10/10 VUs  0m54.0s/1m40.0s

running (0m51.6s), 10/10 VUs, 3329 complete and 0 interrupted iterations
default   [  55% ] 10/10 VUs  0m55.0s/1m40.0s

running (0m52.6s), 10/10 VUs, 3417 complete and 0 interrupted iterations
default   [  56% ] 10/10 VUs  0m56.0s/1m40.0s

running (0m53.6s), 10/10 VUs, 3507 complete and 0 interrupted iterations
default   [  57% ] 10/10 VUs  0m57.0s/1m40.0s

running (0m54.6s), 10/10 VUs, 3588 complete and 0 interrupted iterations
default   [  58% ] 10/10 VUs  0m58.0s/1m40.0s

running (0m55.6s), 10/10 VUs, 3671 complete and 0 interrupted iterations
default   [  59% ] 10/10 VUs  0m59.0s/1m40.0s

running (0m56.6s), 10/10 VUs, 3761 complete and 0 interrupted iterations
default   [  60% ] 10/10 VUs  1m00.0s/1m40.0s

running (0m57.6s), 10/10 VUs, 3852 complete and 0 interrupted iterations
default   [  61% ] 10/10 VUs  1m01.0s/1m40.0s

running (0m58.6s), 10/10 VUs, 3942 complete and 0 interrupted iterations
default   [  62% ] 10/10 VUs  1m02.0s/1m40.0s

running (0m57.8s), 10/10 VUs, 4032 complete and 0 interrupted iterations
default   [  63% ] 10/10 VUs  1m03.0s/1m40.0s

running (0m58.8s), 10/10 VUs, 4120 complete and 0 interrupted iterations
default   [  64% ] 10/10 VUs  1m04.0s/1m40.0s

running (0m59.8s), 10/10 VUs, 4208 complete and 0 interrupted iterations
default   [  65% ] 10/10 VUs  1m05.0s/1m40.0s

running (1m00.8s), 10/10 VUs, 4294 complete and 0 interrupted iterations
default   [  66% ] 10/10 VUs  1m06.0s/1m40.0s

running (1m01.8s), 10/10 VUs, 4381 complete and 0 interrupted iterations
default   [  67% ] 10/10 VUs  1m07.0s/1m40.0s

running (1m02.8s), 10/10 VUs, 4466 complete and 0 interrupted iterations
default   [  68% ] 10/10 VUs  1m08.0s/1m40.0s

running (1m03.8s), 10/10 VUs, 4550 complete and 0 interrupted iterations
default   [  69% ] 10/10 VUs  1m09.0s/1m40.0s

running (1m04.8s), 10/10 VUs, 4635 complete and 0 interrupted iterations
default   [  70% ] 10/10 VUs  1m10.0s/1m40.0s

running (1m05.8s), 10/10 VUs, 4723 complete and 0 interrupted iterations
default   [  71% ] 10/10 VUs  1m11.0s/1m40.0s

running (1m06.8s), 10/10 VUs, 4808 complete and 0 interrupted iterations
default   [  72% ] 10/10 VUs  1m12.0s/1m40.0s

running (1m07.8s), 10/10 VUs, 4898 complete and 0 interrupted iterations
default   [  73% ] 10/10 VUs  1m13.0s/1m40.0s

running (1m08.8s), 10/10 VUs, 4988 complete and 0 interrupted iterations
default   [  74% ] 10/10 VUs  1m14.0s/1m40.0s

running (1m09.8s), 10/10 VUs, 5075 complete and 0 interrupted iterations
default   [  75% ] 10/10 VUs  1m15.0s/1m40.0s

running (1m10.8s), 10/10 VUs, 5158 complete and 0 interrupted iterations
default   [  76% ] 10/10 VUs  1m16.0s/1m40.0s

running (1m11.8s), 10/10 VUs, 5249 complete and 0 interrupted iterations
default   [  77% ] 10/10 VUs  1m17.0s/1m40.0s

running (1m12.8s), 10/10 VUs, 5339 complete and 0 interrupted iterations
default   [  78% ] 10/10 VUs  1m18.0s/1m40.0s

running (1m13.8s), 10/10 VUs, 5427 complete and 0 interrupted iterations
default   [  79% ] 10/10 VUs  1m19.0s/1m40.0s

running (1m14.8s), 10/10 VUs, 5512 complete and 0 interrupted iterations
default   [  80% ] 10/10 VUs  1m20.0s/1m40.0s

running (1m15.8s), 10/10 VUs, 5591 complete and 0 interrupted iterations
default   [  81% ] 10/10 VUs  1m21.0s/1m40.0s

running (1m16.8s), 10/10 VUs, 5668 complete and 0 interrupted iterations
default   [  82% ] 10/10 VUs  1m22.0s/1m40.0s

running (1m17.8s), 10/10 VUs, 5746 complete and 0 interrupted iterations
default   [  83% ] 10/10 VUs  1m23.0s/1m40.0s

running (1m18.8s), 10/10 VUs, 5833 complete and 0 interrupted iterations
default   [  84% ] 10/10 VUs  1m24.0s/1m40.0s

running (1m19.8s), 10/10 VUs, 5921 complete and 0 interrupted iterations
default   [  85% ] 10/10 VUs  1m25.0s/1m40.0s

running (1m20.8s), 10/10 VUs, 6008 complete and 0 interrupted iterations
default   [  86% ] 10/10 VUs  1m26.0s/1m40.0s

running (1m21.8s), 10/10 VUs, 6087 complete and 0 interrupted iterations
default   [  87% ] 10/10 VUs  1m27.0s/1m40.0s

running (1m22.8s), 10/10 VUs, 6174 complete and 0 interrupted iterations
default   [  88% ] 10/10 VUs  1m28.0s/1m40.0s

running (1m23.8s), 10/10 VUs, 6264 complete and 0 interrupted iterations
default   [  89% ] 10/10 VUs  1m29.0s/1m40.0s

running (1m24.8s), 10/10 VUs, 6348 complete and 0 interrupted iterations
default   [  90% ] 10/10 VUs  1m30.0s/1m40.0s

running (1m25.8s), 10/10 VUs, 6432 complete and 0 interrupted iterations
default   [  91% ] 10/10 VUs  1m31.0s/1m40.0s

running (1m26.8s), 09/10 VUs, 6510 complete and 0 interrupted iterations
default   [  92% ] 09/10 VUs  1m32.0s/1m40.0s

running (1m26.1s), 08/10 VUs, 6583 complete and 0 interrupted iterations
default   [  93% ] 08/10 VUs  1m33.0s/1m40.0s

running (1m27.1s), 07/10 VUs, 6647 complete and 0 interrupted iterations
default   [  94% ] 07/10 VUs  1m34.0s/1m40.0s

running (1m28.1s), 06/10 VUs, 6703 complete and 0 interrupted iterations
default   [  95% ] 06/10 VUs  1m35.0s/1m40.0s

running (1m29.1s), 05/10 VUs, 6749 complete and 0 interrupted iterations
default   [  96% ] 05/10 VUs  1m36.0s/1m40.0s

running (1m30.1s), 04/10 VUs, 6783 complete and 0 interrupted iterations
default   [  97% ] 04/10 VUs  1m37.0s/1m40.0s

running (1m31.1s), 03/10 VUs, 6810 complete and 0 interrupted iterations
default   [  98% ] 03/10 VUs  1m38.0s/1m40.0s

running (1m32.1s), 02/10 VUs, 6828 complete and 0 interrupted iterations
default   [  99% ] 02/10 VUs  1m39.0s/1m40.0s

running (1m33.1s), 01/10 VUs, 6838 complete and 0 interrupted iterations
default   [ 100% ] 01/10 VUs  1m40.0s/1m40.0s


  █ THRESHOLDS 

    http_req_duration
    ✓ 'p(95)<500' p(95)=20.61ms
    ✓ 'p(99)<1000' p(99)=56.33ms

    http_req_failed
    ✓ 'rate<0.01' rate=0.00%


  █ TOTAL RESULTS 

    checks_total.......: 27356   293.576874/s
    checks_succeeded...: 100.00% 27356 out of 27356
    checks_failed......: 0.00%   0 out of 27356

    ✓ status is 200
    ✓ has message
    ✓ has values

    HTTP
    http_req_duration..............: avg=8.33ms   min=88.82µs  med=5.87ms max=495.52ms p(90)=12.24ms p(95)=20.61ms
      { expected_response:true }...: avg=8.33ms   min=88.82µs  med=5.87ms max=495.52ms p(90)=12.24ms p(95)=20.61ms
    http_req_failed................: 0.00%  0 out of 13678
    http_reqs......................: 13678  146.788437/s

    EXECUTION
    iteration_duration.............: avg=117.72ms min=106.72ms med=113ms  max=705.83ms p(90)=127.1ms p(95)=147.2ms
    iterations.....................: 6839   73.394218/s
    vus............................: 1      min=1          max=10
    vus_max........................: 10     min=10         max=10

    NETWORK
    data_received..................: 4.2 MB 45 kB/s
    data_sent......................: 1.2 MB 13 kB/s




running (1m33.2s), 00/10 VUs, 6839 complete and 0 interrupted iterations
default ✓ [ 100% ] 00/10 VUs  1m40s
