
         /\      Grafana   /‾‾/  
    /\  /  \     |\  __   /  /   
   /  \/    \    | |/ /  /   ‾‾\ 
  /          \   |   (  |  (‾)  |
 / __________ \  |_|\_\  \_____/ 

     execution: local
        script: /home/edilberto/pspd/atividade-final-pspd/load/ramp.js
        output: json (/home/edilberto/pspd/atividade-final-pspd/results/ramp.json)

     scenarios: (100.00%) 1 scenario, 150 max VUs, 4m30s max duration (incl. graceful stop):
              * default: Up to 150 looping VUs for 4m0s over 5 stages (gracefulRampDown: 30s, gracefulStop: 30s)


running (0m01.0s), 001/150 VUs, 1 complete and 0 interrupted iterations
default   [   0% ] 001/150 VUs  0m01.0s/4m00.0s

running (0m02.0s), 001/150 VUs, 3 complete and 0 interrupted iterations
default   [   1% ] 001/150 VUs  0m02.0s/4m00.0s

running (0m03.0s), 001/150 VUs, 4 complete and 0 interrupted iterations
default   [   1% ] 001/150 VUs  0m03.0s/4m00.0s

running (0m04.0s), 002/150 VUs, 7 complete and 0 interrupted iterations
default   [   2% ] 002/150 VUs  0m04.0s/4m00.0s

running (0m05.0s), 002/150 VUs, 10 complete and 0 interrupted iterations
default   [   2% ] 002/150 VUs  0m05.0s/4m00.0s

running (0m06.0s), 002/150 VUs, 13 complete and 0 interrupted iterations
default   [   2% ] 002/150 VUs  0m06.0s/4m00.0s

running (0m07.0s), 003/150 VUs, 16 complete and 0 interrupted iterations
default   [   3% ] 003/150 VUs  0m07.0s/4m00.0s

running (0m08.0s), 003/150 VUs, 21 complete and 0 interrupted iterations
default   [   3% ] 003/150 VUs  0m08.0s/4m00.0s

running (0m09.0s), 003/150 VUs, 26 complete and 0 interrupted iterations
default   [   4% ] 003/150 VUs  0m09.0s/4m00.0s

running (0m10.0s), 003/150 VUs, 31 complete and 0 interrupted iterations
default   [   4% ] 003/150 VUs  0m10.0s/4m00.0s

running (0m11.0s), 004/150 VUs, 36 complete and 0 interrupted iterations
default   [   5% ] 004/150 VUs  0m11.0s/4m00.0s

running (0m12.0s), 004/150 VUs, 43 complete and 0 interrupted iterations
default   [   5% ] 004/150 VUs  0m12.0s/4m00.0s

running (0m13.0s), 004/150 VUs, 49 complete and 0 interrupted iterations
default   [   5% ] 004/150 VUs  0m13.0s/4m00.0s

running (0m14.0s), 005/150 VUs, 57 complete and 0 interrupted iterations
default   [   6% ] 005/150 VUs  0m14.0s/4m00.0s

running (0m15.0s), 005/150 VUs, 65 complete and 0 interrupted iterations
default   [   6% ] 005/150 VUs  0m15.0s/4m00.0s

running (0m16.0s), 005/150 VUs, 73 complete and 0 interrupted iterations
default   [   7% ] 005/150 VUs  0m16.0s/4m00.0s

running (0m17.0s), 006/150 VUs, 81 complete and 0 interrupted iterations
default   [   7% ] 006/150 VUs  0m17.0s/4m00.0s

running (0m18.0s), 006/150 VUs, 91 complete and 0 interrupted iterations
default   [   7% ] 006/150 VUs  0m18.0s/4m00.0s

running (0m19.0s), 006/150 VUs, 100 complete and 0 interrupted iterations
default   [   8% ] 006/150 VUs  0m19.0s/4m00.0s

running (0m20.0s), 006/150 VUs, 111 complete and 0 interrupted iterations
default   [   8% ] 006/150 VUs  0m20.0s/4m00.0s

running (0m21.0s), 007/150 VUs, 122 complete and 0 interrupted iterations
default   [   9% ] 007/150 VUs  0m21.0s/4m00.0s

running (0m22.0s), 007/150 VUs, 133 complete and 0 interrupted iterations
default   [   9% ] 007/150 VUs  0m22.0s/4m00.0s

running (0m23.0s), 007/150 VUs, 144 complete and 0 interrupted iterations
default   [  10% ] 007/150 VUs  0m23.0s/4m00.0s

running (0m22.1s), 008/150 VUs, 156 complete and 0 interrupted iterations
default   [  10% ] 008/150 VUs  0m24.0s/4m00.0s

running (0m23.1s), 008/150 VUs, 169 complete and 0 interrupted iterations
default   [  10% ] 008/150 VUs  0m25.0s/4m00.0s

running (0m24.1s), 008/150 VUs, 183 complete and 0 interrupted iterations
default   [  11% ] 008/150 VUs  0m26.0s/4m00.0s

running (0m25.1s), 009/150 VUs, 195 complete and 0 interrupted iterations
default   [  11% ] 009/150 VUs  0m27.0s/4m00.0s

running (0m26.1s), 009/150 VUs, 211 complete and 0 interrupted iterations
default   [  12% ] 009/150 VUs  0m28.0s/4m00.0s

running (0m27.1s), 009/150 VUs, 225 complete and 0 interrupted iterations
default   [  12% ] 009/150 VUs  0m29.0s/4m00.0s

running (0m28.1s), 009/150 VUs, 239 complete and 0 interrupted iterations
default   [  12% ] 009/150 VUs  0m30.0s/4m00.0s

running (0m29.1s), 010/150 VUs, 255 complete and 0 interrupted iterations
default   [  13% ] 010/150 VUs  0m31.0s/4m00.0s

running (0m30.1s), 011/150 VUs, 271 complete and 0 interrupted iterations
default   [  13% ] 011/150 VUs  0m32.0s/4m00.0s

running (0m31.1s), 011/150 VUs, 290 complete and 0 interrupted iterations
default   [  14% ] 011/150 VUs  0m33.0s/4m00.0s

running (0m32.1s), 012/150 VUs, 309 complete and 0 interrupted iterations
default   [  14% ] 012/150 VUs  0m34.0s/4m00.0s

running (0m33.1s), 013/150 VUs, 329 complete and 0 interrupted iterations
default   [  15% ] 013/150 VUs  0m35.0s/4m00.0s

running (0m34.1s), 013/150 VUs, 350 complete and 0 interrupted iterations
default   [  15% ] 013/150 VUs  0m36.0s/4m00.0s

running (0m35.1s), 014/150 VUs, 372 complete and 0 interrupted iterations
default   [  15% ] 014/150 VUs  0m37.0s/4m00.0s

running (0m36.1s), 015/150 VUs, 395 complete and 0 interrupted iterations
default   [  16% ] 015/150 VUs  0m38.0s/4m00.0s

running (0m37.1s), 015/150 VUs, 420 complete and 0 interrupted iterations
default   [  16% ] 015/150 VUs  0m39.0s/4m00.0s

running (0m38.1s), 016/150 VUs, 446 complete and 0 interrupted iterations
default   [  17% ] 016/150 VUs  0m40.0s/4m00.0s

running (0m39.1s), 017/150 VUs, 471 complete and 0 interrupted iterations
default   [  17% ] 017/150 VUs  0m41.0s/4m00.0s

running (0m40.1s), 017/150 VUs, 499 complete and 0 interrupted iterations
default   [  17% ] 017/150 VUs  0m42.0s/4m00.0s

running (0m41.1s), 018/150 VUs, 528 complete and 0 interrupted iterations
default   [  18% ] 018/150 VUs  0m43.0s/4m00.0s

running (0m42.1s), 019/150 VUs, 557 complete and 0 interrupted iterations
default   [  18% ] 019/150 VUs  0m44.0s/4m00.0s

running (0m43.1s), 019/150 VUs, 588 complete and 0 interrupted iterations
default   [  19% ] 019/150 VUs  0m45.0s/4m00.0s

running (0m44.1s), 020/150 VUs, 621 complete and 0 interrupted iterations
default   [  19% ] 020/150 VUs  0m46.0s/4m00.0s

running (0m45.1s), 021/150 VUs, 653 complete and 0 interrupted iterations
default   [  20% ] 021/150 VUs  0m47.0s/4m00.0s

running (0m46.1s), 021/150 VUs, 685 complete and 0 interrupted iterations
default   [  20% ] 021/150 VUs  0m48.0s/4m00.0s

running (0m47.1s), 022/150 VUs, 723 complete and 0 interrupted iterations
default   [  20% ] 022/150 VUs  0m49.0s/4m00.0s

running (0m48.1s), 023/150 VUs, 759 complete and 0 interrupted iterations
default   [  21% ] 023/150 VUs  0m50.0s/4m00.0s

running (0m49.1s), 023/150 VUs, 796 complete and 0 interrupted iterations
default   [  21% ] 023/150 VUs  0m51.0s/4m00.0s

running (0m50.1s), 024/150 VUs, 834 complete and 0 interrupted iterations
default   [  22% ] 024/150 VUs  0m52.0s/4m00.0s

running (0m51.1s), 025/150 VUs, 874 complete and 0 interrupted iterations
default   [  22% ] 025/150 VUs  0m53.0s/4m00.0s

running (0m50.4s), 025/150 VUs, 915 complete and 0 interrupted iterations
default   [  22% ] 025/150 VUs  0m54.0s/4m00.0s

running (0m51.4s), 026/150 VUs, 957 complete and 0 interrupted iterations
default   [  23% ] 026/150 VUs  0m55.0s/4m00.0s

running (0m52.4s), 027/150 VUs, 999 complete and 0 interrupted iterations
default   [  23% ] 027/150 VUs  0m56.0s/4m00.0s

running (0m53.1s), 027/150 VUs, 1028 complete and 0 interrupted iterations
default   [  24% ] 027/150 VUs  0m56.6s/4m00.0s

running (0m53.4s), 027/150 VUs, 1043 complete and 0 interrupted iterations
default   [  24% ] 027/150 VUs  0m57.0s/4m00.0s

running (0m54.4s), 028/150 VUs, 1089 complete and 0 interrupted iterations
default   [  24% ] 028/150 VUs  0m58.0s/4m00.0s

running (0m55.4s), 029/150 VUs, 1134 complete and 0 interrupted iterations
default   [  25% ] 029/150 VUs  0m59.0s/4m00.0s

running (0m56.4s), 029/150 VUs, 1182 complete and 0 interrupted iterations
default   [  25% ] 029/150 VUs  1m00.0s/4m00.0s

running (0m57.4s), 030/150 VUs, 1231 complete and 0 interrupted iterations
default   [  25% ] 030/150 VUs  1m01.0s/4m00.0s

running (0m58.4s), 031/150 VUs, 1278 complete and 0 interrupted iterations
default   [  26% ] 031/150 VUs  1m02.0s/4m00.0s

running (0m59.4s), 031/150 VUs, 1326 complete and 0 interrupted iterations
default   [  26% ] 031/150 VUs  1m03.0s/4m00.0s

running (1m00.4s), 032/150 VUs, 1380 complete and 0 interrupted iterations
default   [  27% ] 032/150 VUs  1m04.0s/4m00.0s

running (1m01.4s), 033/150 VUs, 1432 complete and 0 interrupted iterations
default   [  27% ] 033/150 VUs  1m05.0s/4m00.0s

running (1m02.4s), 033/150 VUs, 1486 complete and 0 interrupted iterations
default   [  27% ] 033/150 VUs  1m06.0s/4m00.0s

running (1m03.4s), 034/150 VUs, 1541 complete and 0 interrupted iterations
default   [  28% ] 034/150 VUs  1m07.0s/4m00.0s

running (1m04.4s), 035/150 VUs, 1597 complete and 0 interrupted iterations
default   [  28% ] 035/150 VUs  1m08.0s/4m00.0s

running (1m05.4s), 035/150 VUs, 1652 complete and 0 interrupted iterations
default   [  29% ] 035/150 VUs  1m09.0s/4m00.0s

running (1m06.4s), 036/150 VUs, 1712 complete and 0 interrupted iterations
default   [  29% ] 036/150 VUs  1m10.0s/4m00.0s

running (1m07.4s), 037/150 VUs, 1770 complete and 0 interrupted iterations
default   [  30% ] 037/150 VUs  1m11.0s/4m00.0s

running (1m08.4s), 037/150 VUs, 1832 complete and 0 interrupted iterations
default   [  30% ] 037/150 VUs  1m12.0s/4m00.0s

running (1m09.4s), 038/150 VUs, 1891 complete and 0 interrupted iterations
default   [  30% ] 038/150 VUs  1m13.0s/4m00.0s

running (1m10.4s), 039/150 VUs, 1954 complete and 0 interrupted iterations
default   [  31% ] 039/150 VUs  1m14.0s/4m00.0s

running (1m11.4s), 039/150 VUs, 2018 complete and 0 interrupted iterations
default   [  31% ] 039/150 VUs  1m15.0s/4m00.0s

running (1m12.4s), 040/150 VUs, 2082 complete and 0 interrupted iterations
default   [  32% ] 040/150 VUs  1m16.0s/4m00.0s

running (1m13.4s), 041/150 VUs, 2145 complete and 0 interrupted iterations
default   [  32% ] 041/150 VUs  1m17.0s/4m00.0s

running (1m14.4s), 041/150 VUs, 2214 complete and 0 interrupted iterations
default   [  32% ] 041/150 VUs  1m18.0s/4m00.0s

running (1m15.2s), 042/150 VUs, 2263 complete and 0 interrupted iterations
default   [  33% ] 042/150 VUs  1m18.7s/4m00.0s

running (1m15.4s), 042/150 VUs, 2278 complete and 0 interrupted iterations
default   [  33% ] 042/150 VUs  1m19.0s/4m00.0s

running (1m16.4s), 043/150 VUs, 2347 complete and 0 interrupted iterations
default   [  33% ] 043/150 VUs  1m20.0s/4m00.0s

running (1m17.4s), 043/150 VUs, 2417 complete and 0 interrupted iterations
default   [  34% ] 043/150 VUs  1m21.0s/4m00.0s

running (1m18.4s), 044/150 VUs, 2485 complete and 0 interrupted iterations
default   [  34% ] 044/150 VUs  1m22.0s/4m00.0s

running (1m19.4s), 045/150 VUs, 2552 complete and 0 interrupted iterations
default   [  35% ] 045/150 VUs  1m23.0s/4m00.0s

running (1m18.5s), 045/150 VUs, 2628 complete and 0 interrupted iterations
default   [  35% ] 045/150 VUs  1m24.0s/4m00.0s

running (1m19.5s), 046/150 VUs, 2704 complete and 0 interrupted iterations
default   [  35% ] 046/150 VUs  1m25.0s/4m00.0s

running (1m20.5s), 047/150 VUs, 2777 complete and 0 interrupted iterations
default   [  36% ] 047/150 VUs  1m26.0s/4m00.0s

running (1m21.5s), 047/150 VUs, 2851 complete and 0 interrupted iterations
default   [  36% ] 047/150 VUs  1m27.0s/4m00.0s

running (1m22.5s), 048/150 VUs, 2926 complete and 0 interrupted iterations
default   [  37% ] 048/150 VUs  1m28.0s/4m00.0s

running (1m23.5s), 049/150 VUs, 3005 complete and 0 interrupted iterations
default   [  37% ] 049/150 VUs  1m29.0s/4m00.0s

running (1m24.5s), 049/150 VUs, 3084 complete and 0 interrupted iterations
default   [  37% ] 049/150 VUs  1m30.0s/4m00.0s

running (1m25.5s), 050/150 VUs, 3165 complete and 0 interrupted iterations
default   [  38% ] 050/150 VUs  1m31.0s/4m00.0s

running (1m26.5s), 051/150 VUs, 3245 complete and 0 interrupted iterations
default   [  38% ] 051/150 VUs  1m32.0s/4m00.0s

running (1m27.5s), 052/150 VUs, 3324 complete and 0 interrupted iterations
default   [  39% ] 052/150 VUs  1m33.0s/4m00.0s

running (1m28.5s), 053/150 VUs, 3408 complete and 0 interrupted iterations
default   [  39% ] 053/150 VUs  1m34.0s/4m00.0s

running (1m29.5s), 054/150 VUs, 3500 complete and 0 interrupted iterations
default   [  40% ] 054/150 VUs  1m35.0s/4m00.0s

running (1m30.5s), 054/150 VUs, 3585 complete and 0 interrupted iterations
default   [  40% ] 054/150 VUs  1m36.0s/4m00.0s

running (1m31.5s), 055/150 VUs, 3667 complete and 0 interrupted iterations
default   [  40% ] 055/150 VUs  1m37.0s/4m00.0s

running (1m32.5s), 056/150 VUs, 3757 complete and 0 interrupted iterations
default   [  41% ] 056/150 VUs  1m38.0s/4m00.0s

running (1m33.5s), 057/150 VUs, 3844 complete and 0 interrupted iterations
default   [  41% ] 057/150 VUs  1m39.0s/4m00.0s

running (1m34.5s), 058/150 VUs, 3935 complete and 0 interrupted iterations
default   [  42% ] 058/150 VUs  1m40.0s/4m00.0s

running (1m35.5s), 059/150 VUs, 4026 complete and 0 interrupted iterations
default   [  42% ] 059/150 VUs  1m41.0s/4m00.0s

running (1m36.5s), 059/150 VUs, 4116 complete and 0 interrupted iterations
default   [  42% ] 059/150 VUs  1m42.0s/4m00.0s

running (1m37.5s), 060/150 VUs, 4209 complete and 0 interrupted iterations
default   [  43% ] 060/150 VUs  1m43.0s/4m00.0s

running (1m38.5s), 061/150 VUs, 4298 complete and 0 interrupted iterations
default   [  43% ] 061/150 VUs  1m44.0s/4m00.0s

running (1m39.5s), 062/150 VUs, 4388 complete and 0 interrupted iterations
default   [  44% ] 062/150 VUs  1m45.0s/4m00.0s

running (1m40.5s), 063/150 VUs, 4482 complete and 0 interrupted iterations
default   [  44% ] 063/150 VUs  1m46.0s/4m00.0s

running (1m41.5s), 064/150 VUs, 4578 complete and 0 interrupted iterations
default   [  45% ] 064/150 VUs  1m47.0s/4m00.0s

running (1m42.5s), 064/150 VUs, 4668 complete and 0 interrupted iterations
default   [  45% ] 064/150 VUs  1m48.0s/4m00.0s

running (1m43.5s), 065/150 VUs, 4766 complete and 0 interrupted iterations
default   [  45% ] 065/150 VUs  1m49.0s/4m00.0s

running (1m44.5s), 066/150 VUs, 4858 complete and 0 interrupted iterations
default   [  46% ] 066/150 VUs  1m50.0s/4m00.0s

running (1m45.5s), 067/150 VUs, 4951 complete and 0 interrupted iterations
default   [  46% ] 067/150 VUs  1m51.0s/4m00.0s

running (1m46.5s), 068/150 VUs, 5047 complete and 0 interrupted iterations
default   [  47% ] 068/150 VUs  1m52.0s/4m00.0s

running (1m47.5s), 069/150 VUs, 5138 complete and 0 interrupted iterations
default   [  47% ] 069/150 VUs  1m53.0s/4m00.0s

running (1m46.7s), 069/150 VUs, 5229 complete and 0 interrupted iterations
default   [  47% ] 069/150 VUs  1m54.0s/4m00.0s

running (1m47.7s), 070/150 VUs, 5325 complete and 0 interrupted iterations
default   [  48% ] 070/150 VUs  1m55.0s/4m00.0s

running (1m48.7s), 071/150 VUs, 5418 complete and 0 interrupted iterations
default   [  48% ] 071/150 VUs  1m56.0s/4m00.0s

running (1m49.7s), 072/150 VUs, 5508 complete and 0 interrupted iterations
default   [  49% ] 072/150 VUs  1m57.0s/4m00.0s

running (1m50.7s), 073/150 VUs, 5600 complete and 0 interrupted iterations
default   [  49% ] 073/150 VUs  1m58.0s/4m00.0s

running (1m51.7s), 074/150 VUs, 5690 complete and 0 interrupted iterations
default   [  50% ] 074/150 VUs  1m59.0s/4m00.0s

running (1m52.7s), 074/150 VUs, 5780 complete and 0 interrupted iterations
default   [  50% ] 074/150 VUs  2m00.0s/4m00.0s

running (1m53.7s), 075/150 VUs, 5876 complete and 0 interrupted iterations
default   [  50% ] 075/150 VUs  2m01.0s/4m00.0s

running (1m54.7s), 076/150 VUs, 5970 complete and 0 interrupted iterations
default   [  51% ] 076/150 VUs  2m02.0s/4m00.0s

running (1m55.7s), 077/150 VUs, 6063 complete and 0 interrupted iterations
default   [  51% ] 077/150 VUs  2m03.0s/4m00.0s

running (1m56.7s), 078/150 VUs, 6150 complete and 0 interrupted iterations
default   [  52% ] 078/150 VUs  2m04.0s/4m00.0s

running (1m57.7s), 079/150 VUs, 6246 complete and 0 interrupted iterations
default   [  52% ] 079/150 VUs  2m05.0s/4m00.0s

running (1m58.7s), 079/150 VUs, 6340 complete and 0 interrupted iterations
default   [  52% ] 079/150 VUs  2m06.0s/4m00.0s

running (1m59.7s), 080/150 VUs, 6431 complete and 0 interrupted iterations
default   [  53% ] 080/150 VUs  2m07.0s/4m00.0s

running (2m00.7s), 081/150 VUs, 6526 complete and 0 interrupted iterations
default   [  53% ] 081/150 VUs  2m08.0s/4m00.0s

running (2m01.7s), 082/150 VUs, 6620 complete and 0 interrupted iterations
default   [  54% ] 082/150 VUs  2m09.0s/4m00.0s

running (2m02.7s), 083/150 VUs, 6712 complete and 0 interrupted iterations
default   [  54% ] 083/150 VUs  2m10.0s/4m00.0s

running (2m03.7s), 084/150 VUs, 6806 complete and 0 interrupted iterations
default   [  55% ] 084/150 VUs  2m11.0s/4m00.0s

running (2m04.7s), 084/150 VUs, 6900 complete and 0 interrupted iterations
default   [  55% ] 084/150 VUs  2m12.0s/4m00.0s

running (2m05.7s), 085/150 VUs, 6992 complete and 0 interrupted iterations
default   [  55% ] 085/150 VUs  2m13.0s/4m00.0s

running (2m06.7s), 086/150 VUs, 7083 complete and 0 interrupted iterations
default   [  56% ] 086/150 VUs  2m14.0s/4m00.0s

running (2m07.7s), 087/150 VUs, 7179 complete and 0 interrupted iterations
default   [  56% ] 087/150 VUs  2m15.0s/4m00.0s

running (2m08.7s), 088/150 VUs, 7266 complete and 0 interrupted iterations
default   [  57% ] 088/150 VUs  2m16.0s/4m00.0s

running (2m09.7s), 089/150 VUs, 7359 complete and 0 interrupted iterations
default   [  57% ] 089/150 VUs  2m17.0s/4m00.0s

running (2m10.7s), 089/150 VUs, 7443 complete and 0 interrupted iterations
default   [  57% ] 089/150 VUs  2m18.0s/4m00.0s

running (2m11.7s), 090/150 VUs, 7535 complete and 0 interrupted iterations
default   [  58% ] 090/150 VUs  2m19.0s/4m00.0s

running (2m12.7s), 091/150 VUs, 7630 complete and 0 interrupted iterations
default   [  58% ] 091/150 VUs  2m20.0s/4m00.0s

running (2m13.7s), 092/150 VUs, 7723 complete and 0 interrupted iterations
default   [  59% ] 092/150 VUs  2m21.0s/4m00.0s

running (2m14.7s), 093/150 VUs, 7815 complete and 0 interrupted iterations
default   [  59% ] 093/150 VUs  2m22.0s/4m00.0s

running (2m15.7s), 094/150 VUs, 7910 complete and 0 interrupted iterations
default   [  60% ] 094/150 VUs  2m23.0s/4m00.0s

running (2m14.9s), 094/150 VUs, 8004 complete and 0 interrupted iterations
default   [  60% ] 094/150 VUs  2m24.0s/4m00.0s

running (2m15.9s), 095/150 VUs, 8094 complete and 0 interrupted iterations
default   [  60% ] 095/150 VUs  2m25.0s/4m00.0s

running (2m16.9s), 096/150 VUs, 8187 complete and 0 interrupted iterations
default   [  61% ] 096/150 VUs  2m26.0s/4m00.0s

running (2m17.9s), 097/150 VUs, 8274 complete and 0 interrupted iterations
default   [  61% ] 097/150 VUs  2m27.0s/4m00.0s

running (2m18.9s), 098/150 VUs, 8364 complete and 0 interrupted iterations
default   [  62% ] 098/150 VUs  2m28.0s/4m00.0s

running (2m19.9s), 099/150 VUs, 8436 complete and 0 interrupted iterations
default   [  62% ] 099/150 VUs  2m29.0s/4m00.0s

running (2m20.9s), 099/150 VUs, 8514 complete and 0 interrupted iterations
default   [  62% ] 099/150 VUs  2m30.0s/4m00.0s

running (2m21.9s), 100/150 VUs, 8574 complete and 0 interrupted iterations
default   [  63% ] 100/150 VUs  2m31.0s/4m00.0s

running (2m22.9s), 101/150 VUs, 8631 complete and 0 interrupted iterations
default   [  63% ] 101/150 VUs  2m32.0s/4m00.0s

running (2m23.9s), 102/150 VUs, 8688 complete and 0 interrupted iterations
default   [  64% ] 102/150 VUs  2m33.0s/4m00.0s

running (2m24.9s), 103/150 VUs, 8756 complete and 0 interrupted iterations
default   [  64% ] 103/150 VUs  2m34.0s/4m00.0s

running (2m25.9s), 104/150 VUs, 8825 complete and 0 interrupted iterations
default   [  65% ] 104/150 VUs  2m35.0s/4m00.0s

running (2m26.9s), 104/150 VUs, 8914 complete and 0 interrupted iterations
default   [  65% ] 104/150 VUs  2m36.0s/4m00.0s

running (2m27.9s), 105/150 VUs, 8980 complete and 0 interrupted iterations
default   [  65% ] 105/150 VUs  2m37.0s/4m00.0s

running (2m28.9s), 106/150 VUs, 9061 complete and 0 interrupted iterations
default   [  66% ] 106/150 VUs  2m38.0s/4m00.0s

running (2m29.9s), 107/150 VUs, 9145 complete and 0 interrupted iterations
default   [  66% ] 107/150 VUs  2m39.0s/4m00.0s

running (2m30.9s), 108/150 VUs, 9226 complete and 0 interrupted iterations
default   [  67% ] 108/150 VUs  2m40.0s/4m00.0s

running (2m31.9s), 109/150 VUs, 9308 complete and 0 interrupted iterations
default   [  67% ] 109/150 VUs  2m41.0s/4m00.0s

running (2m32.9s), 109/150 VUs, 9399 complete and 0 interrupted iterations
default   [  67% ] 109/150 VUs  2m42.0s/4m00.0s

running (2m33.9s), 110/150 VUs, 9489 complete and 0 interrupted iterations
default   [  68% ] 110/150 VUs  2m43.0s/4m00.0s

running (2m34.9s), 111/150 VUs, 9575 complete and 0 interrupted iterations
default   [  68% ] 111/150 VUs  2m44.0s/4m00.0s

running (2m35.9s), 112/150 VUs, 9661 complete and 0 interrupted iterations
default   [  69% ] 112/150 VUs  2m45.0s/4m00.0s

running (2m36.9s), 113/150 VUs, 9754 complete and 0 interrupted iterations
default   [  69% ] 113/150 VUs  2m46.0s/4m00.0s

running (2m37.9s), 114/150 VUs, 9847 complete and 0 interrupted iterations
default   [  70% ] 114/150 VUs  2m47.0s/4m00.0s

running (2m38.9s), 114/150 VUs, 9941 complete and 0 interrupted iterations
default   [  70% ] 114/150 VUs  2m48.0s/4m00.0s

running (2m39.9s), 115/150 VUs, 10034 complete and 0 interrupted iterations
default   [  70% ] 115/150 VUs  2m49.0s/4m00.0s

running (2m40.9s), 116/150 VUs, 10125 complete and 0 interrupted iterations
default   [  71% ] 116/150 VUs  2m50.0s/4m00.0s

running (2m41.9s), 117/150 VUs, 10221 complete and 0 interrupted iterations
default   [  71% ] 117/150 VUs  2m51.0s/4m00.0s

running (2m42.9s), 118/150 VUs, 10313 complete and 0 interrupted iterations
default   [  72% ] 118/150 VUs  2m52.0s/4m00.0s

running (2m43.9s), 119/150 VUs, 10406 complete and 0 interrupted iterations
default   [  72% ] 119/150 VUs  2m53.0s/4m00.0s

running (2m43.4s), 119/150 VUs, 10501 complete and 0 interrupted iterations
default   [  72% ] 119/150 VUs  2m54.0s/4m00.0s

running (2m44.4s), 120/150 VUs, 10595 complete and 0 interrupted iterations
default   [  73% ] 120/150 VUs  2m55.0s/4m00.0s

running (2m45.4s), 121/150 VUs, 10688 complete and 0 interrupted iterations
default   [  73% ] 121/150 VUs  2m56.0s/4m00.0s

running (2m46.4s), 122/150 VUs, 10782 complete and 0 interrupted iterations
default   [  74% ] 122/150 VUs  2m57.0s/4m00.0s

running (2m47.4s), 123/150 VUs, 10875 complete and 0 interrupted iterations
default   [  74% ] 123/150 VUs  2m58.0s/4m00.0s

running (2m48.4s), 124/150 VUs, 10966 complete and 0 interrupted iterations
default   [  75% ] 124/150 VUs  2m59.0s/4m00.0s

running (2m49.4s), 124/150 VUs, 11062 complete and 0 interrupted iterations
default   [  75% ] 124/150 VUs  3m00.0s/4m00.0s

running (2m50.4s), 125/150 VUs, 11148 complete and 0 interrupted iterations
default   [  75% ] 125/150 VUs  3m01.0s/4m00.0s

running (2m51.4s), 126/150 VUs, 11235 complete and 0 interrupted iterations
default   [  76% ] 126/150 VUs  3m02.0s/4m00.0s

running (2m52.4s), 127/150 VUs, 11326 complete and 0 interrupted iterations
default   [  76% ] 127/150 VUs  3m03.0s/4m00.0s

running (2m53.4s), 128/150 VUs, 11420 complete and 0 interrupted iterations
default   [  77% ] 128/150 VUs  3m04.0s/4m00.0s

running (2m54.4s), 129/150 VUs, 11511 complete and 0 interrupted iterations
default   [  77% ] 129/150 VUs  3m05.0s/4m00.0s

running (2m55.4s), 129/150 VUs, 11596 complete and 0 interrupted iterations
default   [  77% ] 129/150 VUs  3m06.0s/4m00.0s

running (2m56.4s), 130/150 VUs, 11679 complete and 0 interrupted iterations
default   [  78% ] 130/150 VUs  3m07.0s/4m00.0s

running (2m57.4s), 131/150 VUs, 11757 complete and 0 interrupted iterations
default   [  78% ] 131/150 VUs  3m08.0s/4m00.0s

running (2m58.4s), 132/150 VUs, 11840 complete and 0 interrupted iterations
default   [  79% ] 132/150 VUs  3m09.0s/4m00.0s

running (2m59.4s), 133/150 VUs, 11917 complete and 0 interrupted iterations
default   [  79% ] 133/150 VUs  3m10.0s/4m00.0s

running (3m00.4s), 134/150 VUs, 11979 complete and 0 interrupted iterations
default   [  80% ] 134/150 VUs  3m11.0s/4m00.0s

running (3m01.4s), 134/150 VUs, 12053 complete and 0 interrupted iterations
default   [  80% ] 134/150 VUs  3m12.0s/4m00.0s

running (3m02.4s), 135/150 VUs, 12130 complete and 0 interrupted iterations
default   [  80% ] 135/150 VUs  3m13.0s/4m00.0s

running (3m03.4s), 136/150 VUs, 12220 complete and 0 interrupted iterations
default   [  81% ] 136/150 VUs  3m14.0s/4m00.0s

running (3m04.4s), 137/150 VUs, 12310 complete and 0 interrupted iterations
default   [  81% ] 137/150 VUs  3m15.0s/4m00.0s

running (3m05.4s), 138/150 VUs, 12400 complete and 0 interrupted iterations
default   [  82% ] 138/150 VUs  3m16.0s/4m00.0s

running (3m06.4s), 139/150 VUs, 12490 complete and 0 interrupted iterations
default   [  82% ] 139/150 VUs  3m17.0s/4m00.0s

running (3m07.4s), 139/150 VUs, 12582 complete and 0 interrupted iterations
default   [  82% ] 139/150 VUs  3m18.0s/4m00.0s

running (3m08.4s), 140/150 VUs, 12675 complete and 0 interrupted iterations
default   [  83% ] 140/150 VUs  3m19.0s/4m00.0s

running (3m09.4s), 141/150 VUs, 12767 complete and 0 interrupted iterations
default   [  83% ] 141/150 VUs  3m20.0s/4m00.0s

running (3m10.4s), 142/150 VUs, 12861 complete and 0 interrupted iterations
default   [  84% ] 142/150 VUs  3m21.0s/4m00.0s

running (3m11.4s), 143/150 VUs, 12952 complete and 0 interrupted iterations
default   [  84% ] 143/150 VUs  3m22.0s/4m00.0s

running (3m12.4s), 144/150 VUs, 13045 complete and 0 interrupted iterations
default   [  85% ] 144/150 VUs  3m23.0s/4m00.0s

running (3m12.6s), 144/150 VUs, 13139 complete and 0 interrupted iterations
default   [  85% ] 144/150 VUs  3m24.0s/4m00.0s

running (3m12.5s), 145/150 VUs, 13226 complete and 0 interrupted iterations
default   [  85% ] 145/150 VUs  3m25.0s/4m00.0s

running (3m13.5s), 146/150 VUs, 13308 complete and 0 interrupted iterations
default   [  86% ] 146/150 VUs  3m26.0s/4m00.0s

running (3m14.5s), 147/150 VUs, 13404 complete and 0 interrupted iterations
default   [  86% ] 147/150 VUs  3m27.0s/4m00.0s

running (3m15.5s), 148/150 VUs, 13497 complete and 0 interrupted iterations
default   [  87% ] 148/150 VUs  3m28.0s/4m00.0s

running (3m16.5s), 149/150 VUs, 13588 complete and 0 interrupted iterations
default   [  87% ] 149/150 VUs  3m29.0s/4m00.0s

running (3m17.5s), 149/150 VUs, 13668 complete and 0 interrupted iterations
default   [  87% ] 149/150 VUs  3m30.0s/4m00.0s

running (3m18.5s), 149/150 VUs, 13758 complete and 0 interrupted iterations
default   [  88% ] 149/150 VUs  3m31.0s/4m00.0s

running (3m19.5s), 145/150 VUs, 13849 complete and 0 interrupted iterations
default   [  88% ] 145/150 VUs  3m32.0s/4m00.0s

running (3m20.5s), 139/150 VUs, 13945 complete and 0 interrupted iterations
default   [  89% ] 139/150 VUs  3m33.0s/4m00.0s

running (3m21.5s), 134/150 VUs, 14038 complete and 0 interrupted iterations
default   [  89% ] 134/150 VUs  3m34.0s/4m00.0s

running (3m22.5s), 129/150 VUs, 14131 complete and 0 interrupted iterations
default   [  90% ] 129/150 VUs  3m35.0s/4m00.0s

running (3m23.5s), 123/150 VUs, 14225 complete and 0 interrupted iterations
default   [  90% ] 123/150 VUs  3m36.0s/4m00.0s

running (3m24.5s), 118/150 VUs, 14318 complete and 0 interrupted iterations
default   [  90% ] 118/150 VUs  3m37.0s/4m00.0s

running (3m25.5s), 113/150 VUs, 14410 complete and 0 interrupted iterations
default   [  91% ] 113/150 VUs  3m38.0s/4m00.0s

running (3m26.5s), 110/150 VUs, 14508 complete and 0 interrupted iterations
default   [  91% ] 110/150 VUs  3m39.0s/4m00.0s

running (3m27.5s), 104/150 VUs, 14598 complete and 0 interrupted iterations
default   [  92% ] 104/150 VUs  3m40.0s/4m00.0s

running (3m28.5s), 099/150 VUs, 14693 complete and 0 interrupted iterations
default   [  92% ] 099/150 VUs  3m41.0s/4m00.0s

running (3m29.5s), 093/150 VUs, 14786 complete and 0 interrupted iterations
default   [  92% ] 093/150 VUs  3m42.0s/4m00.0s

running (3m30.5s), 088/150 VUs, 14878 complete and 0 interrupted iterations
default   [  93% ] 088/150 VUs  3m43.0s/4m00.0s

running (3m31.5s), 083/150 VUs, 14970 complete and 0 interrupted iterations
default   [  93% ] 083/150 VUs  3m44.0s/4m00.0s

running (3m32.5s), 077/150 VUs, 15066 complete and 0 interrupted iterations
default   [  94% ] 077/150 VUs  3m45.0s/4m00.0s

running (3m33.5s), 072/150 VUs, 15158 complete and 0 interrupted iterations
default   [  94% ] 072/150 VUs  3m46.0s/4m00.0s

running (3m34.5s), 067/150 VUs, 15248 complete and 0 interrupted iterations
default   [  95% ] 067/150 VUs  3m47.0s/4m00.0s

running (3m35.6s), 062/150 VUs, 15335 complete and 0 interrupted iterations
default   [  95% ] 062/150 VUs  3m48.0s/4m00.0s

running (3m36.5s), 059/150 VUs, 15392 complete and 0 interrupted iterations
default   [  95% ] 059/150 VUs  3m49.0s/4m00.0s

running (3m37.5s), 051/150 VUs, 15470 complete and 0 interrupted iterations
default   [  96% ] 051/150 VUs  3m50.0s/4m00.0s

running (3m38.5s), 048/150 VUs, 15537 complete and 0 interrupted iterations
default   [  96% ] 048/150 VUs  3m51.0s/4m00.0s

running (3m39.5s), 042/150 VUs, 15598 complete and 0 interrupted iterations
default   [  97% ] 042/150 VUs  3m52.0s/4m00.0s

running (3m40.5s), 038/150 VUs, 15664 complete and 0 interrupted iterations
default   [  97% ] 038/150 VUs  3m53.0s/4m00.0s

running (3m39.8s), 032/150 VUs, 15719 complete and 0 interrupted iterations
default   [  97% ] 032/150 VUs  3m54.0s/4m00.0s

running (3m40.8s), 027/150 VUs, 15771 complete and 0 interrupted iterations
default   [  98% ] 027/150 VUs  3m55.0s/4m00.0s

running (3m41.8s), 023/150 VUs, 15810 complete and 0 interrupted iterations
default   [  98% ] 023/150 VUs  3m56.0s/4m00.0s

running (3m42.8s), 017/150 VUs, 15849 complete and 0 interrupted iterations
default   [  99% ] 017/150 VUs  3m57.0s/4m00.0s

running (3m43.8s), 012/150 VUs, 15873 complete and 0 interrupted iterations
default   [  99% ] 012/150 VUs  3m58.0s/4m00.0s

running (3m44.8s), 007/150 VUs, 15889 complete and 0 interrupted iterations
default   [ 100% ] 007/150 VUs  3m59.0s/4m00.0s

running (3m45.8s), 003/150 VUs, 15899 complete and 0 interrupted iterations
default   [ 100% ] 003/150 VUs  4m00.0s/4m00.0s


  █ THRESHOLDS 

    http_req_duration
    ✗ 'p(95)<1000' p(95)=1.01s
    ✓ 'p(99)<2000' p(99)=1.19s

    http_req_failed
    ✓ 'rate<0.05' rate=0.00%


  █ TOTAL RESULTS 

    checks_total.......: 31804   140.646199/s
    checks_succeeded...: 100.00% 31804 out of 31804
    checks_failed......: 0.00%   0 out of 31804

    ✓ a: status 200
    ✓ b: status 200

    HTTP
    http_req_duration..............: avg=251.4ms min=40.92µs  med=107.24ms max=1.5s  p(90)=863.8ms p(95)=1.01s
      { expected_response:true }...: avg=251.4ms min=40.92µs  med=107.24ms max=1.5s  p(90)=863.8ms p(95)=1.01s
    http_req_failed................: 0.00%  0 out of 31804
    http_reqs......................: 31804  140.646199/s

    EXECUTION
    iteration_duration.............: avg=1.01s   min=608.47ms med=923.24ms max=2.08s p(90)=1.54s   p(95)=1.64s
    iterations.....................: 15902  70.3231/s
    vus............................: 3      min=1          max=149
    vus_max........................: 150    min=150        max=150

    NETWORK
    data_received..................: 9.9 MB 44 kB/s
    data_sent......................: 3.0 MB 13 kB/s




running (3m46.1s), 000/150 VUs, 15902 complete and 0 interrupted iterations
default ✓ [ 100% ] 000/150 VUs  4m0s
