
         /\      Grafana   /‾‾/  
    /\  /  \     |\  __   /  /   
   /  \/    \    | |/ /  /   ‾‾\ 
  /          \   |   (  |  (‾)  |
 / __________ \  |_|\_\  \_____/ 

     execution: local
        script: /home/edilberto/pspd/atividade-final-pspd/load/spike.js
        output: json (/home/edilberto/pspd/atividade-final-pspd/results/spike/metrics.json)

     scenarios: (100.00%) 1 scenario, 200 max VUs, 1m40s max duration (incl. graceful stop):
              * default: Up to 200 looping VUs for 1m10s over 5 stages (gracefulRampDown: 30s, gracefulStop: 30s)


running (0m01.0s), 001/200 VUs, 0 complete and 0 interrupted iterations
default   [   1% ] 001/200 VUs  0m01.0s/1m10.0s

running (0m02.0s), 002/200 VUs, 0 complete and 0 interrupted iterations
default   [   3% ] 002/200 VUs  0m02.0s/1m10.0s

running (0m03.0s), 003/200 VUs, 0 complete and 0 interrupted iterations
default   [   4% ] 003/200 VUs  0m03.0s/1m10.0s

running (0m04.0s), 004/200 VUs, 0 complete and 0 interrupted iterations
default   [   6% ] 004/200 VUs  0m04.0s/1m10.0s

running (0m05.0s), 005/200 VUs, 0 complete and 0 interrupted iterations
default   [   7% ] 005/200 VUs  0m05.0s/1m10.0s

running (0m06.0s), 006/200 VUs, 0 complete and 0 interrupted iterations
default   [   9% ] 006/200 VUs  0m06.0s/1m10.0s

running (0m07.0s), 007/200 VUs, 0 complete and 0 interrupted iterations
default   [  10% ] 007/200 VUs  0m07.0s/1m10.0s

running (0m08.0s), 008/200 VUs, 0 complete and 0 interrupted iterations
default   [  11% ] 008/200 VUs  0m08.0s/1m10.0s

running (0m09.0s), 009/200 VUs, 0 complete and 0 interrupted iterations
default   [  13% ] 009/200 VUs  0m09.0s/1m10.0s

running (0m10.0s), 009/200 VUs, 0 complete and 0 interrupted iterations
default   [  14% ] 009/200 VUs  0m10.0s/1m10.0s

running (0m11.0s), 028/200 VUs, 0 complete and 0 interrupted iterations
default   [  16% ] 028/200 VUs  0m11.0s/1m10.0s

running (0m12.0s), 047/200 VUs, 0 complete and 0 interrupted iterations
default   [  17% ] 047/200 VUs  0m12.0s/1m10.0s

running (0m13.0s), 066/200 VUs, 0 complete and 0 interrupted iterations
default   [  19% ] 066/200 VUs  0m13.0s/1m10.0s

running (0m14.0s), 085/200 VUs, 0 complete and 0 interrupted iterations
default   [  20% ] 085/200 VUs  0m14.0s/1m10.0s

running (0m15.0s), 104/200 VUs, 0 complete and 0 interrupted iterations
default   [  21% ] 104/200 VUs  0m15.0s/1m10.0s

running (0m16.0s), 123/200 VUs, 0 complete and 0 interrupted iterations
default   [  23% ] 123/200 VUs  0m16.0s/1m10.0s

running (0m17.0s), 142/200 VUs, 0 complete and 0 interrupted iterations
default   [  24% ] 142/200 VUs  0m17.0s/1m10.0s

running (0m18.0s), 161/200 VUs, 0 complete and 0 interrupted iterations
default   [  26% ] 161/200 VUs  0m18.0s/1m10.0s

running (0m19.0s), 180/200 VUs, 0 complete and 0 interrupted iterations
default   [  27% ] 180/200 VUs  0m19.0s/1m10.0s

running (0m20.0s), 199/200 VUs, 0 complete and 0 interrupted iterations
default   [  29% ] 199/200 VUs  0m20.0s/1m10.0s

running (0m21.0s), 200/200 VUs, 0 complete and 0 interrupted iterations
default   [  30% ] 200/200 VUs  0m21.0s/1m10.0s

running (0m22.0s), 200/200 VUs, 0 complete and 0 interrupted iterations
default   [  31% ] 200/200 VUs  0m22.0s/1m10.0s

running (0m23.0s), 200/200 VUs, 0 complete and 0 interrupted iterations
default   [  33% ] 200/200 VUs  0m23.0s/1m10.0s

running (0m24.0s), 200/200 VUs, 0 complete and 0 interrupted iterations
default   [  34% ] 200/200 VUs  0m24.0s/1m10.0s

running (0m25.0s), 200/200 VUs, 0 complete and 0 interrupted iterations
default   [  36% ] 200/200 VUs  0m25.0s/1m10.0s

running (0m26.0s), 200/200 VUs, 0 complete and 0 interrupted iterations
default   [  37% ] 200/200 VUs  0m26.0s/1m10.0s

running (0m27.0s), 200/200 VUs, 0 complete and 0 interrupted iterations
default   [  39% ] 200/200 VUs  0m27.0s/1m10.0s

running (0m28.0s), 200/200 VUs, 0 complete and 0 interrupted iterations
default   [  40% ] 200/200 VUs  0m28.0s/1m10.0s

running (0m29.0s), 200/200 VUs, 0 complete and 0 interrupted iterations
default   [  41% ] 200/200 VUs  0m29.0s/1m10.0s

running (0m30.0s), 200/200 VUs, 0 complete and 0 interrupted iterations
default   [  43% ] 200/200 VUs  0m30.0s/1m10.0s

running (0m31.0s), 200/200 VUs, 1 complete and 0 interrupted iterations
default   [  44% ] 200/200 VUs  0m31.0s/1m10.0s

running (0m32.0s), 200/200 VUs, 2 complete and 0 interrupted iterations
default   [  46% ] 200/200 VUs  0m32.0s/1m10.0s

running (0m33.0s), 200/200 VUs, 3 complete and 0 interrupted iterations
default   [  47% ] 200/200 VUs  0m33.0s/1m10.0s

running (0m34.0s), 200/200 VUs, 4 complete and 0 interrupted iterations
default   [  49% ] 200/200 VUs  0m34.0s/1m10.0s

running (0m35.0s), 200/200 VUs, 5 complete and 0 interrupted iterations
default   [  50% ] 200/200 VUs  0m35.0s/1m10.0s

running (0m36.0s), 200/200 VUs, 6 complete and 0 interrupted iterations
default   [  51% ] 200/200 VUs  0m36.0s/1m10.0s

running (0m37.0s), 200/200 VUs, 7 complete and 0 interrupted iterations
default   [  53% ] 200/200 VUs  0m37.0s/1m10.0s

running (0m38.0s), 200/200 VUs, 8 complete and 0 interrupted iterations
default   [  54% ] 200/200 VUs  0m38.0s/1m10.0s

running (0m39.0s), 200/200 VUs, 9 complete and 0 interrupted iterations
default   [  56% ] 200/200 VUs  0m39.0s/1m10.0s

running (0m40.0s), 200/200 VUs, 9 complete and 0 interrupted iterations
default   [  57% ] 200/200 VUs  0m40.0s/1m10.0s

running (0m41.0s), 200/200 VUs, 28 complete and 0 interrupted iterations
default   [  59% ] 200/200 VUs  0m41.0s/1m10.0s

running (0m42.0s), 200/200 VUs, 47 complete and 0 interrupted iterations
default   [  60% ] 200/200 VUs  0m42.0s/1m10.0s

running (0m43.0s), 200/200 VUs, 66 complete and 0 interrupted iterations
default   [  61% ] 200/200 VUs  0m43.0s/1m10.0s

running (0m44.0s), 200/200 VUs, 85 complete and 0 interrupted iterations
default   [  63% ] 200/200 VUs  0m44.0s/1m10.0s

running (0m45.0s), 200/200 VUs, 104 complete and 0 interrupted iterations
default   [  64% ] 200/200 VUs  0m45.0s/1m10.0s

running (0m46.0s), 200/200 VUs, 122 complete and 0 interrupted iterations
default   [  66% ] 200/200 VUs  0m46.0s/1m10.0s

running (0m47.0s), 200/200 VUs, 142 complete and 0 interrupted iterations
default   [  67% ] 200/200 VUs  0m47.0s/1m10.0s

running (0m48.0s), 200/200 VUs, 161 complete and 0 interrupted iterations
default   [  69% ] 200/200 VUs  0m48.0s/1m10.0s

running (0m49.0s), 200/200 VUs, 180 complete and 0 interrupted iterations
default   [  70% ] 200/200 VUs  0m49.0s/1m10.0s

running (0m50.0s), 200/200 VUs, 199 complete and 0 interrupted iterations
default   [  71% ] 200/200 VUs  0m50.0s/1m10.0s

running (0m51.0s), 200/200 VUs, 200 complete and 0 interrupted iterations
default   [  73% ] 200/200 VUs  0m51.0s/1m10.0s

running (0m52.0s), 200/200 VUs, 200 complete and 0 interrupted iterations
default   [  74% ] 200/200 VUs  0m52.0s/1m10.0s

running (0m53.0s), 200/200 VUs, 200 complete and 0 interrupted iterations
default   [  76% ] 200/200 VUs  0m53.0s/1m10.0s

running (0m54.0s), 200/200 VUs, 200 complete and 0 interrupted iterations
default   [  77% ] 200/200 VUs  0m54.0s/1m10.0s

running (0m55.0s), 200/200 VUs, 200 complete and 0 interrupted iterations
default   [  79% ] 200/200 VUs  0m55.0s/1m10.0s

running (0m56.0s), 200/200 VUs, 200 complete and 0 interrupted iterations
default   [  80% ] 200/200 VUs  0m56.0s/1m10.0s

running (0m57.0s), 200/200 VUs, 200 complete and 0 interrupted iterations
default   [  81% ] 200/200 VUs  0m57.0s/1m10.0s

running (0m58.0s), 200/200 VUs, 200 complete and 0 interrupted iterations
default   [  83% ] 200/200 VUs  0m58.0s/1m10.0s

running (0m59.0s), 200/200 VUs, 200 complete and 0 interrupted iterations
default   [  84% ] 200/200 VUs  0m59.0s/1m10.0s

running (1m00.0s), 200/200 VUs, 200 complete and 0 interrupted iterations
default   [  86% ] 200/200 VUs  1m00.0s/1m10.0s

running (1m01.0s), 200/200 VUs, 201 complete and 0 interrupted iterations
default   [  87% ] 200/200 VUs  1m01.0s/1m10.0s

running (1m02.0s), 200/200 VUs, 202 complete and 0 interrupted iterations
default   [  89% ] 200/200 VUs  1m02.0s/1m10.0s

running (1m03.0s), 200/200 VUs, 203 complete and 0 interrupted iterations
default   [  90% ] 200/200 VUs  1m03.0s/1m10.0s

running (1m04.0s), 200/200 VUs, 204 complete and 0 interrupted iterations
default   [  91% ] 200/200 VUs  1m04.0s/1m10.0s

running (1m05.0s), 200/200 VUs, 205 complete and 0 interrupted iterations
default   [  93% ] 200/200 VUs  1m05.0s/1m10.0s

running (1m06.0s), 199/200 VUs, 206 complete and 0 interrupted iterations
default   [  94% ] 199/200 VUs  1m06.0s/1m10.0s

running (1m07.0s), 198/200 VUs, 207 complete and 0 interrupted iterations
default   [  96% ] 198/200 VUs  1m07.0s/1m10.0s

running (1m08.0s), 197/200 VUs, 208 complete and 0 interrupted iterations
default   [  97% ] 197/200 VUs  1m08.0s/1m10.0s

running (1m09.0s), 196/200 VUs, 209 complete and 0 interrupted iterations
default   [  99% ] 196/200 VUs  1m09.0s/1m10.0s

running (1m10.0s), 196/200 VUs, 209 complete and 0 interrupted iterations
default   [ 100% ] 196/200 VUs  1m10.0s/1m10.0s

running (1m11.0s), 177/200 VUs, 228 complete and 0 interrupted iterations
default ↓ [ 100% ] 196/200 VUs  1m10s

running (1m12.0s), 158/200 VUs, 247 complete and 0 interrupted iterations
default ↓ [ 100% ] 196/200 VUs  1m10s

running (1m13.0s), 139/200 VUs, 266 complete and 0 interrupted iterations
default ↓ [ 100% ] 196/200 VUs  1m10s

running (1m14.0s), 120/200 VUs, 285 complete and 0 interrupted iterations
default ↓ [ 100% ] 196/200 VUs  1m10s

running (1m15.0s), 101/200 VUs, 304 complete and 0 interrupted iterations
default ↓ [ 100% ] 196/200 VUs  1m10s

running (1m16.0s), 083/200 VUs, 322 complete and 0 interrupted iterations
default ↓ [ 100% ] 196/200 VUs  1m10s

running (1m17.0s), 063/200 VUs, 342 complete and 0 interrupted iterations
default ↓ [ 100% ] 196/200 VUs  1m10s

running (1m18.0s), 044/200 VUs, 361 complete and 0 interrupted iterations
default ↓ [ 100% ] 196/200 VUs  1m10s

running (1m19.0s), 025/200 VUs, 380 complete and 0 interrupted iterations
default ↓ [ 100% ] 196/200 VUs  1m10s

running (1m20.0s), 006/200 VUs, 399 complete and 0 interrupted iterations
default ↓ [ 100% ] 196/200 VUs  1m10s

running (1m21.0s), 005/200 VUs, 400 complete and 0 interrupted iterations
default ↓ [ 100% ] 196/200 VUs  1m10s

running (1m22.0s), 005/200 VUs, 400 complete and 0 interrupted iterations
default ↓ [ 100% ] 196/200 VUs  1m10s

running (1m23.0s), 005/200 VUs, 400 complete and 0 interrupted iterations
default ↓ [ 100% ] 196/200 VUs  1m10s

running (1m24.0s), 005/200 VUs, 400 complete and 0 interrupted iterations
default ↓ [ 100% ] 196/200 VUs  1m10s

running (1m25.0s), 005/200 VUs, 400 complete and 0 interrupted iterations
default ↓ [ 100% ] 196/200 VUs  1m10s

running (1m26.0s), 005/200 VUs, 400 complete and 0 interrupted iterations
default ↓ [ 100% ] 196/200 VUs  1m10s

running (1m27.0s), 005/200 VUs, 400 complete and 0 interrupted iterations
default ↓ [ 100% ] 196/200 VUs  1m10s

running (1m28.0s), 005/200 VUs, 400 complete and 0 interrupted iterations
default ↓ [ 100% ] 196/200 VUs  1m10s

running (1m29.0s), 005/200 VUs, 400 complete and 0 interrupted iterations
default ↓ [ 100% ] 196/200 VUs  1m10s

running (1m30.0s), 005/200 VUs, 400 complete and 0 interrupted iterations
default ↓ [ 100% ] 196/200 VUs  1m10s

running (1m31.0s), 004/200 VUs, 401 complete and 0 interrupted iterations
default ↓ [ 100% ] 196/200 VUs  1m10s

running (1m32.0s), 003/200 VUs, 402 complete and 0 interrupted iterations
default ↓ [ 100% ] 196/200 VUs  1m10s

running (1m33.0s), 002/200 VUs, 403 complete and 0 interrupted iterations
default ↓ [ 100% ] 196/200 VUs  1m10s

running (1m34.0s), 001/200 VUs, 404 complete and 0 interrupted iterations
default ↓ [ 100% ] 196/200 VUs  1m10s


  █ THRESHOLDS 

    http_req_duration
    ✗ 'p(95)<2000' p(95)=30.01s

    http_req_failed
    ✗ 'rate<0.1' rate=100.00%


  █ TOTAL RESULTS 

    HTTP
    http_req_duration....: avg=30.01s min=30s med=30.01s max=30.01s p(90)=30.01s p(95)=30.01s
    http_req_failed......: 100.00% 810 out of 810
    http_reqs............: 810     8.571961/s

    EXECUTION
    iteration_duration...: avg=30s    min=30s med=30s    max=30.02s p(90)=30s    p(95)=30s   
    iterations...........: 405     4.28598/s
    vus..................: 1       min=1          max=200
    vus_max..............: 200     min=200        max=200

    NETWORK
    data_received........: 0 B     0 B/s
    data_sent............: 72 kB   761 B/s




running (1m34.5s), 000/200 VUs, 405 complete and 0 interrupted iterations
default ✓ [ 100% ] 000/200 VUs  1m10s
